Index;Text;Cause;Effect;Offset_Sentence2;Offset_Sentence3;Cause_Start;Cause_End;Effect_Start;Effect_End;Sentence
0257.00052.1;GMV contributions from marketplaces in the first half of the year was 62% versus 51% for the same period last year, sorry GMV contribution from marketplaces was 63% this year. The increase is primarily from adding quality merchants to our B2C merchants marketplace because of the declining sales volume, our cost of revenue decreased to $23 million and our gross profit decreased to $8 million. The decline in both our gross profit and gross profit margin were primarily because we worked on clearing out all inventory to recover cash and increased staff provisioning.;The increase is primarily from adding quality merchants to our B2C merchants marketplace because of the declining sales volume, our cost of revenue decreased to $23 million and our gross profit decreased to $8 million.;GMV contributions from marketplaces in the first half of the year was 62% versus 51% for the same period last year, sorry GMV contribution from marketplaces was 63% this year.;175.0;394.0;176;394;0;175;<e2>GMV contributions from marketplaces in the first half of the year was 62% versus 51% for the same period last year, sorry GMV contribution from marketplaces was 63% this year.</e2> <e1>The increase is primarily from adding quality merchants to our B2C merchants marketplace because of the declining sales volume, our cost of revenue decreased to $23 million and our gross profit decreased to $8 million.</e1> The decline in both our gross profit and gross profit margin were primarily because we worked on clearing out all inventory to recover cash and increased staff provisioning.
0257.00052.2;GMV contributions from marketplaces in the first half of the year was 62% versus 51% for the same period last year, sorry GMV contribution from marketplaces was 63% this year. The increase is primarily from adding quality merchants to our B2C merchants marketplace because of the declining sales volume, our cost of revenue decreased to $23 million and our gross profit decreased to $8 million. The decline in both our gross profit and gross profit margin were primarily because we worked on clearing out all inventory to recover cash and increased staff provisioning.;The decline in both our gross profit and gross profit margin were primarily because we worked on clearing out all inventory to recover cash and increased staff provisioning.;The increase is primarily from adding quality merchants to our B2C merchants marketplace because of the declining sales volume, our cost of revenue decreased to $23 million and our gross profit decreased to $8 million.;175.0;394.0;395;568;176;394;GMV contributions from marketplaces in the first half of the year was 62% versus 51% for the same period last year, sorry GMV contribution from marketplaces was 63% this year. <e2>The increase is primarily from adding quality merchants to our B2C merchants marketplace because of the declining sales volume, our cost of revenue decreased to $23 million and our gross profit decreased to $8 million.</e2> <e1>The decline in both our gross profit and gross profit margin were primarily because we worked on clearing out all inventory to recover cash and increased staff provisioning.</e1>
0257.00054;Marketing expenses decreased to $2 million mainly because we were able to reduce customer acquisition retargeting and branding its activities across all channels, and also lowered headcount.;we were able to reduce customer acquisition retargeting and branding its activities across all channels, and also lowered headcount.;Marketing expenses decreased to $2 million;;;58;190;0;42;<e2>Marketing expenses decreased to $2 million</e2> mainly because <e1>we were able to reduce customer acquisition retargeting and branding its activities across all channels, and also lowered headcount.</e1>
0265.00003;-  Ordinary shares of the combined company went through a 4:1 stock split, resulting in approximately 197 million ordinary shares outstanding.;-  Ordinary shares of the combined company went through a 4:1 stock split;approximately 197 million ordinary shares outstanding.;;;0;73;88;142;<e1>-  Ordinary shares of the combined company went through a 4:1 stock split</e1>, resulting in <e2>approximately 197 million ordinary shares outstanding.</e2>
0265.00008;Following the closing of the transaction, ordinary shares of the combined company have been consolidated through a 4:1 reverse stock split, resulting in approximately 197 million ordinary shares outstanding.;Following the closing of the transaction, ordinary shares of the combined company have been consolidated through a 4:1 reverse stock split;approximately 197 million ordinary shares outstanding.;;;0;138;153;207;<e1>Following the closing of the transaction, ordinary shares of the combined company have been consolidated through a 4:1 reverse stock split</e1>, resulting in <e2>approximately 197 million ordinary shares outstanding.</e2>
0267.00004;-  TCAP announced a dividend payment at ฿1.20/share, XD Oct. 3.   -  BCPG acquired 100% shares of Nam San 3A, aiming to fully operate hydro PP in Laos.;fully operate hydro PP in Laos.;-  TCAP announced a dividend payment at ฿1.20/share, XD Oct. 3.   -  BCPG acquired 100% shares of Nam San 3A;;;120;151;0;108;<e2>-  TCAP announced a dividend payment at ฿1.20/share, XD Oct. 3.   -  BCPG acquired 100% shares of Nam San 3A</e2>, aiming to <e1>fully operate hydro PP in Laos.</e1>
0270.00001;A key tax deadline is today.Here's how to make sure you don't botch it.Paying quarterly taxes?Sept.is the third deadline for the 2019 tax year.Get the Better newsletter.Got some side income?Run a business?You're facing a tax deadline today.Individuals who pay the Internal Revenue Service every quarter must make their third payment for 2019 by Sept.16.The other deadlines for this year are April 15, June 17 and Jan.15, 2020.or 100 percent of the liability from the prior year.If your adjusted gross income on that year's return exceeded $150,000, then you're on the hook for 110 percent of the tax liability.Though most 9-to-5 employees have these taxes withheld from each paycheck throughout the year, business owners and others who pay quarterly must hash out their estimated income and calculate what their tax load will be.When you calculate estimated tax, you come up for the estimate for the whole year and back out any withholding, said Lisa Featherngill, CPA and member of the American Institute of CPAs' personal financial planning committee.Then you want to make sure that three-quarters of what will be due is paid through September, she said.;A key tax deadline is today.Here's how to make sure you don't botch it.Paying quarterly taxes?Sept.is the third deadline for the 2019 tax year.Get the Better newsletter.Got some side income?Run a business?You're facing a tax deadline today.Individuals who pay the Internal Revenue Service every quarter must make their third payment for 2019 by Sept.16.The other deadlines for this year are April 15, June 17 and Jan.15, 2020.or 100 percent of the liability from the prior year.If your adjusted gross income on that year's return exceeded $150,000;you're on the hook for 110 percent of the tax liability.;;;0;547;554;610;<e1>A key tax deadline is today.Here's how to make sure you don't botch it.Paying quarterly taxes?Sept.is the third deadline for the 2019 tax year.Get the Better newsletter.Got some side income?Run a business?You're facing a tax deadline today.Individuals who pay the Internal Revenue Service every quarter must make their third payment for 2019 by Sept.16.The other deadlines for this year are April 15, June 17 and Jan.15, 2020.or 100 percent of the liability from the prior year.If your adjusted gross income on that year's return exceeded $150,000</e1>, then <e2>you're on the hook for 110 percent of the tax liability.</e2>Though most 9-to-5 employees have these taxes withheld from each paycheck throughout the year, business owners and others who pay quarterly must hash out their estimated income and calculate what their tax load will be.When you calculate estimated tax, you come up for the estimate for the whole year and back out any withholding, said Lisa Featherngill, CPA and member of the American Institute of CPAs' personal financial planning committee.Then you want to make sure that three-quarters of what will be due is paid through September, she said.
0275.00004;We are pleased that MIDF Investment Bank and China Construction Bank Malaysia have come together to help us meet our biogas financing needs, enabling us to increase our contribution to MESTECC's Green Energy goal to generate 20% of the country's energy from renewable sources.;We are pleased that MIDF Investment Bank and China Construction Bank Malaysia have come together to help us meet our biogas financing needs;us to increase our contribution to MESTECC's Green Energy goal to generate 20% of the country's energy from renewable sources.;;;0;139;150;276;<e1>We are pleased that MIDF Investment Bank and China Construction Bank Malaysia have come together to help us meet our biogas financing needs</e1>, enabling <e2>us to increase our contribution to MESTECC's Green Energy goal to generate 20% of the country's energy from renewable sources.</e2>
0287.00010.1;Finally, in the sixth paragraph of Thursday's letter, Donaldson got around to announcing the trade-off that was the real news of the day: Funding this essential programming for impacted workers has required that we temporarily reallocate funding in the Rural Dividend Program. The first $5 million in the budget for the dividend program will be diverted to the aforementioned community grants. The remaining $20 million will help pay for retraining and other support for the displaced workers.;Finally, in the sixth paragraph of Thursday's letter, Donaldson got around to announcing the trade-off that was the real news of the day: Funding this essential programming for impacted workers has required that we temporarily reallocate funding in the Rural Dividend Program.;The first $5 million in the budget for the dividend program will be diverted to the aforementioned community grants.;276.0;393.0;0;276;277;393;<e1>Finally, in the sixth paragraph of Thursday's letter, Donaldson got around to announcing the trade-off that was the real news of the day: Funding this essential programming for impacted workers has required that we temporarily reallocate funding in the Rural Dividend Program.</e1> <e2>The first $5 million in the budget for the dividend program will be diverted to the aforementioned community grants.</e2> The remaining $20 million will help pay for retraining and other support for the displaced workers.
0287.00010.2;Finally, in the sixth paragraph of Thursday's letter, Donaldson got around to announcing the trade-off that was the real news of the day: Funding this essential programming for impacted workers has required that we temporarily reallocate funding in the Rural Dividend Program. The first $5 million in the budget for the dividend program will be diverted to the aforementioned community grants. The remaining $20 million will help pay for retraining and other support for the displaced workers.;Finally, in the sixth paragraph of Thursday's letter, Donaldson got around to announcing the trade-off that was the real news of the day: Funding this essential programming for impacted workers has required that we temporarily reallocate funding in the Rural Dividend Program.;The remaining $20 million will help pay for retraining and other support for the displaced workers.;276.0;393.0;0;276;394;493;<e1>Finally, in the sixth paragraph of Thursday's letter, Donaldson got around to announcing the trade-off that was the real news of the day: Funding this essential programming for impacted workers has required that we temporarily reallocate funding in the Rural Dividend Program.</e1> The first $5 million in the budget for the dividend program will be diverted to the aforementioned community grants. <e2>The remaining $20 million will help pay for retraining and other support for the displaced workers.</e2>
0288.00004;The stock increased 0.39% or $0.26 during the last trading session, reaching $68.89.;The stock increased 0.39% or $0.26 during the last trading session;reaching $68.89.;;;0;66;68;84;<e1>The stock increased 0.39% or $0.26 during the last trading session</e1>, <e2>reaching $68.89.</e2>
0298.00008.1;All three counties are asking for a 40 percent tax on all non-cigarette tobacco products and a $4 tax on each pack of cigarettes. The taxes would start in 2020, although Pitkin County's cigarette tax would start at $3.20 and increase by 10 cents a year until it reaches $4. These are measures that local public health experts would agree are good steps to help curb tobacco use among youths, and it would be easy to assume that they were initiated by concerned parents, but much of the push, as well as the mostly successful efforts to raise the tobacco purchase age to 21, has come from teens themselves.;These are measures that local public health experts would agree are good steps to help curb tobacco use among youths, and it would be easy to assume that they were initiated by concerned parents, but much of the push, as well as the mostly successful efforts to raise the tobacco purchase age to 21, has come from teens themselves.;All three counties are asking for a 40 percent tax on all non-cigarette tobacco products and a $4 tax on each pack of cigarettes.;129.0;273.0;274;605;0;129;<e2>All three counties are asking for a 40 percent tax on all non-cigarette tobacco products and a $4 tax on each pack of cigarettes.</e2> The taxes would start in 2020, although Pitkin County's cigarette tax would start at $3.20 and increase by 10 cents a year until it reaches $4. <e1>These are measures that local public health experts would agree are good steps to help curb tobacco use among youths, and it would be easy to assume that they were initiated by concerned parents, but much of the push, as well as the mostly successful efforts to raise the tobacco purchase age to 21, has come from teens themselves.</e1>
0298.00008.2;All three counties are asking for a 40 percent tax on all non-cigarette tobacco products and a $4 tax on each pack of cigarettes. The taxes would start in 2020, although Pitkin County's cigarette tax would start at $3.20 and increase by 10 cents a year until it reaches $4. These are measures that local public health experts would agree are good steps to help curb tobacco use among youths, and it would be easy to assume that they were initiated by concerned parents, but much of the push, as well as the mostly successful efforts to raise the tobacco purchase age to 21, has come from teens themselves.;These are measures that local public health experts would agree are good steps to help curb tobacco use among youths, and it would be easy to assume that they were initiated by concerned parents, but much of the push, as well as the mostly successful efforts to raise the tobacco purchase age to 21, has come from teens themselves.;The taxes would start in 2020, although Pitkin County's cigarette tax would start at $3.20 and increase by 10 cents a year until it reaches $4.;129.0;273.0;274;605;130;273;All three counties are asking for a 40 percent tax on all non-cigarette tobacco products and a $4 tax on each pack of cigarettes. <e2>The taxes would start in 2020, although Pitkin County's cigarette tax would start at $3.20 and increase by 10 cents a year until it reaches $4.</e2> <e1>These are measures that local public health experts would agree are good steps to help curb tobacco use among youths, and it would be easy to assume that they were initiated by concerned parents, but much of the push, as well as the mostly successful efforts to raise the tobacco purchase age to 21, has come from teens themselves.</e1>
0299.00001;By Manoj Kumar  PANAJI, India (Reuters)  -  India's government slashed corporate taxes on Friday, giving a surprise $20.5 billion break aimed at reviving private investment and lifting growth from a six-year low that has caused job losses and fueled discontent in the countryside.;reviving private investment and lifting growth from a six-year low that has caused job losses and fueled discontent in the countryside.;By Manoj Kumar  PANAJI, India (Reuters)  -  India's government slashed corporate taxes on Friday, giving a surprise $20.5 billion break;;;145;280;0;135;<e2>By Manoj Kumar  PANAJI, India (Reuters)  -  India's government slashed corporate taxes on Friday, giving a surprise $20.5 billion break</e2> aimed at <e1>reviving private investment and lifting growth from a six-year low that has caused job losses and fueled discontent in the countryside.</e1>
0299.00011;Indian shares surged more than 6% and were set for their best day in more than a decade after the government announced the tax cuts to revive flagging growth in Asia's third largest economy.;the government announced the tax cuts to revive flagging growth in Asia's third largest economy.;Indian shares surged more than 6% and were set for their best day in more than a decade;;;94;190;0;87;<e2>Indian shares surged more than 6% and were set for their best day in more than a decade</e2> after <e1>the government announced the tax cuts to revive flagging growth in Asia's third largest economy.</e1>
0302.00008;Benevolent AI, which is worth $2bn after a $115m funding round, is a minority shareholder in Adarga.;a $115m funding round, is a minority shareholder in Adarga.;Benevolent AI, which is worth $2bn;;;41;100;0;34;<e2>Benevolent AI, which is worth $2bn</e2> after <e1>a $115m funding round, is a minority shareholder in Adarga.</e1>
0305.00007;Parametric Portfolio Associates LLC raised its position in BlackRock Enhanced Global Dividend Trust by 21.4% in the 1st quarter. Parametric Portfolio Associates LLC now owns 1,321,909 shares of the financial services provider's stock valued at $14,144,000 after buying an additional 233,071 shares during the last quarter.;Parametric Portfolio Associates LLC raised its position in BlackRock Enhanced Global Dividend Trust by 21.4% in the 1st quarter.;Parametric Portfolio Associates LLC now owns 1,321,909 shares of the financial services provider's stock valued at $14,144,000 after buying an additional 233,071 shares during the last quarter.;128.0;;0;128;129;322;<e1>Parametric Portfolio Associates LLC raised its position in BlackRock Enhanced Global Dividend Trust by 21.4% in the 1st quarter.</e1> <e2>Parametric Portfolio Associates LLC now owns 1,321,909 shares of the financial services provider's stock valued at $14,144,000 after buying an additional 233,071 shares during the last quarter.</e2>
0305.00013.1;The business also recently declared a monthly dividend, which will be paid on Monday, September 30th. Shareholders of record on Monday, September 16th will be paid a $0.063 dividend. The ex-dividend date is Friday, September 13th. This represents a $0.76 dividend on an annualized basis and a yield of 7.28%.;The business also recently declared a monthly dividend, which will be paid on Monday, September 30th.;Shareholders of record on Monday, September 16th will be paid a $0.063 dividend.;101.0;182.0;0;101;102;182;<e1>The business also recently declared a monthly dividend, which will be paid on Monday, September 30th.</e1> <e2>Shareholders of record on Monday, September 16th will be paid a $0.063 dividend.</e2> The ex-dividend date is Friday, September 13th. This represents a $0.76 dividend on an annualized basis and a yield of 7.28%.
0305.00013.2;The business also recently declared a monthly dividend, which will be paid on Monday, September 30th. Shareholders of record on Monday, September 16th will be paid a $0.063 dividend. The ex-dividend date is Friday, September 13th. This represents a $0.76 dividend on an annualized basis and a yield of 7.28%.;The business also recently declared a monthly dividend, which will be paid on Monday, September 30th.;This represents a $0.76 dividend on an annualized basis and a yield of 7.28%.;101.0;182.0;0;101;231;308;<e1>The business also recently declared a monthly dividend, which will be paid on Monday, September 30th.</e1> Shareholders of record on Monday, September 16th will be paid a $0.063 dividend. The ex-dividend date is Friday, September 13th. <e2>This represents a $0.76 dividend on an annualized basis and a yield of 7.28%.</e2>
0309.00004;Shares of NYSEARCA:OEF traded down $1.84 during trading on Tuesday, reaching $130.81.;Shares of NYSEARCA:OEF traded down $1.84 during trading on Tuesday;reaching $130.81.;;;0;66;68;85;<e1>Shares of NYSEARCA:OEF traded down $1.84 during trading on Tuesday</e1>, <e2>reaching $130.81.</e2>
0310.00001.1;Materials Select Sector SPDR Fund (NYSEARCA:XLB) Plans  -  Dividend of $0.29 . Shareholders of record on Monday, September 23rd will be paid a dividend of 0.2943 per share by the exchange traded fund on Wednesday, September 25th. This represents a yield of 2%.;Materials Select Sector SPDR Fund (NYSEARCA:XLB) Plans  -  Dividend of $0.29 .;Shareholders of record on Monday, September 23rd will be paid a dividend of 0.2943 per share by the exchange traded fund on Wednesday, September 25th.;78.0;229.0;0;78;79;229;<e1>Materials Select Sector SPDR Fund (NYSEARCA:XLB) Plans  -  Dividend of $0.29 .</e1> <e2>Shareholders of record on Monday, September 23rd will be paid a dividend of 0.2943 per share by the exchange traded fund on Wednesday, September 25th.</e2> This represents a yield of 2%.
0310.00001.2;Materials Select Sector SPDR Fund (NYSEARCA:XLB) Plans  -  Dividend of $0.29 . Shareholders of record on Monday, September 23rd will be paid a dividend of 0.2943 per share by the exchange traded fund on Wednesday, September 25th. This represents a yield of 2%.;Materials Select Sector SPDR Fund (NYSEARCA:XLB) Plans  -  Dividend of $0.29 .;This represents a yield of 2%.;78.0;229.0;0;78;230;260;<e1>Materials Select Sector SPDR Fund (NYSEARCA:XLB) Plans  -  Dividend of $0.29 .</e1> Shareholders of record on Monday, September 23rd will be paid a dividend of 0.2943 per share by the exchange traded fund on Wednesday, September 25th. <e2>This represents a yield of 2%.</e2>
0311.00009;I refinanced my apartment and took almost 30,000 euros of capital out of my home.;I refinanced my apartment;took almost 30,000 euros of capital out of my home.;;;0;25;30;81;<e1>I refinanced my apartment</e1> and <e2>took almost 30,000 euros of capital out of my home.</e2>
0313.00005;That morning, when the NASDAQ opened in New York City, one IPO skyrocketed. Its stock had been priced at $25, the top of the range determined by analysts. Trading opened at nearly double that, $46.;That morning, when the NASDAQ opened in New York City, one IPO skyrocketed.;Trading opened at nearly double that, $46.;75.0;154.0;0;75;155;197;<e1>That morning, when the NASDAQ opened in New York City, one IPO skyrocketed.</e1> Its stock had been priced at $25, the top of the range determined by analysts. <e2>Trading opened at nearly double that, $46.</e2>
0314.00002;French Connection sales tumbled by more than 12% to £51million in the first half of the year  However, sales tumbled by more than 12 per cent to £51million in the first half of the year as the retailer closed down under-performing shops in the face of rising property costs and volatile consumer confidence.;the retailer closed down under-performing shops in the face of rising property costs and volatile consumer confidence.;French Connection sales tumbled by more than 12% to £51million in the first half of the year  However, sales tumbled by more than 12 per cent to £51million in the first half of the year;;;189;307;0;185;<e2>French Connection sales tumbled by more than 12% to £51million in the first half of the year  However, sales tumbled by more than 12 per cent to £51million in the first half of the year</e2> as <e1>the retailer closed down under-performing shops in the face of rising property costs and volatile consumer confidence.</e1>
