Index;Text;Cause;Effect;Offset_Sentence2;Offset_Sentence3;Cause_Start;Cause_End;Effect_Start;Effect_End;Sentence
0005.00003.1;Scaling from 13,000 to 1 million gamers projected According to the report, Immutable's flagship game Gods Unchained has made over $4.5 million in revenue in just over a year, despite it is being played by a closed group of 13,000 gamers. Founded by brothers Robbie and James Ferguson in July 2018, Immutable reportedly expects to grow Gods Unchained from the current 13,000 to 1 million players with the new investment, James stated in an interview with AFR. Based on the Ethereum blockchain, Gods Unchained is a trading card game that has reportedly overtaken other popular TCGs such as Artifact, Faeria and Kards, Immutable stated.;Based on the Ethereum blockchain, Gods Unchained is a trading card game that has reportedly overtaken other popular TCGs such as Artifact, Faeria and Kards, Immutable stated.;Scaling from 13,000 to 1 million gamers projected According to the report, Immutable's flagship game Gods Unchained has made over $4.5 million in revenue in just over a year, despite it is being played by a closed group of 13,000 gamers.;237.0;458.0;459;633;0;237;<e2>Scaling from 13,000 to 1 million gamers projected According to the report, Immutable's flagship game Gods Unchained has made over $4.5 million in revenue in just over a year, despite it is being played by a closed group of 13,000 gamers.</e2> Founded by brothers Robbie and James Ferguson in July 2018, Immutable reportedly expects to grow Gods Unchained from the current 13,000 to 1 million players with the new investment, James stated in an interview with AFR. <e1>Based on the Ethereum blockchain, Gods Unchained is a trading card game that has reportedly overtaken other popular TCGs such as Artifact, Faeria and Kards, Immutable stated.</e1>
0005.00003.2;Scaling from 13,000 to 1 million gamers projected According to the report, Immutable's flagship game Gods Unchained has made over $4.5 million in revenue in just over a year, despite it is being played by a closed group of 13,000 gamers. Founded by brothers Robbie and James Ferguson in July 2018, Immutable reportedly expects to grow Gods Unchained from the current 13,000 to 1 million players with the new investment, James stated in an interview with AFR. Based on the Ethereum blockchain, Gods Unchained is a trading card game that has reportedly overtaken other popular TCGs such as Artifact, Faeria and Kards, Immutable stated.;the new investment;Founded by brothers Robbie and James Ferguson in July 2018, Immutable reportedly expects to grow Gods Unchained from the current 13,000 to 1 million players;237.0;458.0;400;418;238;394;Scaling from 13,000 to 1 million gamers projected According to the report, Immutable's flagship game Gods Unchained has made over $4.5 million in revenue in just over a year, despite it is being played by a closed group of 13,000 gamers. <e2>Founded by brothers Robbie and James Ferguson in July 2018, Immutable reportedly expects to grow Gods Unchained from the current 13,000 to 1 million players</e2> with <e1>the new investment</e1>, James stated in an interview with AFR. Based on the Ethereum blockchain, Gods Unchained is a trading card game that has reportedly overtaken other popular TCGs such as Artifact, Faeria and Kards, Immutable stated.
0006.00004;I believe TII is a compelling investment due to its ability to leverage its existing equity which has increased BV/share at a 21% CAGR since 2013.;I believe TII is a compelling investment due to its ability to leverage its existing equity;has increased BV/share at a 21% CAGR since 2013.;;;0;91;98;146;<e1>I believe TII is a compelling investment due to its ability to leverage its existing equity</e1> which <e2>has increased BV/share at a 21% CAGR since 2013.</e2>
0008.00005;We built momentum despite having to deal with the current uncertainties in the political and economic climate. The board maintains its view that the group is well positioned to build on this and deliver improved performance and increased shareholder value,' said non-executive chairman Martin Morgan. Wilmington said it would pay a final dividend of 5p, up 4% on the previous year, with total dividends of 9.1p (up 3% year on year).;We built momentum despite having to deal with the current uncertainties in the political and economic climate.;Wilmington said it would pay a final dividend of 5p, up 4% on the previous year, with total dividends of 9.1p (up 3% year on year).;110.0;300.0;0;110;301;432;<e1>We built momentum despite having to deal with the current uncertainties in the political and economic climate.</e1> The board maintains its view that the group is well positioned to build on this and deliver improved performance and increased shareholder value,' said non-executive chairman Martin Morgan. <e2>Wilmington said it would pay a final dividend of 5p, up 4% on the previous year, with total dividends of 9.1p (up 3% year on year).</e2>
0009.00067;He began reclaiming some of the industrial enterprises so gullibly surrendered after the fall of Communism, buying back 21% of the energy giant MOL from Russia in 2011.;He began reclaiming some of the industrial enterprises so gullibly surrendered after the fall of Communism;buying back 21% of the energy giant MOL from Russia in 2011.;;;0;106;108;168;<e1>He began reclaiming some of the industrial enterprises so gullibly surrendered after the fall of Communism</e1>, <e2>buying back 21% of the energy giant MOL from Russia in 2011.</e2>
0009.00069.1;But all in all, Orbán's program, universally denounced as a gamble, was a staggering success. Hungary had repaid its IMF loans in full by 2013. The country now has 4% growth and an unemployment rate of about 3%. Debt has fallen from 85% to 71% of GDP, and labor force participation risen from 55% to around 70%.;But all in all, Orbán's program, universally denounced as a gamble, was a staggering success.;Debt has fallen from 85% to 71% of GDP, and labor force participation risen from 55% to around 70%.;93.0;143.0;0;93;212;311;<e1>But all in all, Orbán's program, universally denounced as a gamble, was a staggering success.</e1> Hungary had repaid its IMF loans in full by 2013. The country now has 4% growth and an unemployment rate of about 3%. <e2>Debt has fallen from 85% to 71% of GDP, and labor force participation risen from 55% to around 70%.</e2>
0009.00069.2;But all in all, Orbán's program, universally denounced as a gamble, was a staggering success. Hungary had repaid its IMF loans in full by 2013. The country now has 4% growth and an unemployment rate of about 3%. Debt has fallen from 85% to 71% of GDP, and labor force participation risen from 55% to around 70%.;But all in all, Orbán's program, universally denounced as a gamble, was a staggering success.;The country now has 4% growth and an unemployment rate of about 3%.;93.0;143.0;0;93;144;211;<e1>But all in all, Orbán's program, universally denounced as a gamble, was a staggering success.</e1> Hungary had repaid its IMF loans in full by 2013. <e2>The country now has 4% growth and an unemployment rate of about 3%.</e2> Debt has fallen from 85% to 71% of GDP, and labor force participation risen from 55% to around 70%.
0009.00138;In the wake of Merkel's invitation to migrants in 2015 Soros published a plan to bring a million refugees a year to Europe and distribute them rapidly among neighboring countries for settlement. The plan would, Soros wrote, mobilize the private sector, but only to run the project, not to pay for it. The funding of it would be done at taxpayer expense, through a €20 billion E.U. bond issue.;In the wake of Merkel's invitation to migrants in 2015 Soros published a plan to bring a million refugees a year to Europe and distribute them rapidly among neighboring countries for settlement.;The funding of it would be done at taxpayer expense, through a €20 billion E.U. bond issue.;194.0;300.0;0;194;301;392;<e1>In the wake of Merkel's invitation to migrants in 2015 Soros published a plan to bring a million refugees a year to Europe and distribute them rapidly among neighboring countries for settlement.</e1> The plan would, Soros wrote, mobilize the private sector, but only to run the project, not to pay for it. <e2>The funding of it would be done at taxpayer expense, through a €20 billion E.U. bond issue.</e2>
0011.00006;On the other hand, Articles 50, 51 and 52 of Law 1676 of 2013 provide, in short, that secured creditors, in the context of reorganization and liquidation procedures, have special privileges under which they can collect unpaid amounts in more favorable conditions than other creditors whose claims have not been dismissed, thereby reducing their risk almost to zero.;On the other hand, Articles 50, 51 and 52 of Law 1676 of 2013 provide, in short, that secured creditors, in the context of reorganization and liquidation procedures, have special privileges under which they can collect unpaid amounts in more favorable conditions than other creditors whose claims have not been dismissed;reducing their risk almost to zero.;;;0;320;330;365;<e1>On the other hand, Articles 50, 51 and 52 of Law 1676 of 2013 provide, in short, that secured creditors, in the context of reorganization and liquidation procedures, have special privileges under which they can collect unpaid amounts in more favorable conditions than other creditors whose claims have not been dismissed</e1>, thereby <e2>reducing their risk almost to zero.</e2>
0013.00002;Montreal-based digital asset custodian Knøx has secured $8.25 million in a seed round to support its crypto custody service for institutional customers and fiduciaries. The funding round was led by San Francisco-based venture capital firm Initialized Capital, with the participation of financial services giant Fidelity and venture firm iNovia, Canadian technology-focused news outlet BetaKit reported on Sept. 24.;The funding round was led by San Francisco-based venture capital firm Initialized Capital, with the participation of financial services giant Fidelity and venture firm iNovia, Canadian technology-focused news outlet BetaKit reported on Sept. 24.;Montreal-based digital asset custodian Knøx has secured $8.25 million in a seed round to support its crypto custody service for institutional customers and fiduciaries.;168.0;;169;414;0;168;<e2>Montreal-based digital asset custodian Knøx has secured $8.25 million in a seed round to support its crypto custody service for institutional customers and fiduciaries.</e2> <e1>The funding round was led by San Francisco-based venture capital firm Initialized Capital, with the participation of financial services giant Fidelity and venture firm iNovia, Canadian technology-focused news outlet BetaKit reported on Sept. 24.</e1>
0014.00004.1;We think that, right now, private money is beating public money in terms of its competitiveness, he said. Pension funds, private equity investors, high-net-worth investors, a lot of them have a much better opportunity to buy properties than public companies can. Blackstone, for example, took Pure Industrial Real Estate Trust private in 2018 for $2.5-billion in cash, plus assumed debt, and now it is buying Dream Global.;We think that, right now, private money is beating public money in terms of its competitiveness, he said.;Blackstone, for example, took Pure Industrial Real Estate Trust private in 2018 for $2.5-billion in cash, plus assumed debt, and now it is buying Dream Global.;105.0;262.0;0;105;263;422;<e1>We think that, right now, private money is beating public money in terms of its competitiveness, he said.</e1> Pension funds, private equity investors, high-net-worth investors, a lot of them have a much better opportunity to buy properties than public companies can. <e2>Blackstone, for example, took Pure Industrial Real Estate Trust private in 2018 for $2.5-billion in cash, plus assumed debt, and now it is buying Dream Global.</e2>
0014.00004.2;We think that, right now, private money is beating public money in terms of its competitiveness, he said. Pension funds, private equity investors, high-net-worth investors, a lot of them have a much better opportunity to buy properties than public companies can. Blackstone, for example, took Pure Industrial Real Estate Trust private in 2018 for $2.5-billion in cash, plus assumed debt, and now it is buying Dream Global.;Pension funds, private equity investors, high-net-worth investors, a lot of them have a much better opportunity to buy properties than public companies can.;Blackstone, for example, took Pure Industrial Real Estate Trust private in 2018 for $2.5-billion in cash, plus assumed debt, and now it is buying Dream Global.;105.0;262.0;106;262;263;422;We think that, right now, private money is beating public money in terms of its competitiveness, he said. <e1>Pension funds, private equity investors, high-net-worth investors, a lot of them have a much better opportunity to buy properties than public companies can.</e1> <e2>Blackstone, for example, took Pure Industrial Real Estate Trust private in 2018 for $2.5-billion in cash, plus assumed debt, and now it is buying Dream Global.</e2>
0018.00001.1;Animalcare Group Plc (LON:ANCR) Announces Dividend of GBX 2 Tweet  Animalcare Group Plc (LON:ANCR) announced a dividend on Tuesday, September 24th, Upcoming.Co.Uk reports. Stockholders of record on Thursday, October 24th will be paid a dividend of GBX 2 ($0.03) per share on Friday, November 22nd. This represents a dividend yield of 1.44%.;Animalcare Group Plc (LON:ANCR) Announces Dividend of GBX 2 Tweet  Animalcare Group Plc (LON:ANCR) announced a dividend on Tuesday, September 24th, Upcoming.Co.Uk reports.;Stockholders of record on Thursday, October 24th will be paid a dividend of GBX 2 ($0.03) per share on Friday, November 22nd.;171.0;297.0;0;171;172;297;<e1>Animalcare Group Plc (LON:ANCR) Announces Dividend of GBX 2 Tweet  Animalcare Group Plc (LON:ANCR) announced a dividend on Tuesday, September 24th, Upcoming.Co.Uk reports.</e1> <e2>Stockholders of record on Thursday, October 24th will be paid a dividend of GBX 2 ($0.03) per share on Friday, November 22nd.</e2> This represents a dividend yield of 1.44%.
0018.00001.2;Animalcare Group Plc (LON:ANCR) Announces Dividend of GBX 2 Tweet  Animalcare Group Plc (LON:ANCR) announced a dividend on Tuesday, September 24th, Upcoming.Co.Uk reports. Stockholders of record on Thursday, October 24th will be paid a dividend of GBX 2 ($0.03) per share on Friday, November 22nd. This represents a dividend yield of 1.44%.;Animalcare Group Plc (LON:ANCR) Announces Dividend of GBX 2 Tweet  Animalcare Group Plc (LON:ANCR) announced a dividend on Tuesday, September 24th, Upcoming.Co.Uk reports.;This represents a dividend yield of 1.44%.;171.0;297.0;0;171;298;340;<e1>Animalcare Group Plc (LON:ANCR) Announces Dividend of GBX 2 Tweet  Animalcare Group Plc (LON:ANCR) announced a dividend on Tuesday, September 24th, Upcoming.Co.Uk reports.</e1> Stockholders of record on Thursday, October 24th will be paid a dividend of GBX 2 ($0.03) per share on Friday, November 22nd. <e2>This represents a dividend yield of 1.44%.</e2>
0018.00003;Shares of LON ANCR traded up GBX 4.50 ($0.06) during mid-day trading on Tuesday, hitting GBX 138.50 ($1.81). 18,080 shares of the company's stock traded hands, compared to its average volume of 35,341.;Shares of LON ANCR traded up GBX 4.50 ($0.06) during mid-day trading on Tuesday;hitting GBX 138.50 ($1.81).;;;0;79;81;108;<e1>Shares of LON ANCR traded up GBX 4.50 ($0.06) during mid-day trading on Tuesday</e1>, <e2>hitting GBX 138.50 ($1.81).</e2> 18,080 shares of the company's stock traded hands, compared to its average volume of 35,341.
0020.00006;We are already paying an extra 12 cents a gallon on our gasoline purchases, and a $10 surcharge on our vehicle registration, ostensibly for road improvements.;road improvements.;We are already paying an extra 12 cents a gallon on our gasoline purchases, and a $10 surcharge on our vehicle registration;;;140;158;0;123;<e2>We are already paying an extra 12 cents a gallon on our gasoline purchases, and a $10 surcharge on our vehicle registration</e2>, ostensibly for <e1>road improvements.</e1>
0022.00006;There are two reasons why they pay you big dividends, like the 7%+ cash streams we'll dive into shortly:  REITs are exempt from tax at the corporate level, but … To keep that tax exemption, they must pay 90% of their taxable income to shareholders as dividends.;To keep that tax exemption, they must pay 90% of their taxable income to shareholders as dividends.;There are two reasons why they pay you big dividends, like the 7%+ cash streams;;;162;261;0;79;<e2>There are two reasons why they pay you big dividends, like the 7%+ cash streams</e2> we'll dive into shortly:  REITs are exempt from tax at the corporate level, but … <e1>To keep that tax exemption, they must pay 90% of their taxable income to shareholders as dividends.</e1>
0022.00018;Put all three of these REITs together and you have a diversified real-estate portfolio covering thousands of properties internationally, with a big average yield of 9.3%.;Put all three of these REITs together;you have a diversified real-estate portfolio covering thousands of properties internationally, with a big average yield of 9.3%.;;;0;37;42;170;<e1>Put all three of these REITs together</e1> and <e2>you have a diversified real-estate portfolio covering thousands of properties internationally, with a big average yield of 9.3%.</e2>
0025.00008;- - Net Margins - Return on Equity - Return on Assets  - Santa Fe Financial - 5.41% - -4.65% - 4.78%  - Ellington Financial - 21.99% - 8.70% - 1.52%  Analyst Ratings  This is a breakdown of current ratings for Santa Fe Financial and Ellington Financial, as reported by MarketBeat.com.  - - Sell Ratings - Hold Ratings - Buy Ratings - Strong Buy Ratings - Rating Score  - Santa Fe Financial - 0 - 0 - 0 - 0 - N/A  - Ellington Financial - 0 - 1 - 1 - 0 - 2.50  Ellington Financial has a consensus price target of $19.00, indicating a potential upside of 5.50%.;Ellington Financial has a consensus price target of $19.00;a potential upside of 5.50%.;;;459;517;530;558;- - Net Margins - Return on Equity - Return on Assets  - Santa Fe Financial - 5.41% - -4.65% - 4.78%  - Ellington Financial - 21.99% - 8.70% - 1.52%  Analyst Ratings  This is a breakdown of current ratings for Santa Fe Financial and Ellington Financial, as reported by MarketBeat.com.  - - Sell Ratings - Hold Ratings - Buy Ratings - Strong Buy Ratings - Rating Score  - Santa Fe Financial - 0 - 0 - 0 - 0 - N/A  - Ellington Financial - 0 - 1 - 1 - 0 - 2.50  <e1>Ellington Financial has a consensus price target of $19.00</e1>, indicating <e2>a potential upside of 5.50%.</e2>
0026.00059.1;Andrea Lewis, estimated to be worth $2 million, who started Hugo House, a center for writers in Seattle, with her profits. Jim Allchin, who retired and became a renowned blues guitarist  Chris Peters, a bowling enthusiast, who cashed out and bought the Professional Bowlers Association for an estimated $5 million (and then promptly set it on track to turn profitable and double its revenue). For them, one stock did it all.;For them, one stock did it all.;Andrea Lewis, estimated to be worth $2 million, who started Hugo House, a center for writers in Seattle, with her profits.;122.0;392.0;393;424;0;122;<e2>Andrea Lewis, estimated to be worth $2 million, who started Hugo House, a center for writers in Seattle, with her profits.</e2> Jim Allchin, who retired and became a renowned blues guitarist  Chris Peters, a bowling enthusiast, who cashed out and bought the Professional Bowlers Association for an estimated $5 million (and then promptly set it on track to turn profitable and double its revenue). <e1>For them, one stock did it all.</e1>
0026.00059.2;Andrea Lewis, estimated to be worth $2 million, who started Hugo House, a center for writers in Seattle, with her profits. Jim Allchin, who retired and became a renowned blues guitarist  Chris Peters, a bowling enthusiast, who cashed out and bought the Professional Bowlers Association for an estimated $5 million (and then promptly set it on track to turn profitable and double its revenue). For them, one stock did it all.;For them, one stock did it all.;Jim Allchin, who retired and became a renowned blues guitarist  Chris Peters, a bowling enthusiast, who cashed out and bought the Professional Bowlers Association for an estimated $5 million (and then promptly set it on track to turn profitable and double its revenue).;122.0;392.0;393;424;123;392;Andrea Lewis, estimated to be worth $2 million, who started Hugo House, a center for writers in Seattle, with her profits. <e2>Jim Allchin, who retired and became a renowned blues guitarist  Chris Peters, a bowling enthusiast, who cashed out and bought the Professional Bowlers Association for an estimated $5 million (and then promptly set it on track to turn profitable and double its revenue).</e2> <e1>For them, one stock did it all.</e1>
0026.00070.1;Two grandparents, Joanie and Bill Miller from Buffalo, New York, decided to make Apple their Single-Stock Retirement Plan back in 1997. They put $16,000 into Apple stock. And since then, they've made $2 million.;Two grandparents, Joanie and Bill Miller from Buffalo, New York, decided to make Apple their Single-Stock Retirement Plan back in 1997.;And since then, they've made $2 million.;135.0;170.0;0;135;171;211;<e1>Two grandparents, Joanie and Bill Miller from Buffalo, New York, decided to make Apple their Single-Stock Retirement Plan back in 1997.</e1> They put $16,000 into Apple stock. <e2>And since then, they've made $2 million.</e2>
0026.00070.2;Two grandparents, Joanie and Bill Miller from Buffalo, New York, decided to make Apple their Single-Stock Retirement Plan back in 1997. They put $16,000 into Apple stock. And since then, they've made $2 million.;Two grandparents, Joanie and Bill Miller from Buffalo, New York, decided to make Apple their Single-Stock Retirement Plan back in 1997.;They put $16,000 into Apple stock.;135.0;170.0;0;135;136;170;<e1>Two grandparents, Joanie and Bill Miller from Buffalo, New York, decided to make Apple their Single-Stock Retirement Plan back in 1997.</e1> <e2>They put $16,000 into Apple stock.</e2> And since then, they've made $2 million.
0026.00070.3;Two grandparents, Joanie and Bill Miller from Buffalo, New York, decided to make Apple their Single-Stock Retirement Plan back in 1997. They put $16,000 into Apple stock. And since then, they've made $2 million.;They put $16,000 into Apple stock.;And since then, they've made $2 million.;135.0;170.0;136;170;171;211;Two grandparents, Joanie and Bill Miller from Buffalo, New York, decided to make Apple their Single-Stock Retirement Plan back in 1997. <e1>They put $16,000 into Apple stock.</e1> <e2>And since then, they've made $2 million.</e2>
0027.00009.1;Finally, Deutsche Bank reaffirmed a sell rating on shares of Renishaw in a research note on Friday, July 12th. Five equities research analysts have rated the stock with a sell rating and three have issued a hold rating to the stock. The company currently has a consensus rating of Sell and a consensus price target of GBX 3,693.57 ($48.26).;Finally, Deutsche Bank reaffirmed a sell rating on shares of Renishaw in a research note on Friday, July 12th.;The company currently has a consensus rating of Sell and a consensus price target of GBX 3,693.57 ($48.26).;110.0;232.0;0;110;233;340;<e1>Finally, Deutsche Bank reaffirmed a sell rating on shares of Renishaw in a research note on Friday, July 12th.</e1> Five equities research analysts have rated the stock with a sell rating and three have issued a hold rating to the stock. <e2>The company currently has a consensus rating of Sell and a consensus price target of GBX 3,693.57 ($48.26).</e2>
0027.00009.2;Finally, Deutsche Bank reaffirmed a sell rating on shares of Renishaw in a research note on Friday, July 12th. Five equities research analysts have rated the stock with a sell rating and three have issued a hold rating to the stock. The company currently has a consensus rating of Sell and a consensus price target of GBX 3,693.57 ($48.26).;Five equities research analysts have rated the stock with a sell rating and three have issued a hold rating to the stock.;The company currently has a consensus rating of Sell and a consensus price target of GBX 3,693.57 ($48.26).;110.0;232.0;111;232;233;340;Finally, Deutsche Bank reaffirmed a sell rating on shares of Renishaw in a research note on Friday, July 12th. <e1>Five equities research analysts have rated the stock with a sell rating and three have issued a hold rating to the stock.</e1> <e2>The company currently has a consensus rating of Sell and a consensus price target of GBX 3,693.57 ($48.26).</e2>
0029.00030;But with £400 more per head in contributions, Scots received £1,200 more per head than the UK average in spending.;But with £400 more per head in contributions;Scots received £1,200 more per head than the UK average in spending.;;;0;44;46;114;<e1>But with £400 more per head in contributions</e1>, <e2>Scots received £1,200 more per head than the UK average in spending.</e2>
