0001.00425.2; Average interest-bearing liabilities increased $107.3 billion compared to the earlier quarter. Average interest-bearing deposits increased $101.9 billion, average long-term debt increased $10.4 billion and average short-term borrowings decreased $5.0 billion. The significant increases in earning assets and liabilities are primarily due to the Merger, as well as impacts from the COVID-19 pandemic and the resulting government stimulus programs.The yield on the total loan portfolio for the fourth quarter of 2020 was 4.12%, down 79 basis points compared to the earlier quarter, reflecting the impact of rate decreases, partially offset by purchase accounting accretion from merged loans.; The significant increases in earning assets and liabilities are primarily due to the Merger, as well as impacts from the COVID-19 pandemic and the resulting government stimulus programs.The yield on the total loan portfolio for the fourth quarter of 2020 was 4.12%, down 79 basis points compared to the earlier quarter, reflecting the impact of rate decreases, partially offset by purchase accounting accretion from merged loans.; Average interest-bearing deposits increased $101.9 billion, average long-term debt increased $10.4 billion and average short-term borrowings decreased $5.0 billion.; 94; 259; 260; 689; 95; 259; Average interest-bearing liabilities increased $107.3 billion compared to the earlier quarter. <e2>Average interest-bearing deposits increased $101.9 billion, average long-term debt increased $10.4 billion and average short-term borrowings decreased $5.0 billion.</e2> <e1>The significant increases in earning assets and liabilities are primarily due to the Merger, as well as impacts from the COVID-19 pandemic and the resulting government stimulus programs.The yield on the total loan portfolio for the fourth quarter of 2020 was 4.12%, down 79 basis points compared to the earlier quarter, reflecting the impact of rate decreases, partially offset by purchase accounting accretion from merged loans.</e1>
0001.00425.3; Average interest-bearing liabilities increased $107.3 billion compared to the earlier quarter. Average interest-bearing deposits increased $101.9 billion, average long-term debt increased $10.4 billion and average short-term borrowings decreased $5.0 billion. The significant increases in earning assets and liabilities are primarily due to the Merger, as well as impacts from the COVID-19 pandemic and the resulting government stimulus programs.The yield on the total loan portfolio for the fourth quarter of 2020 was 4.12%, down 79 basis points compared to the earlier quarter, reflecting the impact of rate decreases, partially offset by purchase accounting accretion from merged loans.; rate decreases, partially offset by purchase accounting accretion from merged loans.; The yield on the total loan portfolio for the fourth quarter of 2020 was 4.12%, down 79 basis points compared to the earlier quarter; 94; 259; 605; 689; 446; 578; Average interest-bearing liabilities increased $107.3 billion compared to the earlier quarter. Average interest-bearing deposits increased $101.9 billion, average long-term debt increased $10.4 billion and average short-term borrowings decreased $5.0 billion. The significant increases in earning assets and liabilities are primarily due to the Merger, as well as impacts from the COVID-19 pandemic and the resulting government stimulus programs.<e2>The yield on the total loan portfolio for the fourth quarter of 2020 was 4.12%, down 79 basis points compared to the earlier quarter</e2>, reflecting the impact of <e1>rate decreases, partially offset by purchase accounting accretion from merged loans.</e1>
0001.00426; The yield on the average securities portfolio was 1.60%, down 105 basis points compared to the earlier quarter primarily due to lower yields on new purchases.The average cost of total deposits was 0.07%, down 50 basis points compared to the earlier quarter, and the average cost of interest-bearing deposits was 0.11%, down 71 basis points compared to the earlier quarter.; lower yields on new purchases.; The yield on the average securities portfolio was 1.60%, down 105 basis points compared to the earlier quarter; ; ; 128; 158; 0; 110; <e2>The yield on the average securities portfolio was 1.60%, down 105 basis points compared to the earlier quarter</e2> primarily due to <e1>lower yields on new purchases.</e1>The average cost of total deposits was 0.07%, down 50 basis points compared to the earlier quarter, and the average cost of interest-bearing deposits was 0.11%, down 71 basis points compared to the earlier quarter.
0001.00427.1; The average rate on short-term borrowings was 0.77%, down 138 basis points compared to the earlier quarter. The average rate on long-term debt was 1.64%, down 128 basis points compared to the earlier quarter. The lower rates on interest-bearing liabilities reflect the lower rate environment. The lower rates on long-term debt also reflect the amortization of the fair value mark on the assumed debt and the issuance of new long-term debt.The provision for credit losses was $177 million, compared to $171 million for the earlier quarter.; The lower rates on interest-bearing liabilities reflect the lower rate environment.; The average rate on short-term borrowings was 0.77%, down 138 basis points compared to the earlier quarter.; 107; 208; 209; 292; 0; 107; <e2>The average rate on short-term borrowings was 0.77%, down 138 basis points compared to the earlier quarter.</e2> The average rate on long-term debt was 1.64%, down 128 basis points compared to the earlier quarter. <e1>The lower rates on interest-bearing liabilities reflect the lower rate environment.</e1> The lower rates on long-term debt also reflect the amortization of the fair value mark on the assumed debt and the issuance of new long-term debt.The provision for credit losses was $177 million, compared to $171 million for the earlier quarter.
0001.00427.2; The average rate on short-term borrowings was 0.77%, down 138 basis points compared to the earlier quarter. The average rate on long-term debt was 1.64%, down 128 basis points compared to the earlier quarter. The lower rates on interest-bearing liabilities reflect the lower rate environment. The lower rates on long-term debt also reflect the amortization of the fair value mark on the assumed debt and the issuance of new long-term debt.The provision for credit losses was $177 million, compared to $171 million for the earlier quarter.; The lower rates on interest-bearing liabilities reflect the lower rate environment.; The average rate on long-term debt was 1.64%, down 128 basis points compared to the earlier quarter.; 107; 208; 209; 292; 108; 208; The average rate on short-term borrowings was 0.77%, down 138 basis points compared to the earlier quarter. <e2>The average rate on long-term debt was 1.64%, down 128 basis points compared to the earlier quarter.</e2> <e1>The lower rates on interest-bearing liabilities reflect the lower rate environment.</e1> The lower rates on long-term debt also reflect the amortization of the fair value mark on the assumed debt and the issuance of new long-term debt.The provision for credit losses was $177 million, compared to $171 million for the earlier quarter.
0001.00427.3; The average rate on short-term borrowings was 0.77%, down 138 basis points compared to the earlier quarter. The average rate on long-term debt was 1.64%, down 128 basis points compared to the earlier quarter. The lower rates on interest-bearing liabilities reflect the lower rate environment. The lower rates on long-term debt also reflect the amortization of the fair value mark on the assumed debt and the issuance of new long-term debt.The provision for credit losses was $177 million, compared to $171 million for the earlier quarter.; The lower rates on long-term debt also reflect the amortization of the fair value mark on the assumed debt and the issuance of new long-term debt.The provision for credit losses was $177 million, compared to $171 million for the earlier quarter.; The average rate on long-term debt was 1.64%, down 128 basis points compared to the earlier quarter.; 107; 208; 293; 538; 108; 208; The average rate on short-term borrowings was 0.77%, down 138 basis points compared to the earlier quarter. <e2>The average rate on long-term debt was 1.64%, down 128 basis points compared to the earlier quarter.</e2> The lower rates on interest-bearing liabilities reflect the lower rate environment. <e1>The lower rates on long-term debt also reflect the amortization of the fair value mark on the assumed debt and the issuance of new long-term debt.The provision for credit losses was $177 million, compared to $171 million for the earlier quarter.</e1>
0001.00432; Insurance income increased $36 million due to strong production and premium growth, as well as acquisitions.; strong production and premium growth, as well as acquisitions.; Insurance income increased $36 million; ; ; 46; 108; 0; 38; <e2>Insurance income increased $36 million</e2> due to <e1>strong production and premium growth, as well as acquisitions.</e1>
0001.00434; Service charges on deposits continued to rebound, but remained below 2019 combined levels due to reduced overdraft incident rates.Noninterest expense for the fourth quarter of 2020 was up $1.3 billion compared to the earlier quarter.; reduced overdraft incident rates.; Service charges on deposits continued to rebound, but remained below 2019 combined levels; ; ; 97; 130; 0; 89; <e2>Service charges on deposits continued to rebound, but remained below 2019 combined levels</e2> due to <e1>reduced overdraft incident rates.</e1>Noninterest expense for the fourth quarter of 2020 was up $1.3 billion compared to the earlier quarter.
0001.00436.1; Excluding the merger-related items mentioned above and the impact of an increase of $101 million of amortization expense for intangibles, adjusted noninterest expense was up $994 million primarily reflecting the impact of the Merger.The provision for income taxes was $311 million for the fourth quarter of 2020, compared to $153 million for the earlier quarter. This produced an effective tax rate for the fourth quarter of 2020 of 19.0%, compared to 17.4% for the earlier quarter. The higher effective tax rate is primarily due to higher pre-tax income.ReclassificationsIn certain circumstances, reclassifications have been made to prior period information to conform to the current presentation.; the Merge; Excluding the merger-related items mentioned above and the impact of an increase of $101 million of amortization expense for intangibles, adjusted noninterest expense was up $994 million; 362; 482; 222; 231; 0; 186; <e2>Excluding the merger-related items mentioned above and the impact of an increase of $101 million of amortization expense for intangibles, adjusted noninterest expense was up $994 million</e2> primarily reflecting the impact of <e1>the Merge</e1>r.The provision for income taxes was $311 million for the fourth quarter of 2020, compared to $153 million for the earlier quarter. This produced an effective tax rate for the fourth quarter of 2020 of 19.0%, compared to 17.4% for the earlier quarter. The higher effective tax rate is primarily due to higher pre-tax income.ReclassificationsIn certain circumstances, reclassifications have been made to prior period information to conform to the current presentation.
0001.00436.2; Excluding the merger-related items mentioned above and the impact of an increase of $101 million of amortization expense for intangibles, adjusted noninterest expense was up $994 million primarily reflecting the impact of the Merger.The provision for income taxes was $311 million for the fourth quarter of 2020, compared to $153 million for the earlier quarter. This produced an effective tax rate for the fourth quarter of 2020 of 19.0%, compared to 17.4% for the earlier quarter. The higher effective tax rate is primarily due to higher pre-tax income.ReclassificationsIn certain circumstances, reclassifications have been made to prior period information to conform to the current presentation.; Excluding the merger-related items mentioned above and the impact of an increase of $101 million of amortization expense for intangibles, adjusted noninterest expense was up $994 million primarily reflecting the impact of the Merger.The provision for income taxes was $311 million for the fourth quarter of 2020, compared to $153 million for the earlier quarter.; This produced an effective tax rate for the fourth quarter of 2020 of 19.0%, compared to 17.4% for the earlier quarter.; 362; 482; 0; 362; 363; 482; <e1>Excluding the merger-related items mentioned above and the impact of an increase of $101 million of amortization expense for intangibles, adjusted noninterest expense was up $994 million primarily reflecting the impact of the Merger.The provision for income taxes was $311 million for the fourth quarter of 2020, compared to $153 million for the earlier quarter.</e1> <e2>This produced an effective tax rate for the fourth quarter of 2020 of 19.0%, compared to 17.4% for the earlier quarter.</e2> The higher effective tax rate is primarily due to higher pre-tax income.ReclassificationsIn certain circumstances, reclassifications have been made to prior period information to conform to the current presentation.
0001.00436.3; Excluding the merger-related items mentioned above and the impact of an increase of $101 million of amortization expense for intangibles, adjusted noninterest expense was up $994 million primarily reflecting the impact of the Merger.The provision for income taxes was $311 million for the fourth quarter of 2020, compared to $153 million for the earlier quarter. This produced an effective tax rate for the fourth quarter of 2020 of 19.0%, compared to 17.4% for the earlier quarter. The higher effective tax rate is primarily due to higher pre-tax income.ReclassificationsIn certain circumstances, reclassifications have been made to prior period information to conform to the current presentation.; The higher effective tax rate is primarily due to higher pre-tax income.ReclassificationsIn certain circumstances, reclassifications have been made to prior period information to conform to the current presentation.; This produced an effective tax rate for the fourth quarter of 2020 of 19.0%, compared to 17.4% for the earlier quarter.; 362; 482; 483; 698; 363; 482; Excluding the merger-related items mentioned above and the impact of an increase of $101 million of amortization expense for intangibles, adjusted noninterest expense was up $994 million primarily reflecting the impact of the Merger.The provision for income taxes was $311 million for the fourth quarter of 2020, compared to $153 million for the earlier quarter. <e2>This produced an effective tax rate for the fourth quarter of 2020 of 19.0%, compared to 17.4% for the earlier quarter.</e2> <e1>The higher effective tax rate is primarily due to higher pre-tax income.ReclassificationsIn certain circumstances, reclassifications have been made to prior period information to conform to the current presentation.</e1>
