0001.00107; Noninterest income increased $447 million due primarily to the gain on sale of securities in 2020, partially offset by lower income related to certain post-employment benefits.; the gain on sale of securities in 2020, partially offset by lower income related to certain post-employment benefits.; Noninterest income increased $447 million; ; ; 59; 176; 0; 41; <e2>Noninterest income increased $447 million</e2> due primarily to <e1>the gain on sale of securities in 2020, partially offset by lower income related to certain post-employment benefits.</e1>
0001.00108; The allocated provision for credit losses increased $27 million primarily due to the provision for unfunded commitments.; the provision for unfunded commitments.; The allocated provision for credit losses increased $27 million; ; ; 81; 120; 0; 63; <e2>The allocated provision for credit losses increased $27 million</e2> primarily due to <e1>the provision for unfunded commitments.</e1>
0001.00109; Noninterest expense increased $1.2 billion primarily due to operating expenses related to the Merger, higher merger-related charges and incremental operating expenses related to the Merger, loss on early extinguishment of long-term debt, and elevated COVID-related expenses in 2020.; operating expenses related to the Merger, higher merger-related charges and incremental operating expenses related to the Merger, loss on early extinguishment of long-term debt, and elevated COVID-related expenses in 2020.; Noninterest expense increased $1.2 billion; ; ; 60; 282; 0; 42; <e2>Noninterest expense increased $1.2 billion</e2> primarily due to <e1>operating expenses related to the Merger, higher merger-related charges and incremental operating expenses related to the Merger, loss on early extinguishment of long-term debt, and elevated COVID-related expenses in 2020.</e1>
0001.00110; The benefit for income taxes increased $306 million primarily due to a higher pre-tax loss.Truist Financial Corporation 49Analysis of Financial ConditionInvestment ActivitiesTruist’s Board-approved investment policy is carried out by the MRLCC, which meets regularly to review the economic environment and establish investment strategies.; a higher pre-tax loss.; The benefit for income taxes increased $306 million; ; ; 69; 91; 0; 51; <e2>The benefit for income taxes increased $306 million</e2> primarily due to <e1>a higher pre-tax loss.</e1>Truist Financial Corporation 49Analysis of Financial ConditionInvestment ActivitiesTruist’s Board-approved investment policy is carried out by the MRLCC, which meets regularly to review the economic environment and establish investment strategies.
0001.00115; During 2020, the Company sold non-Agency MBS, and sold and reinvested residential Agency MBS. These sales were the primary drivers for the gains of $402 million for the year ended December 31, 2020.As of December 31, 2020, approximately 1.9% of the securities portfolio was variable rate, compared to 3.6% as of December 31, 2019.; During 2020, the Company sold non-Agency MBS, and sold and reinvested residential Agency MBS.; These sales were the primary drivers for the gains of $402 million for the year ended December 31, 2020.As of December 31, 2020, approximately 1.9% of the securities portfolio was variable rate, compared to 3.6% as of December 31, 2019.; 93; ; 0; 93; 94; 330; <e1>During 2020, the Company sold non-Agency MBS, and sold and reinvested residential Agency MBS.</e1> <e2>These sales were the primary drivers for the gains of $402 million for the year ended December 31, 2020.As of December 31, 2020, approximately 1.9% of the securities portfolio was variable rate, compared to 3.6% as of December 31, 2019.</e2>
0001.00149; Growth in commercial portfolios was partially offset by a decline in dealer floor plan lending and the transfer of $1.0 billion of certain loans and leases to held for sale related to the decision to exit a small ticket loan and lease portfolio.Consumer loans decreased $3.2 billion during 2020 primarily due to refinance activity resulting in a decline in residential mortgages and residential home equity and direct loans.; refinance activity resulting in a decline in residential mortgages and residential home equity and direct loans.; Growth in commercial portfolios was partially offset by a decline in dealer floor plan lending and the transfer of $1.0 billion of certain loans and leases to held for sale related to the decision to exit a small ticket loan and lease portfolio.Consumer loans decreased $3.2 billion during 2020; ; ; 312; 424; 0; 294; <e2>Growth in commercial portfolios was partially offset by a decline in dealer floor plan lending and the transfer of $1.0 billion of certain loans and leases to held for sale related to the decision to exit a small ticket loan and lease portfolio.Consumer loans decreased $3.2 billion during 2020</e2> primarily due to <e1>refinance activity resulting in a decline in residential mortgages and residential home equity and direct loans.</e1>
0001.00150.1; This was partially offset by an increase in indirect auto due to expanded client offerings and an improving credit environment.Credit card loans decreased $780 million during 2020 due to lower business and consumer spending as a result of COVID-19.LHFS decreased $2.3 billion during 2020 primarily due to the sale of loans that had been placed in LHFS after the close of the Merger and the branch divestiture in connection with the Merger, partially offset by the transfer of $1.0 billion to LHFS due to the decision to exit a small ticket loan and lease portfolio.Truist Financial Corporation 53The following table presents a summary of the commercial loan portfolio, segregated by contractual maturities and interest rate terms.; expanded client offerings and an improving credit environment; This was partially offset by an increase in indirect auto; ; ; 65; 126; 0; 57; <e2>This was partially offset by an increase in indirect auto</e2> due to <e1>expanded client offerings and an improving credit environment</e1>.Credit card loans decreased $780 million during 2020 due to lower business and consumer spending as a result of COVID-19.LHFS decreased $2.3 billion during 2020 primarily due to the sale of loans that had been placed in LHFS after the close of the Merger and the branch divestiture in connection with the Merger, partially offset by the transfer of $1.0 billion to LHFS due to the decision to exit a small ticket loan and lease portfolio.Truist Financial Corporation 53The following table presents a summary of the commercial loan portfolio, segregated by contractual maturities and interest rate terms.
0001.00150.2; This was partially offset by an increase in indirect auto due to expanded client offerings and an improving credit environment.Credit card loans decreased $780 million during 2020 due to lower business and consumer spending as a result of COVID-19.LHFS decreased $2.3 billion during 2020 primarily due to the sale of loans that had been placed in LHFS after the close of the Merger and the branch divestiture in connection with the Merger, partially offset by the transfer of $1.0 billion to LHFS due to the decision to exit a small ticket loan and lease portfolio.Truist Financial Corporation 53The following table presents a summary of the commercial loan portfolio, segregated by contractual maturities and interest rate terms.; lower business and consumer spending as a result of COVID-19; Credit card loans decreased $780 million during 2020; ; ; 187; 247; 127; 179; This was partially offset by an increase in indirect auto due to expanded client offerings and an improving credit environment.<e2>Credit card loans decreased $780 million during 2020</e2> due to <e1>lower business and consumer spending as a result of COVID-19</e1>.LHFS decreased $2.3 billion during 2020 primarily due to the sale of loans that had been placed in LHFS after the close of the Merger and the branch divestiture in connection with the Merger, partially offset by the transfer of $1.0 billion to LHFS due to the decision to exit a small ticket loan and lease portfolio.Truist Financial Corporation 53The following table presents a summary of the commercial loan portfolio, segregated by contractual maturities and interest rate terms.
0001.00150.3; This was partially offset by an increase in indirect auto due to expanded client offerings and an improving credit environment.Credit card loans decreased $780 million during 2020 due to lower business and consumer spending as a result of COVID-19.LHFS decreased $2.3 billion during 2020 primarily due to the sale of loans that had been placed in LHFS after the close of the Merger and the branch divestiture in connection with the Merger, partially offset by the transfer of $1.0 billion to LHFS due to the decision to exit a small ticket loan and lease portfolio.Truist Financial Corporation 53The following table presents a summary of the commercial loan portfolio, segregated by contractual maturities and interest rate terms.; to the sale of loans that had been placed in LHFS after the close of the Merger and the branch divestiture in connection with the Merger, partially offset by the transfer of $1.0 billion to LHFS due to the decision to exit a small ticket loan and lease portfolio.; LHFS decreased $2.3 billion during 2020; ; ; 302; 565; 248; 287; This was partially offset by an increase in indirect auto due to expanded client offerings and an improving credit environment.Credit card loans decreased $780 million during 2020 due to lower business and consumer spending as a result of COVID-19.<e2>LHFS decreased $2.3 billion during 2020</e2> primarily due <e1>to the sale of loans that had been placed in LHFS after the close of the Merger and the branch divestiture in connection with the Merger, partially offset by the transfer of $1.0 billion to LHFS due to the decision to exit a small ticket loan and lease portfolio.</e1>Truist Financial Corporation 53The following table presents a summary of the commercial loan portfolio, segregated by contractual maturities and interest rate terms.
0001.00156; The carrying value of PPP loans was down $1.4 billion compared to September 30, 2020, which resulted in a decline of $304 million in average PPP loans compared to the average for the third quarter of 2020.; The carrying value of PPP loans was down $1.4 billion compared to September 30, 2020; a decline of $304 million in average PPP loans compared to the average for the third quarter of 2020.; ; ; 0; 84; 104; 205; <e1>The carrying value of PPP loans was down $1.4 billion compared to September 30, 2020</e1>, which resulted in <e2>a decline of $304 million in average PPP loans compared to the average for the third quarter of 2020.</e2>
0001.00157.1; In addition, average commercial loans were impacted by the transfer of $1.0 billion of certain loans and leases to held for sale, which resulted in a decline in the average balance of $323 million compared to the third quarter of 2020.Average consumer loans decreased $2.2 billion primarily due to seasonally lower loan production and refinance activity resulting in a decline in residential mortgages and residential home equity and direct loans.; In addition, average commercial loans were impacted by the transfer of $1.0 billion of certain loans and leases to held for sale; a decline in the average balance of $323 million compared to the third quarter of 2020; ; ; 0; 128; 148; 234; <e1>In addition, average commercial loans were impacted by the transfer of $1.0 billion of certain loans and leases to held for sale</e1>, which resulted in <e2>a decline in the average balance of $323 million compared to the third quarter of 2020</e2>.Average consumer loans decreased $2.2 billion primarily due to seasonally lower loan production and refinance activity resulting in a decline in residential mortgages and residential home equity and direct loans.
0001.00157.2; In addition, average commercial loans were impacted by the transfer of $1.0 billion of certain loans and leases to held for sale, which resulted in a decline in the average balance of $323 million compared to the third quarter of 2020.Average consumer loans decreased $2.2 billion primarily due to seasonally lower loan production and refinance activity resulting in a decline in residential mortgages and residential home equity and direct loans.; seasonally lower loan production and refinance activity resulting in a decline in residential mortgages and residential home equity and direct loans.; Average consumer loans decreased $2.2 billion; ; ; 298; 447; 235; 280; In addition, average commercial loans were impacted by the transfer of $1.0 billion of certain loans and leases to held for sale, which resulted in a decline in the average balance of $323 million compared to the third quarter of 2020.<e2>Average consumer loans decreased $2.2 billion</e2> primarily due to <e1>seasonally lower loan production and refinance activity resulting in a decline in residential mortgages and residential home equity and direct loans.</e1>
0001.00169; The remaining increase in nonperforming loans held for investment is primarily in commercial and industrial loans and an increase in nonperforming mortgage loans due to loans exiting certain accommodation programs related to the CARES Act.; exiting certain accommodation programs related to the CARES Act.; The remaining increase in nonperforming loans held for investment is primarily in commercial and industrial loans and an increase in nonperforming mortgage loans; ; ; 175; 239; 0; 161; <e2>The remaining increase in nonperforming loans held for investment is primarily in commercial and industrial loans and an increase in nonperforming mortgage loans</e2> due to loans <e1>exiting certain accommodation programs related to the CARES Act.</e1>
0001.00171; Performing TDRs were up $381 million compared to the prior year primarily in residential mortgage, lease financing and indirect auto loans. This increase primarily reflects the application of acquisition accounting related to the Merger, which resulted in the removal of the TDR designation on all loans that were restructured by SunTrust prior to the Merger date.Loans 90 days or more past due and still accruing totaled $2.0 billion at December 31, 2020, relatively flat compared to the prior year.; This increase primarily reflects the application of acquisition accounting related to the Merger, which resulted in the removal of the TDR designation on all loans that were restructured by SunTrust prior to the Merger date.Loans 90 days or more past due and still accruing totaled $2.0 billion at December 31, 2020, relatively flat compared to the prior year.; Performing TDRs were up $381 million compared to the prior year primarily in residential mortgage, lease financing and indirect auto loans.; 139; ; 140; 500; 0; 139; <e2>Performing TDRs were up $381 million compared to the prior year primarily in residential mortgage, lease financing and indirect auto loans.</e2> <e1>This increase primarily reflects the application of acquisition accounting related to the Merger, which resulted in the removal of the TDR designation on all loans that were restructured by SunTrust prior to the Merger date.Loans 90 days or more past due and still accruing totaled $2.0 billion at December 31, 2020, relatively flat compared to the prior year.</e1>
0001.00172; In connection with the discontinuation of pool level accounting for PCI loans, loans 90 days or more past due and still accruing decreased as loan-level evaluations resulted in certain loans being placed in nonaccrual status.; loan-level evaluations resulted in certain loans being placed in nonaccrual status.; In connection with the discontinuation of pool level accounting for PCI loans, loans 90 days or more past due and still accruing decreased; ; ; 142; 225; 0; 138; <e2>In connection with the discontinuation of pool level accounting for PCI loans, loans 90 days or more past due and still accruing decreased</e2> as <e1>loan-level evaluations resulted in certain loans being placed in nonaccrual status.</e1>
0001.00174; Additionally, residential mortgage loans 90 days or more past due increased primarily due to the repurchase of delinquent government guaranteed loans.; the repurchase of delinquent government guaranteed loans.; Additionally, residential mortgage loans 90 days or more past due increased; ; ; 93; 150; 0; 75; <e2>Additionally, residential mortgage loans 90 days or more past due increased</e2> primarily due to <e1>the repurchase of delinquent government guaranteed loans.</e1>
0001.00192; The increase in the allowance for credit losses was primarily due to the adoption of CECL.; the adoption of CECL.; The increase in the allowance for credit losses; ; ; 69; 90; 0; 47; <e2>The increase in the allowance for credit losses</e2> was primarily due to <e1>the adoption of CECL.</e1>
0001.00194; The remaining increase in the allowance for credit losses primarily reflects deteriorated economic conditions.; deteriorated economic conditions.; The remaining increase in the allowance for credit losses; ; ; 77; 110; 0; 57; <e2>The remaining increase in the allowance for credit losses</e2> primarily reflects <e1>deteriorated economic conditions.</e1>
0001.00199; The increase in net charge-offs primarily reflects the Merger.; the Merger.; The increase in net charge-offs; ; ; 51; 62; 0; 31; <e2>The increase in net charge-offs</e2> primarily reflects <e1>the Merger.</e1>
0001.00214; Average noninterest-bearing and interest checking deposit growth was strong for the fourth quarter of 2020 driven by anticipated seasonal inflows in addition to continued growth resulting from pandemic-related client behavior.; anticipated seasonal inflows in addition to continued growth resulting from pandemic-related client behavior.; Average noninterest-bearing and interest checking deposit growth was strong for the fourth quarter of 2020; ; ; 117; 226; 0; 106; <e2>Average noninterest-bearing and interest checking deposit growth was strong for the fourth quarter of 2020</e2> driven by <e1>anticipated seasonal inflows in addition to continued growth resulting from pandemic-related client behavior.</e1>
0001.00215; Average time deposits decreased primarily due to maturity of wholesale negotiable certificates of deposit and higher-cost personal and business accounts.Average noninterest-bearing deposits represented 33.9% of total deposits for the fourth quarter of 2020, compared to 33.3% for the prior quarter.; maturity of wholesale negotiable certificates of deposit and higher-cost personal and business accounts.; Average time deposits decreased; ; ; 49; 153; 0; 31; <e2>Average time deposits decreased</e2> primarily due to <e1>maturity of wholesale negotiable certificates of deposit and higher-cost personal and business accounts.</e1>Average noninterest-bearing deposits represented 33.9% of total deposits for the fourth quarter of 2020, compared to 33.3% for the prior quarter.
0001.00219; The increase in the average amount was due to the Merger.; the Merger.; The increase in the average amount; ; ; 46; 57; 0; 34; <e2>The increase in the average amount</e2> was due to <e1>the Merger.</e1>
0001.00220; Average short-term borrowings decreased as a percentage of funding sources due to strong deposit growth.Long-term debt provides funding and, to a lesser extent, regulatory capital, and primarily consists of senior and subordinated notes issued by Truist and Truist Bank.; strong deposit growth.; Average short-term borrowings decreased as a percentage of funding sources; ; ; 82; 104; 0; 74; <e2>Average short-term borrowings decreased as a percentage of funding sources</e2> due to <e1>strong deposit growth.</e1>Long-term debt provides funding and, to a lesser extent, regulatory capital, and primarily consists of senior and subordinated notes issued by Truist and Truist Bank.
0001.00422; During 2020,Truist paid $2.4 billion in common stock dividends or $1.80 per share, which resulted in a total payout ratio of 58.0% for the year.78 Truist Financial CorporationTable 44: Quarterly Financial Summary – Unaudited 20202019(Dollars in millions, except per share data)Fourth QuarterThird QuarterSecond QuarterFirst QuarterFourth QuarterThird QuarterSecond QuarterFirst QuarterConsolidated summary of operations:; During 2020,Truist paid $2.4 billion in common stock dividends or $1.80 per share; total payout ratio of 58.0% for the year; ; ; 0; 81; 103; 143; <e1>During 2020,Truist paid $2.4 billion in common stock dividends or $1.80 per share</e1>, which resulted in a <e2>total payout ratio of 58.0% for the year</e2>.78 Truist Financial CorporationTable 44: Quarterly Financial Summary – Unaudited 20202019(Dollars in millions, except per share data)Fourth QuarterThird QuarterSecond QuarterFirst QuarterFourth QuarterThird QuarterSecond QuarterFirst QuarterConsolidated summary of operations:
0001.00423; Average earning assets increased $175.6 billion. The increase in average earning assets reflects a $114.5 billion increase in average total loans and leases and a $41.4 billion increase in average securities.; The increase in average earning assets reflects a $114.5 billion increase in average total loans and leases and a $41.4 billion increase in average securities.; Average earning assets increased $175.6 billion.; 48; ; 49; 208; 0; 48; <e2>Average earning assets increased $175.6 billion.</e2> <e1>The increase in average earning assets reflects a $114.5 billion increase in average total loans and leases and a $41.4 billion increase in average securities.</e1>
0001.00424; Average other earning assets increased $17.5 billion primarily due to higher interest-earning balances at the Federal Reserve.; higher interest-earning balances at the Federal Reserve.; Average other earning assets increased $17.5 billion; ; ; 70; 126; 0; 52; <e2>Average other earning assets increased $17.5 billion</e2> primarily due to <e1>higher interest-earning balances at the Federal Reserve.</e1>
0001.00425.1; Average interest-bearing liabilities increased $107.3 billion compared to the earlier quarter. Average interest-bearing deposits increased $101.9 billion, average long-term debt increased $10.4 billion and average short-term borrowings decreased $5.0 billion. The significant increases in earning assets and liabilities are primarily due to the Merger, as well as impacts from the COVID-19 pandemic and the resulting government stimulus programs.The yield on the total loan portfolio for the fourth quarter of 2020 was 4.12%, down 79 basis points compared to the earlier quarter, reflecting the impact of rate decreases, partially offset by purchase accounting accretion from merged loans.; The significant increases in earning assets and liabilities are primarily due to the Merger, as well as impacts from the COVID-19 pandemic and the resulting government stimulus programs.The yield on the total loan portfolio for the fourth quarter of 2020 was 4.12%, down 79 basis points compared to the earlier quarter, reflecting the impact of rate decreases, partially offset by purchase accounting accretion from merged loans.; Average interest-bearing liabilities increased $107.3 billion compared to the earlier quarter.; 94; 259; 260; 689; 0; 94; <e2>Average interest-bearing liabilities increased $107.3 billion compared to the earlier quarter.</e2> Average interest-bearing deposits increased $101.9 billion, average long-term debt increased $10.4 billion and average short-term borrowings decreased $5.0 billion. <e1>The significant increases in earning assets and liabilities are primarily due to the Merger, as well as impacts from the COVID-19 pandemic and the resulting government stimulus programs.The yield on the total loan portfolio for the fourth quarter of 2020 was 4.12%, down 79 basis points compared to the earlier quarter, reflecting the impact of rate decreases, partially offset by purchase accounting accretion from merged loans.</e1>
