Index; Text; Cause; Effect; Offset_Sentence2; Offset_Sentence3; Cause_Start; Cause_End; Effect_Start; Effect_End; Sentence
0001.00026; It found that total U.S. health care spending would be about $3.9 trillion under Medicare for All in 2019, compared with about $3.8 trillion under the status quo. Part of the reason is that Medicare for All would offer generous benefits with no copays and deductibles, except limited cost-sharing for certain medications.; Part of the reason is that Medicare for All would offer generous benefits with no copays and deductibles, except limited cost-sharing for certain medications.; It found that total U.S. health care spending would be about $3.9 trillion under Medicare for All in 2019, compared with about $3.8 trillion under the status quo.; 162; ; 163; 321; 0; 162; <e2>It found that total U.S. health care spending would be about $3.9 trillion under Medicare for All in 2019, compared with about $3.8 trillion under the status quo.</e2> <e1>Part of the reason is that Medicare for All would offer generous benefits with no copays and deductibles, except limited cost-sharing for certain medications.</e1>
0003.00001; Transat loss more than doubles as it works to complete Air Canada deal ; it works to complete Air Canada deal; Transat loss more than doubles; ; ; 34; 70; 0; 30; <e2>Transat loss more than doubles</e2> as <e1>it works to complete Air Canada deal</e1> 
0003.00002; MONTREAL  -  Transat AT Inc.'s third-quarter net loss more than doubled from the same time last year as the tour operator worked to complete its takeover by Air Canada.; the tour operator worked to complete its takeover by Air Canada.; Transat AT Inc.'s third-quarter net loss more than doubled from the same time last year; ; ; 104; 168; 13; 100; MONTREAL  -  <e2>Transat AT Inc.'s third-quarter net loss more than doubled from the same time last year</e2> as <e1>the tour operator worked to complete its takeover by Air Canada.</e1>
0003.00003; The Montreal-based company lost $11.0 million in the quarter ended July 31 versus its $5.0-million net loss the year prior. The push to close Transat's sale to Air Canada heaped on an extra $14 million in costs in its third quarter, including $6 million in professional fees and $7.7 million in stock-based compensation for executives.; The push to close Transat's sale to Air Canada heaped on an extra $14 million in costs in its third quarter, including $6 million in professional fees and $7.7 million in stock-based compensation for executives.; The Montreal-based company lost $11.0 million in the quarter ended July 31 versus its $5.0-million net loss the year prior.; 123; ; 124; 335; 0; 123; <e2>The Montreal-based company lost $11.0 million in the quarter ended July 31 versus its $5.0-million net loss the year prior.</e2> <e1>The push to close Transat's sale to Air Canada heaped on an extra $14 million in costs in its third quarter, including $6 million in professional fees and $7.7 million in stock-based compensation for executives.</e1>
0003.00007; Transatlantic passenger traffic  -  key in the late-spring and summer months when sun-destination trips drop off  -  rose more than four per cent year over year last quarter to help boost revenue to $698.9 million, up from $664.6 million a year earlier.; help boost revenue to $698.9 million, up from $664.6 million a year earlier.; Transatlantic passenger traffic  -  key in the late-spring and summer months when sun-destination trips drop off  -  rose more than four per cent year over year last quarter; ; ; 177; 253; 0; 173; <e2>Transatlantic passenger traffic  -  key in the late-spring and summer months when sun-destination trips drop off  -  rose more than four per cent year over year last quarter</e2> to <e1>help boost revenue to $698.9 million, up from $664.6 million a year earlier.</e1>
0004.00001.1; Let's begin with a story: At the end of 2017, with new technology such as bitcoin, Ethereum, cryptocurrency and blockchain at their very buzziest, a small, publicly traded beverage company, Long Island Iced Tea, announced it was changing its name to Long Blockchain Corp. Literally overnight, shares skyrocketed 200% at the opening of the next trading day. Nothing had really changed except for the company's name, but the signal that the business was now tech-integrated attracted attention, press and real market value for the company and many new shareholders.; Let's begin with a story: At the end of 2017, with new technology such as bitcoin, Ethereum, cryptocurrency and blockchain at their very buzziest, a small, publicly traded beverage company, Long Island Iced Tea, announced it was changing its name to Long Blockchain Corp.; Literally overnight, shares skyrocketed 200% at the opening of the next trading day.; 271; 356; 0; 271; 272; 356; <e1>Let's begin with a story: At the end of 2017, with new technology such as bitcoin, Ethereum, cryptocurrency and blockchain at their very buzziest, a small, publicly traded beverage company, Long Island Iced Tea, announced it was changing its name to Long Blockchain Corp.</e1> <e2>Literally overnight, shares skyrocketed 200% at the opening of the next trading day.</e2> Nothing had really changed except for the company's name, but the signal that the business was now tech-integrated attracted attention, press and real market value for the company and many new shareholders.
0004.00001.2; Let's begin with a story: At the end of 2017, with new technology such as bitcoin, Ethereum, cryptocurrency and blockchain at their very buzziest, a small, publicly traded beverage company, Long Island Iced Tea, announced it was changing its name to Long Blockchain Corp. Literally overnight, shares skyrocketed 200% at the opening of the next trading day. Nothing had really changed except for the company's name, but the signal that the business was now tech-integrated attracted attention, press and real market value for the company and many new shareholders.; Nothing had really changed except for the company's name, but the signal that the business was now tech-integrated attracted attention, press and real market value for the company and many new shareholders.; Literally overnight, shares skyrocketed 200% at the opening of the next trading day.; 271; 356; 357; 563; 272; 356; Let's begin with a story: At the end of 2017, with new technology such as bitcoin, Ethereum, cryptocurrency and blockchain at their very buzziest, a small, publicly traded beverage company, Long Island Iced Tea, announced it was changing its name to Long Blockchain Corp. <e2>Literally overnight, shares skyrocketed 200% at the opening of the next trading day.</e2> <e1>Nothing had really changed except for the company's name, but the signal that the business was now tech-integrated attracted attention, press and real market value for the company and many new shareholders.</e1>
0005.00001; Largest Tencent Shareholder Leads $15M Round in Blockchain Game Developer by Cryptocurrency News Daily | Sep 23, 2019 | Cryptocurrency News | 0 comments  Naspers, the largest shareholder of Chinese Internet giant Tencent, participated in a $15 million investment in blockchain game developer Immutable. Immutable, a Sydney-based blockchain gaming startup, completed a new funding round led by Naspers and Mike Novogratz's crypto investment bank Galaxy Digital, the company announced in a blog post on Sept. 23.; Immutable, a Sydney-based blockchain gaming startup, completed a new funding round led by Naspers and Mike Novogratz's crypto investment bank Galaxy Digital, the company announced in a blog post on Sept. 23.; Largest Tencent Shareholder Leads $15M Round in Blockchain Game Developer by Cryptocurrency News Daily | Sep 23, 2019 | Cryptocurrency News | 0 comments  Naspers, the largest shareholder of Chinese Internet giant Tencent, participated in a $15 million investment in blockchain game developer Immutable.; 302; ; 303; 510; 0; 302; <e2>Largest Tencent Shareholder Leads $15M Round in Blockchain Game Developer by Cryptocurrency News Daily | Sep 23, 2019 | Cryptocurrency News | 0 comments  Naspers, the largest shareholder of Chinese Internet giant Tencent, participated in a $15 million investment in blockchain game developer Immutable.</e2> <e1>Immutable, a Sydney-based blockchain gaming startup, completed a new funding round led by Naspers and Mike Novogratz's crypto investment bank Galaxy Digital, the company announced in a blog post on Sept. 23.</e1>
0005.00003.1; Scaling from 13,000 to 1 million gamers projected According to the report, Immutable's flagship game Gods Unchained has made over $4.5 million in revenue in just over a year, despite it is being played by a closed group of 13,000 gamers. Founded by brothers Robbie and James Ferguson in July 2018, Immutable reportedly expects to grow Gods Unchained from the current 13,000 to 1 million players with the new investment, James stated in an interview with AFR. Based on the Ethereum blockchain, Gods Unchained is a trading card game that has reportedly overtaken other popular TCGs such as Artifact, Faeria and Kards, Immutable stated.; Based on the Ethereum blockchain, Gods Unchained is a trading card game that has reportedly overtaken other popular TCGs such as Artifact, Faeria and Kards, Immutable stated.; Scaling from 13,000 to 1 million gamers projected According to the report, Immutable's flagship game Gods Unchained has made over $4.5 million in revenue in just over a year, despite it is being played by a closed group of 13,000 gamers.; 237; 458; 459; 633; 0; 237; <e2>Scaling from 13,000 to 1 million gamers projected According to the report, Immutable's flagship game Gods Unchained has made over $4.5 million in revenue in just over a year, despite it is being played by a closed group of 13,000 gamers.</e2> Founded by brothers Robbie and James Ferguson in July 2018, Immutable reportedly expects to grow Gods Unchained from the current 13,000 to 1 million players with the new investment, James stated in an interview with AFR. <e1>Based on the Ethereum blockchain, Gods Unchained is a trading card game that has reportedly overtaken other popular TCGs such as Artifact, Faeria and Kards, Immutable stated.</e1>
0005.00003.2; Scaling from 13,000 to 1 million gamers projected According to the report, Immutable's flagship game Gods Unchained has made over $4.5 million in revenue in just over a year, despite it is being played by a closed group of 13,000 gamers. Founded by brothers Robbie and James Ferguson in July 2018, Immutable reportedly expects to grow Gods Unchained from the current 13,000 to 1 million players with the new investment, James stated in an interview with AFR. Based on the Ethereum blockchain, Gods Unchained is a trading card game that has reportedly overtaken other popular TCGs such as Artifact, Faeria and Kards, Immutable stated.; the new investment; Founded by brothers Robbie and James Ferguson in July 2018, Immutable reportedly expects to grow Gods Unchained from the current 13,000 to 1 million players; 237; 458; 400; 418; 238; 394; Scaling from 13,000 to 1 million gamers projected According to the report, Immutable's flagship game Gods Unchained has made over $4.5 million in revenue in just over a year, despite it is being played by a closed group of 13,000 gamers. <e2>Founded by brothers Robbie and James Ferguson in July 2018, Immutable reportedly expects to grow Gods Unchained from the current 13,000 to 1 million players</e2> with <e1>the new investment</e1>, James stated in an interview with AFR. Based on the Ethereum blockchain, Gods Unchained is a trading card game that has reportedly overtaken other popular TCGs such as Artifact, Faeria and Kards, Immutable stated.
0006.00003; Through financial engineering, TII is able to obtain equity-like returns (IRRs >20%) while being exposed to debt-like risks through senior loan and private syndication and transaction fees.; Through financial engineering; TII is able to obtain equity-like returns (IRRs >20%) while being exposed to debt-like risks through senior loan and private syndication and transaction fees.; ; ; 0; 29; 31; 189; <e1>Through financial engineering</e1>, <e2>TII is able to obtain equity-like returns (IRRs >20%) while being exposed to debt-like risks through senior loan and private syndication and transaction fees.</e2>
0006.00004; I believe TII is a compelling investment due to its ability to leverage its existing equity which has increased BV/share at a 21% CAGR since 2013.; I believe TII is a compelling investment due to its ability to leverage its existing equity; has increased BV/share at a 21% CAGR since 2013.; ; ; 0; 91; 98; 146; <e1>I believe TII is a compelling investment due to its ability to leverage its existing equity</e1> which <e2>has increased BV/share at a 21% CAGR since 2013.</e2>
0006.00009; Through financial engineering, TII is able to obtain equity-like returns while being exposed to debt-like risks. Compared to regular mezzanine debt lenders which usually lend only up to 75% LTV, the Company has a slightly higher threshold of risk up to 80% LTV.; Through financial engineering, TII is able to obtain equity-like returns while being exposed to debt-like risks.; Compared to regular mezzanine debt lenders which usually lend only up to 75% LTV, the Company has a slightly higher threshold of risk up to 80% LTV.; 112; ; 0; 112; 113; 261; <e1>Through financial engineering, TII is able to obtain equity-like returns while being exposed to debt-like risks.</e1> <e2>Compared to regular mezzanine debt lenders which usually lend only up to 75% LTV, the Company has a slightly higher threshold of risk up to 80% LTV.</e2>
0006.00010; The Company has three primary levers to increase its project IRR:  1. Senior Loan Syndications  -  the company would originate a loan up to 80% LTV and create a senior A tranche (typically 50-60% LTV) as well as a junior B tranche.; The Company has three primary levers to increase its project IRR:  1. Senior Loan Syndications; the company would originate a loan up to 80% LTV and create a senior A tranche (typically 50-60% LTV) as well as a junior B tranche.; ; ; 0; 94; 99; 231; <e1>The Company has three primary levers to increase its project IRR:  1. Senior Loan Syndications</e1>  -  <e2>the company would originate a loan up to 80% LTV and create a senior A tranche (typically 50-60% LTV) as well as a junior B tranche.</e2>
0006.00014; Private Syndications  -  the company would syndicate up to 80% of a loan and mortgage investment to accredited investors, with terms of the syndicate generally mirroring the terms of the loan except for interest rates paid to syndicated investors, which are typically 300bps less.; Private Syndications; the company would syndicate up to 80% of a loan and mortgage investment to accredited investors, with terms of the syndicate generally mirroring the terms of the loan except for interest rates paid to syndicated investors, which are typically 300bps less.; ; ; 0; 20; 25; 280; <e1>Private Syndications</e1>  -  <e2>the company would syndicate up to 80% of a loan and mortgage investment to accredited investors, with terms of the syndicate generally mirroring the terms of the loan except for interest rates paid to syndicated investors, which are typically 300bps less.</e2>
0006.00035; Source: Google Public Data  Source: Rate Hub  Since mortgage rates hit their peak of 8.5% in May of 2000, mortgage rates have declined to trough levels of 5.3% in July 2005 and 3.7% in July 2015. Credit became more widely available with the introduction of the Canada Mortgage Bond (CMB) in 2001.; Credit became more widely available with the introduction of the Canada Mortgage Bond (CMB) in 2001.; Source: Google Public Data  Source: Rate Hub  Since mortgage rates hit their peak of 8.5% in May of 2000, mortgage rates have declined to trough levels of 5.3% in July 2005 and 3.7% in July 2015.; 195; ; 196; 296; 0; 195; <e2>Source: Google Public Data  Source: Rate Hub  Since mortgage rates hit their peak of 8.5% in May of 2000, mortgage rates have declined to trough levels of 5.3% in July 2005 and 3.7% in July 2015.</e2> <e1>Credit became more widely available with the introduction of the Canada Mortgage Bond (CMB) in 2001.</e1>
0006.00037; Post 2008 financial crisis, lending policies were tightened with interest-only mortgages no longer able to be insured, a reduction of maximum insurable amortization terms from 40 to 35 years, and the minimum down payment raised from 0% to 5%.; Post 2008 financial crisis; lending policies were tightened with interest-only mortgages no longer able to be insured, a reduction of maximum insurable amortization terms from 40 to 35 years, and the minimum down payment raised from 0% to 5%.; ; ; 0; 26; 28; 242; <e1>Post 2008 financial crisis</e1>, <e2>lending policies were tightened with interest-only mortgages no longer able to be insured, a reduction of maximum insurable amortization terms from 40 to 35 years, and the minimum down payment raised from 0% to 5%.</e2>
0008.00001; Wilmington sees 10% drop in FY Ebitda but 'promising' sales in new year StockMarketWire.com - Information and education provider Wilmington reported a 9.7% drop in full-year earnings, reflecting previously announced cost increases to support its growth, even as it saw a 1% increase in revenues. Adjusted Ebitda fell 9.7% to £21.5m with Ebita margins at 17.6% while adjusted pre-tax profit fell 11.5% to £19.3m for the 12 months to 30 June 2019.; Adjusted Ebitda fell 9.7% to £21.5m with Ebita margins at 17.6% while adjusted pre-tax profit fell 11.5% to £19.3m for the 12 months to 30 June 2019.; Wilmington sees 10% drop in FY Ebitda but 'promising' sales in new year StockMarketWire.com - Information and education provider Wilmington reported a 9.7% drop in full-year earnings, reflecting previously announced cost increases to support its growth, even as it saw a 1% increase in revenues.; 295; ; 296; 445; 0; 295; <e2>Wilmington sees 10% drop in FY Ebitda but 'promising' sales in new year StockMarketWire.com - Information and education provider Wilmington reported a 9.7% drop in full-year earnings, reflecting previously announced cost increases to support its growth, even as it saw a 1% increase in revenues.</e2> <e1>Adjusted Ebitda fell 9.7% to £21.5m with Ebita margins at 17.6% while adjusted pre-tax profit fell 11.5% to £19.3m for the 12 months to 30 June 2019.</e1>
0008.00002; However, revenue rose 1% to £122.5m. This was driven by double-digit growth in the firm's compliance business, while the healthcare division recovered from a 'challenging' year to achieve 1% growth.; This was driven by double-digit growth in the firm's compliance business, while the healthcare division recovered from a 'challenging' year to achieve 1% growth.; However, revenue rose 1% to £122.5m.; 36; ; 37; 198; 0; 36; <e2>However, revenue rose 1% to £122.5m.</e2> <e1>This was driven by double-digit growth in the firm's compliance business, while the healthcare division recovered from a 'challenging' year to achieve 1% growth.</e1>
0008.00005; We built momentum despite having to deal with the current uncertainties in the political and economic climate. The board maintains its view that the group is well positioned to build on this and deliver improved performance and increased shareholder value,' said non-executive chairman Martin Morgan. Wilmington said it would pay a final dividend of 5p, up 4% on the previous year, with total dividends of 9.1p (up 3% year on year).; We built momentum despite having to deal with the current uncertainties in the political and economic climate.; Wilmington said it would pay a final dividend of 5p, up 4% on the previous year, with total dividends of 9.1p (up 3% year on year).; 110; 300; 0; 110; 301; 432; <e1>We built momentum despite having to deal with the current uncertainties in the political and economic climate.</e1> The board maintains its view that the group is well positioned to build on this and deliver improved performance and increased shareholder value,' said non-executive chairman Martin Morgan. <e2>Wilmington said it would pay a final dividend of 5p, up 4% on the previous year, with total dividends of 9.1p (up 3% year on year).</e2>
0009.00052.1; Things got worse when the Wall came down. GDP fell 20% between 1988 and 1993. There were suddenly hundreds of thousands of unemployed in a country that, under Communism, had had full employment.; Things got worse when the Wall came down.; GDP fell 20% between 1988 and 1993.; 41; 77; 0; 41; 42; 77; <e1>Things got worse when the Wall came down.</e1> <e2>GDP fell 20% between 1988 and 1993.</e2> There were suddenly hundreds of thousands of unemployed in a country that, under Communism, had had full employment.
0009.00052.2; Things got worse when the Wall came down. GDP fell 20% between 1988 and 1993. There were suddenly hundreds of thousands of unemployed in a country that, under Communism, had had full employment.; Things got worse when the Wall came down.; There were suddenly hundreds of thousands of unemployed in a country that, under Communism, had had full employment.; 41; 77; 0; 41; 78; 194; <e1>Things got worse when the Wall came down.</e1> GDP fell 20% between 1988 and 1993. <e2>There were suddenly hundreds of thousands of unemployed in a country that, under Communism, had had full employment.</e2>
0009.00064; Instead, working with his bold economics minister György Matolcsy, he pursued policies decried at the time as radical and irresponsible. He raised the minimum wage. He cut personal income tax rates sharply, from 30% to a flat rate of 16% (they would fall further, and corporate rates would bottom out at 9%, the lowest in Europe).; Instead, working with his bold economics minister György Matolcsy, he pursued policies decried at the time as radical and irresponsible.; He cut personal income tax rates sharply, from 30% to a flat rate of 16% (they would fall further, and corporate rates would bottom out at 9%, the lowest in Europe).; 136; 164; 0; 136; 165; 330; <e1>Instead, working with his bold economics minister György Matolcsy, he pursued policies decried at the time as radical and irresponsible.</e1> He raised the minimum wage. <e2>He cut personal income tax rates sharply, from 30% to a flat rate of 16% (they would fall further, and corporate rates would bottom out at 9%, the lowest in Europe).</e2>
0009.00067; He began reclaiming some of the industrial enterprises so gullibly surrendered after the fall of Communism, buying back 21% of the energy giant MOL from Russia in 2011.; He began reclaiming some of the industrial enterprises so gullibly surrendered after the fall of Communism; buying back 21% of the energy giant MOL from Russia in 2011.; ; ; 0; 106; 108; 168; <e1>He began reclaiming some of the industrial enterprises so gullibly surrendered after the fall of Communism</e1>, <e2>buying back 21% of the energy giant MOL from Russia in 2011.</e2>
0009.00069.1; But all in all, Orbán's program, universally denounced as a gamble, was a staggering success. Hungary had repaid its IMF loans in full by 2013. The country now has 4% growth and an unemployment rate of about 3%. Debt has fallen from 85% to 71% of GDP, and labor force participation risen from 55% to around 70%.; But all in all, Orbán's program, universally denounced as a gamble, was a staggering success.; Debt has fallen from 85% to 71% of GDP, and labor force participation risen from 55% to around 70%.; 93; 143; 0; 93; 212; 311; <e1>But all in all, Orbán's program, universally denounced as a gamble, was a staggering success.</e1> Hungary had repaid its IMF loans in full by 2013. The country now has 4% growth and an unemployment rate of about 3%. <e2>Debt has fallen from 85% to 71% of GDP, and labor force participation risen from 55% to around 70%.</e2>
0009.00069.2; But all in all, Orbán's program, universally denounced as a gamble, was a staggering success. Hungary had repaid its IMF loans in full by 2013. The country now has 4% growth and an unemployment rate of about 3%. Debt has fallen from 85% to 71% of GDP, and labor force participation risen from 55% to around 70%.; But all in all, Orbán's program, universally denounced as a gamble, was a staggering success.; The country now has 4% growth and an unemployment rate of about 3%.; 93; 143; 0; 93; 144; 211; <e1>But all in all, Orbán's program, universally denounced as a gamble, was a staggering success.</e1> Hungary had repaid its IMF loans in full by 2013. <e2>The country now has 4% growth and an unemployment rate of about 3%.</e2> Debt has fallen from 85% to 71% of GDP, and labor force participation risen from 55% to around 70%.
0009.00105; So short of labor is Hungary that two strikes in January 2019 - one in the 4,000-strong Mercedes plant in Kecskemét, one at the vast Audi plant in Györ, with 13,000 employees - ended with 20% and 18% raises for workers, respectively.; So short of labor is Hungary; two strikes in January 2019 - one in the 4,000-strong Mercedes plant in Kecskemét, one at the vast Audi plant in Györ, with 13,000 employees - ended with 20% and 18% raises for workers, respectively.; ; ; 0; 28; 34; 233; <e1>So short of labor is Hungary</e1> that <e2>two strikes in January 2019 - one in the 4,000-strong Mercedes plant in Kecskemét, one at the vast Audi plant in Györ, with 13,000 employees - ended with 20% and 18% raises for workers, respectively.</e2>
