0275.00004; We are pleased that MIDF Investment Bank and China Construction Bank Malaysia have come together to help us meet our biogas financing needs, enabling us to increase our contribution to MESTECC's Green Energy goal to generate 20% of the country's energy from renewable sources.; We are pleased that MIDF Investment Bank and China Construction Bank Malaysia have come together to help us meet our biogas financing needs; us to increase our contribution to MESTECC's Green Energy goal to generate 20% of the country's energy from renewable sources.; ; ; 0; 139; 150; 276; <e1>We are pleased that MIDF Investment Bank and China Construction Bank Malaysia have come together to help us meet our biogas financing needs</e1>, enabling <e2>us to increase our contribution to MESTECC's Green Energy goal to generate 20% of the country's energy from renewable sources.</e2>
0276.00002; [ ] Direct deposit required: Additional requirements: See below Hard/soft pull: ChexSystems: Credit card funding: Monthly fees: $6-$7 Early account termination fee: Six months, bonus forfeit Household limit: None listed Expiration date: None listed  Contents  Direct link to offer  Hanmi is offering a bonus of up to $500 when you open a new checking account. You get a bonus of 2% of your account balance, based on a 3-month average daily balance on the account for the first full 3-months ($25,000 for the full bonus). You must also complete the following requirements:  Maintain a minimum average daily balance of $5,000 or more for three months Maintain account for a minimum of six months Enroll in eStatements within 30 days of account opening Make at least 5 debit card transactions during each of the first three statement cycles Business accounts only: Make a minimum of one ACH debit or ACH credit transaction during each of the first three statement cycles  This offer is subject to discontinue when Regular Personal Checking account aggregate balance reaches $10 million or 1,400 accounts, and Regular Business Checking account aggregate balance reaches $20 million or 800 accounts, whichever comes first.; [ ] Direct deposit required: Additional requirements: See below Hard/soft pull: ChexSystems: Credit card funding: Monthly fees: $6-$7 Early account termination fee: Six months, bonus forfeit Household limit: None listed Expiration date: None listed  Contents  Direct link to offer  Hanmi is offering a bonus of up to $500 when you open a new checking account.; You must also complete the following requirements:  Maintain a minimum average daily balance of $5,000 or more for three months Maintain account for a minimum of six months Enroll in eStatements within 30 days of account opening Make at least 5 debit card transactions during each of the first three statement cycles Business accounts only: Make a minimum of one ACH debit or ACH credit transaction during each of the first three statement cycles  This offer is subject to discontinue when Regular Personal Checking account aggregate balance reaches $10 million or 1,400 accounts, and Regular Business Checking account aggregate balance reaches $20 million or 800 accounts, whichever comes first.; 359; 520; 0; 359; 521; 1217; <e1>[ ] Direct deposit required: Additional requirements: See below Hard/soft pull: ChexSystems: Credit card funding: Monthly fees: $6-$7 Early account termination fee: Six months, bonus forfeit Household limit: None listed Expiration date: None listed  Contents  Direct link to offer  Hanmi is offering a bonus of up to $500 when you open a new checking account.</e1> You get a bonus of 2% of your account balance, based on a 3-month average daily balance on the account for the first full 3-months ($25,000 for the full bonus). <e2>You must also complete the following requirements:  Maintain a minimum average daily balance of $5,000 or more for three months Maintain account for a minimum of six months Enroll in eStatements within 30 days of account opening Make at least 5 debit card transactions during each of the first three statement cycles Business accounts only: Make a minimum of one ACH debit or ACH credit transaction during each of the first three statement cycles  This offer is subject to discontinue when Regular Personal Checking account aggregate balance reaches $10 million or 1,400 accounts, and Regular Business Checking account aggregate balance reaches $20 million or 800 accounts, whichever comes first.</e2>
0280.00016; At the tribunal, P&ID claimed that it had invested $40 million in the project even though it had not acquired the land or built any facilities for gas processing. It claimed damages of about $6.6 billion dollars: the amount of the net income it would have earned over the 20-year period of the agreement.; At the tribunal, P&ID claimed that it had invested $40 million in the project even though it had not acquired the land or built any facilities for gas processing.; It claimed damages of about $6.6 billion dollars: the amount of the net income it would have earned over the 20-year period of the agreement.; 162; ; 0; 162; 163; 304; <e1>At the tribunal, P&ID claimed that it had invested $40 million in the project even though it had not acquired the land or built any facilities for gas processing.</e1> <e2>It claimed damages of about $6.6 billion dollars: the amount of the net income it would have earned over the 20-year period of the agreement.</e2>
0280.00024; Despite delays by the Nigerian government, on Aug. 16, the court made an order enforcing the tribunal's final award which now stands at about $9.6 billion.; Despite delays by the Nigerian government, on Aug. 16, the court made an order; enforcing the tribunal's final award which now stands at about $9.6 billion.; ; ; 0; 78; 79; 155; <e1>Despite delays by the Nigerian government, on Aug. 16, the court made an order</e1> <e2>enforcing the tribunal's final award which now stands at about $9.6 billion.</e2>
0284.00002; He has been chairman since August 2017 but, since then, Kier's shares have plunged nearly 90 per cent as the company has been rocked by crisis after crisis.; the company has been rocked by crisis after crisis.; He has been chairman since August 2017 but, since then, Kier's shares have plunged nearly 90 per cent; ; ; 105; 156; 0; 101; <e2>He has been chairman since August 2017 but, since then, Kier's shares have plunged nearly 90 per cent</e2> as <e1>the company has been rocked by crisis after crisis.</e1>
0284.00004; Shares edged up 0.7 per cent, or 0.9p, to 133p yesterday after chief executive Andrew Davies claimed turnaround efforts were starting to bear fruit.; chief executive Andrew Davies claimed turnaround efforts were starting to bear fruit.; Shares edged up 0.7 per cent, or 0.9p, to 133p yesterday; ; ; 63; 148; 0; 56; <e2>Shares edged up 0.7 per cent, or 0.9p, to 133p yesterday</e2> after <e1>chief executive Andrew Davies claimed turnaround efforts were starting to bear fruit.</e1>
0285.00004; In addition to promoting travel to the Bahamas via its website and communications with customers, AirStream Jets is waving its 20% international premium for jet card members through the end of the year, so for a $50,000 charter, a savings of $10,000 as an example.; In addition to promoting travel to the Bahamas via its website and communications with customers, AirStream Jets is waving its 20% international premium for jet card members through the end of the year; for a $50,000 charter, a savings of $10,000 as an example.; ; ; 0; 201; 206; 264; <e1>In addition to promoting travel to the Bahamas via its website and communications with customers, AirStream Jets is waving its 20% international premium for jet card members through the end of the year</e1>, so <e2>for a $50,000 charter, a savings of $10,000 as an example.</e2>
0286.00001; COPENHAGEN (Reuters) - Germany's North Channel Bank has been fined 110 million Danish crowns ($16.2 million) by a court in Denmark for its involvement in a dividend stripping scheme.; its involvement in a dividend stripping scheme.; Germany's North Channel Bank has been fined 110 million Danish crowns ($16.2 million) by a court in Denmark; ; ; 135; 182; 23; 130; COPENHAGEN (Reuters) - <e2>Germany's North Channel Bank has been fined 110 million Danish crowns ($16.2 million) by a court in Denmark</e2> for <e1>its involvement in a dividend stripping scheme.</e1>
0286.00003; Denmark's tax authorities have said they lost around $2 billion in the so-called tax stripping scandal that hit several countries across Europe including Germany, Belgium and Austria.; the so-called tax stripping scandal that hit several countries across Europe including Germany, Belgium and Austria.; Denmark's tax authorities have said they lost around $2 billion; ; ; 67; 183; 0; 63; <e2>Denmark's tax authorities have said they lost around $2 billion</e2> in <e1>the so-called tax stripping scandal that hit several countries across Europe including Germany, Belgium and Austria.</e1>
0286.00005; The Danish state prosecutor said the bank facilitated fraudulent dividend tax payments worth 1.1 billion crowns to U.S. pension plans from which it profited by 55 million crowns.; The Danish state prosecutor said the bank facilitated fraudulent dividend tax payments worth 1.1 billion crowns to U.S. pension plans; it profited by 55 million crowns.; ; ; 0; 133; 145; 178; <e1>The Danish state prosecutor said the bank facilitated fraudulent dividend tax payments worth 1.1 billion crowns to U.S. pension plans</e1> from which <e2>it profited by 55 million crowns.</e2>
0286.00009; The Danish tax authority said in May it had reached settlements with 61 U.S. pension plans that will repay 1.6 billion crowns.; The Danish tax authority said in May it had reached settlements with 61 U.S. pension plans; will repay 1.6 billion crowns.; ; ; 0; 90; 96; 126; <e1>The Danish tax authority said in May it had reached settlements with 61 U.S. pension plans</e1> that <e2>will repay 1.6 billion crowns.</e2>
0287.00002; VICTORIA  -  When cabinet minister Doug Donaldson announced a $69-million support package for displaced forest workers, he didn't mention it would be paid for in part by suspending $25 million in grants to develop the rural economy.; VICTORIA  -  When cabinet minister Doug Donaldson announced a $69-million support package for displaced forest workers; it would be paid for in part by suspending $25 million in grants to develop the rural economy.; ; ; 0; 118; 138; 232; <e1>VICTORIA  -  When cabinet minister Doug Donaldson announced a $69-million support package for displaced forest workers</e1>, he didn't mention <e2>it would be paid for in part by suspending $25 million in grants to develop the rural economy.</e2>
0287.00005; Since 2016, the program has provided $73 million in grants to more than 500 communities, organizations, First Nations and other applicants to develop business plans, develop tourist attractions and build local infrastructure.; develop business plans, develop tourist attractions and build local infrastructure.; Since 2016, the program has provided $73 million in grants to more than 500 communities, organizations, First Nations and other applicants; ; ; 142; 225; 0; 138; <e2>Since 2016, the program has provided $73 million in grants to more than 500 communities, organizations, First Nations and other applicants</e2> to <e1>develop business plans, develop tourist attractions and build local infrastructure.</e1>
0287.00010.1; Finally, in the sixth paragraph of Thursday's letter, Donaldson got around to announcing the trade-off that was the real news of the day: Funding this essential programming for impacted workers has required that we temporarily reallocate funding in the Rural Dividend Program. The first $5 million in the budget for the dividend program will be diverted to the aforementioned community grants. The remaining $20 million will help pay for retraining and other support for the displaced workers.; Finally, in the sixth paragraph of Thursday's letter, Donaldson got around to announcing the trade-off that was the real news of the day: Funding this essential programming for impacted workers has required that we temporarily reallocate funding in the Rural Dividend Program.; The first $5 million in the budget for the dividend program will be diverted to the aforementioned community grants.; 276; 393; 0; 276; 277; 393; <e1>Finally, in the sixth paragraph of Thursday's letter, Donaldson got around to announcing the trade-off that was the real news of the day: Funding this essential programming for impacted workers has required that we temporarily reallocate funding in the Rural Dividend Program.</e1> <e2>The first $5 million in the budget for the dividend program will be diverted to the aforementioned community grants.</e2> The remaining $20 million will help pay for retraining and other support for the displaced workers.
0287.00010.2; Finally, in the sixth paragraph of Thursday's letter, Donaldson got around to announcing the trade-off that was the real news of the day: Funding this essential programming for impacted workers has required that we temporarily reallocate funding in the Rural Dividend Program. The first $5 million in the budget for the dividend program will be diverted to the aforementioned community grants. The remaining $20 million will help pay for retraining and other support for the displaced workers.; Finally, in the sixth paragraph of Thursday's letter, Donaldson got around to announcing the trade-off that was the real news of the day: Funding this essential programming for impacted workers has required that we temporarily reallocate funding in the Rural Dividend Program.; The remaining $20 million will help pay for retraining and other support for the displaced workers.; 276; 393; 0; 276; 394; 493; <e1>Finally, in the sixth paragraph of Thursday's letter, Donaldson got around to announcing the trade-off that was the real news of the day: Funding this essential programming for impacted workers has required that we temporarily reallocate funding in the Rural Dividend Program.</e1> The first $5 million in the budget for the dividend program will be diverted to the aforementioned community grants. <e2>The remaining $20 million will help pay for retraining and other support for the displaced workers.</e2>
0288.00002; Chase Investment Counsel Corp bought 15,881 shares as the company's stock declined 11.03% . The institutional investor held 50,476 shares of the railroads company at the end of 2019Q2, valued at $3.91M, up from 34,595 at the end of the previous reported quarter.; Chase Investment Counsel Corp bought 15,881 shares as the company's stock declined 11.03% .; The institutional investor held 50,476 shares of the railroads company at the end of 2019Q2, valued at $3.91M, up from 34,595 at the end of the previous reported quarter.; 91; ; 0; 91; 92; 262; <e1>Chase Investment Counsel Corp bought 15,881 shares as the company's stock declined 11.03% .</e1> <e2>The institutional investor held 50,476 shares of the railroads company at the end of 2019Q2, valued at $3.91M, up from 34,595 at the end of the previous reported quarter.</e2>
0288.00004; The stock increased 0.39% or $0.26 during the last trading session, reaching $68.89.; The stock increased 0.39% or $0.26 during the last trading session; reaching $68.89.; ; ; 0; 66; 68; 84; <e1>The stock increased 0.39% or $0.26 during the last trading session</e1>, <e2>reaching $68.89.</e2>
0288.00007; Some Historical CSX News: 08/05/2018  -  CSX Corporation Chief Financial Officer to Address Bank of America Merrill Lynch Transportation Conference 05/03/2018 CSX Closes Above 50-Day Moving Average: Technicals 16/03/2018  -  More than 100 ex-employees sue CSX after being fired or suspended for taking family medical leave 17/04/2018  -  CSX Doubles Profit as Cuts Pick Up Steam 30/05/2018  -  CSX Corp Names James Schwichtenberg Chief Safety Officer 30/05/2018  -  CSX Names James Schwichtenberg Chief Safety Officer 06/04/2018  -  Deceased CSX Chief Hunter Harrison Was Among Top-Paid CEOs 18/04/2018  -  Rail operator CSX tops profit estimates on cost-cutting boost 29/05/2018  -  CSX at Bernstein Strategic Decisions CEO Conference Tomorrow 17/04/2018  -  CSX 1Q OPERATING INCOME $1.04B, EST. $913.8M  Uss Investment Management Ltd increased its stake in Raytheon Company (RTN) by 0.14% based on its latest 2019Q2 regulatory filing with the SEC. Uss Investment Management Ltd bought 2,100 shares as the company's stock rose 3.37% . The institutional investor held 1.53 million shares of the industrial machinery and components company at the end of 2019Q2, valued at $266.12M, up from 1.53M at the end of the previous reported quarter.; Some Historical CSX News: 08/05/2018  -  CSX Corporation Chief Financial Officer to Address Bank of America Merrill Lynch Transportation Conference 05/03/2018 CSX Closes Above 50-Day Moving Average: Technicals 16/03/2018  -  More than 100 ex-employees sue CSX after being fired or suspended for taking family medical leave 17/04/2018  -  CSX Doubles Profit as Cuts Pick Up Steam 30/05/2018  -  CSX Corp Names James Schwichtenberg Chief Safety Officer 30/05/2018  -  CSX Names James Schwichtenberg Chief Safety Officer 06/04/2018  -  Deceased CSX Chief Hunter Harrison Was Among Top-Paid CEOs 18/04/2018  -  Rail operator CSX tops profit estimates on cost-cutting boost 29/05/2018  -  CSX at Bernstein Strategic Decisions CEO Conference Tomorrow 17/04/2018  -  CSX 1Q OPERATING INCOME $1.04B, EST. $913.8M  Uss Investment Management Ltd increased its stake in Raytheon Company (RTN) by 0.14% based on its latest 2019Q2 regulatory filing with the SEC. Uss Investment Management Ltd bought 2,100 shares as the company's stock rose 3.37% .; The institutional investor held 1.53 million shares of the industrial machinery and components company at the end of 2019Q2, valued at $266.12M, up from 1.53M at the end of the previous reported quarter.; 1035; ; 0; 1035; 1036; 1239; <e1>Some Historical CSX News: 08/05/2018  -  CSX Corporation Chief Financial Officer to Address Bank of America Merrill Lynch Transportation Conference 05/03/2018 CSX Closes Above 50-Day Moving Average: Technicals 16/03/2018  -  More than 100 ex-employees sue CSX after being fired or suspended for taking family medical leave 17/04/2018  -  CSX Doubles Profit as Cuts Pick Up Steam 30/05/2018  -  CSX Corp Names James Schwichtenberg Chief Safety Officer 30/05/2018  -  CSX Names James Schwichtenberg Chief Safety Officer 06/04/2018  -  Deceased CSX Chief Hunter Harrison Was Among Top-Paid CEOs 18/04/2018  -  Rail operator CSX tops profit estimates on cost-cutting boost 29/05/2018  -  CSX at Bernstein Strategic Decisions CEO Conference Tomorrow 17/04/2018  -  CSX 1Q OPERATING INCOME $1.04B, EST. $913.8M  Uss Investment Management Ltd increased its stake in Raytheon Company (RTN) by 0.14% based on its latest 2019Q2 regulatory filing with the SEC. Uss Investment Management Ltd bought 2,100 shares as the company's stock rose 3.37% .</e1> <e2>The institutional investor held 1.53 million shares of the industrial machinery and components company at the end of 2019Q2, valued at $266.12M, up from 1.53M at the end of the previous reported quarter.</e2>
0288.00009; The stock increased 0.89% or $1.75 during the last trading session, reaching $197.39.; The stock increased 0.89% or $1.75 during the last trading session; reaching $197.39.; ; ; 0; 66; 68; 85; <e1>The stock increased 0.89% or $1.75 during the last trading session</e1>, <e2>reaching $197.39.</e2>
0288.00013; It also reduced its holding in Autozone Inc (NYSE:AZO) by 511 shares in the quarter, leaving it with 5,550 shares, and cut its stake in Worldpay Inc.; It also reduced its holding in Autozone Inc (NYSE:AZO) by 511 shares in the quarter; leaving it with 5,550 shares, and cut its stake in Worldpay Inc.; ; ; 0; 83; 85; 149; <e1>It also reduced its holding in Autozone Inc (NYSE:AZO) by 511 shares in the quarter</e1>, <e2>leaving it with 5,550 shares, and cut its stake in Worldpay Inc.</e2>
0290.00002; More than $100 million has been raked back from welfare cheats who were dobbed in, Federal government frontbencher Stuart Robert says. The Department of Human Services received more than 90,000 tip offs from the public about welfare, Medicare and Child Support fraud in the 2018/19 financial year which has led to 200 investigations.; The Department of Human Services received more than 90,000 tip offs from the public about welfare, Medicare and Child Support fraud in the 2018/19 financial year which has led to 200 investigations.; More than $100 million has been raked back from welfare cheats who were dobbed in, Federal government frontbencher Stuart Robert says.; 134; ; 135; 333; 0; 134; <e2>More than $100 million has been raked back from welfare cheats who were dobbed in, Federal government frontbencher Stuart Robert says.</e2> <e1>The Department of Human Services received more than 90,000 tip offs from the public about welfare, Medicare and Child Support fraud in the 2018/19 financial year which has led to 200 investigations.</e1>
0291.00024; In Lebanon during the 1990s, government bonds traded at a substantial discount, with yields reaching upward of 36 percent on several occasions.; In Lebanon during the 1990s, government bonds traded at a substantial discount; yields reaching upward of 36 percent on several occasions.; ; ; 0; 78; 85; 143; <e1>In Lebanon during the 1990s, government bonds traded at a substantial discount</e1>, with <e2>yields reaching upward of 36 percent on several occasions.</e2>
0291.00035; Banks, therefore, benefited from consolidating funds from small and liquid deposits and using them to buy less-liquid government debt instruments. That's why, during the 1990s, banks came to hold two-thirds of the public debt, with the remaining third in the hands of Lebanon's central bank and other public institutions.; Banks, therefore, benefited from consolidating funds from small and liquid deposits and using them to buy less-liquid government debt instruments.; That's why, during the 1990s, banks came to hold two-thirds of the public debt, with the remaining third in the hands of Lebanon's central bank and other public institutions.; 146; ; 0; 146; 147; 321; <e1>Banks, therefore, benefited from consolidating funds from small and liquid deposits and using them to buy less-liquid government debt instruments.</e1> <e2>That's why, during the 1990s, banks came to hold two-thirds of the public debt, with the remaining third in the hands of Lebanon's central bank and other public institutions.</e2>
0292.00014; BKD traded down $0.01 during midday trading on Thursday, reaching $7.82. 932,277 shares of the company's stock were exchanged, compared to its average volume of 1,306,188.; BKD traded down $0.01 during midday trading on Thursday; reaching $7.82.; ; ; 0; 55; 57; 72; <e1>BKD traded down $0.01 during midday trading on Thursday</e1>, <e2>reaching $7.82.</e2> 932,277 shares of the company's stock were exchanged, compared to its average volume of 1,306,188.
0292.00019; JPMorgan Chase & Co. grew its holdings in shares of Brookdale Senior Living by 583.2% during the second quarter. JPMorgan Chase & Co. now owns 449,490 shares of the company's stock worth $3,106,000 after buying an additional 383,701 shares in the last quarter.; JPMorgan Chase & Co. grew its holdings in shares of Brookdale Senior Living by 583.2% during the second quarter.; JPMorgan Chase & Co. now owns 449,490 shares of the company's stock worth $3,106,000 after buying an additional 383,701 shares in the last quarter.; 112; ; 0; 112; 113; 260; <e1>JPMorgan Chase & Co. grew its holdings in shares of Brookdale Senior Living by 583.2% during the second quarter.</e1> <e2>JPMorgan Chase & Co. now owns 449,490 shares of the company's stock worth $3,106,000 after buying an additional 383,701 shares in the last quarter.</e2>
0292.00020; Connor Clark & Lunn Investment Management Ltd. grew its holdings in shares of Brookdale Senior Living by 441.2% during the second quarter. Connor Clark & Lunn Investment Management Ltd. now owns 299,400 shares of the company's stock worth $2,159,000 after buying an additional 244,075 shares in the last quarter.; Connor Clark & Lunn Investment Management Ltd. grew its holdings in shares of Brookdale Senior Living by 441.2% during the second quarter.; Connor Clark & Lunn Investment Management Ltd. now owns 299,400 shares of the company's stock worth $2,159,000 after buying an additional 244,075 shares in the last quarter.; 138; ; 0; 138; 139; 312; <e1>Connor Clark & Lunn Investment Management Ltd. grew its holdings in shares of Brookdale Senior Living by 441.2% during the second quarter.</e1> <e2>Connor Clark & Lunn Investment Management Ltd. now owns 299,400 shares of the company's stock worth $2,159,000 after buying an additional 244,075 shares in the last quarter.</e2>
0292.00022; Renaissance Technologies LLC grew its holdings in shares of Brookdale Senior Living by 54.6% during the second quarter. Renaissance Technologies LLC now owns 11,384,695 shares of the company's stock worth $82,084,000 after buying an additional 4,022,079 shares in the last quarter.; Renaissance Technologies LLC grew its holdings in shares of Brookdale Senior Living by 54.6% during the second quarter.; Renaissance Technologies LLC now owns 11,384,695 shares of the company's stock worth $82,084,000 after buying an additional 4,022,079 shares in the last quarter.; 119; ; 0; 119; 120; 281; <e1>Renaissance Technologies LLC grew its holdings in shares of Brookdale Senior Living by 54.6% during the second quarter.</e1> <e2>Renaissance Technologies LLC now owns 11,384,695 shares of the company's stock worth $82,084,000 after buying an additional 4,022,079 shares in the last quarter.</e2>
