0067.00007.1; When they sell through their own website, that's a very strong margin and that's growing very rapidly, becoming a bigger and bigger part of the business. Revenue in North America, its biggest market, rose 3.6% to $4.29 billion, while sales from its digital platform, which includes apps and websites, grew 42%. Net income rose to $1.37 billion, or 86 cents per share, from $1.09 billion, or 67 cents per share, a year earlier.; When they sell through their own website, that's a very strong margin and that's growing very rapidly, becoming a bigger and bigger part of the business.; Revenue in North America, its biggest market, rose 3.6% to $4.29 billion, while sales from its digital platform, which includes apps and websites, grew 42%.; 153; 310; 0; 153; 154; 310; <e1>When they sell through their own website, that's a very strong margin and that's growing very rapidly, becoming a bigger and bigger part of the business.</e1> <e2>Revenue in North America, its biggest market, rose 3.6% to $4.29 billion, while sales from its digital platform, which includes apps and websites, grew 42%.</e2> Net income rose to $1.37 billion, or 86 cents per share, from $1.09 billion, or 67 cents per share, a year earlier.
0067.00007.2; When they sell through their own website, that's a very strong margin and that's growing very rapidly, becoming a bigger and bigger part of the business. Revenue in North America, its biggest market, rose 3.6% to $4.29 billion, while sales from its digital platform, which includes apps and websites, grew 42%. Net income rose to $1.37 billion, or 86 cents per share, from $1.09 billion, or 67 cents per share, a year earlier.; When they sell through their own website, that's a very strong margin and that's growing very rapidly, becoming a bigger and bigger part of the business.; Net income rose to $1.37 billion, or 86 cents per share, from $1.09 billion, or 67 cents per share, a year earlier.; 153; 310; 0; 153; 311; 426; <e1>When they sell through their own website, that's a very strong margin and that's growing very rapidly, becoming a bigger and bigger part of the business.</e1> Revenue in North America, its biggest market, rose 3.6% to $4.29 billion, while sales from its digital platform, which includes apps and websites, grew 42%. <e2>Net income rose to $1.37 billion, or 86 cents per share, from $1.09 billion, or 67 cents per share, a year earlier.</e2>
0071.00001; MPC, +5.97% shot up 6.2% toward a 4 1/2-month high in premarket trading Wednesday, after activist investor Elliott Management said it sees potential for the oil refiner's stock to rise 61% from current levels.; activist investor Elliott Management said it sees potential for the oil refiner's stock to rise 61% from current levels.; MPC, +5.97% shot up 6.2% toward a 4 1/2-month high in premarket trading Wednesday; ; ; 89; 209; 0; 81; <e2>MPC, +5.97% shot up 6.2% toward a 4 1/2-month high in premarket trading Wednesday</e2>, after <e1>activist investor Elliott Management said it sees potential for the oil refiner's stock to rise 61% from current levels.</e1>
0071.00002; In a letter to Marathon Chairman Gary Heminger, Elliott, which manages funds that own about 2.5% of the economic interest in Marathon, said it believes the company could unlock more than $22 billion in shareholder value with no change in operating assumptions, and an additional $17 billion in value through achieving full operating potential.; achieving full operating potential.; In a letter to Marathon Chairman Gary Heminger, Elliott, which manages funds that own about 2.5% of the economic interest in Marathon, said it believes the company could unlock more than $22 billion in shareholder value with no change in operating assumptions, and an additional $17 billion in value; ; ; 308; 343; 0; 299; <e2>In a letter to Marathon Chairman Gary Heminger, Elliott, which manages funds that own about 2.5% of the economic interest in Marathon, said it believes the company could unlock more than $22 billion in shareholder value with no change in operating assumptions, and an additional $17 billion in value</e2> through <e1>achieving full operating potential.</e1>
0074.00001.1; PJT Partners Inc (NYSE:PJT) to Issue $0.05 Quarterly Dividend PJT Partners Inc (NYSE:PJT) announced a quarterly dividend on Wednesday, July 24th, NASDAQ reports. Stockholders of record on Wednesday, September 4th will be given a dividend of 0.05 per share by the financial services provider on Wednesday, September 18th. This represents a $0.20 dividend on an annualized basis and a dividend yield of 0.48%.; PJT Partners Inc (NYSE:PJT) to Issue $0.05 Quarterly Dividend PJT Partners Inc (NYSE:PJT) announced a quarterly dividend on Wednesday, July 24th, NASDAQ reports.; Stockholders of record on Wednesday, September 4th will be given a dividend of 0.05 per share by the financial services provider on Wednesday, September 18th.; 161; 320; 0; 161; 162; 320; <e1>PJT Partners Inc (NYSE:PJT) to Issue $0.05 Quarterly Dividend PJT Partners Inc (NYSE:PJT) announced a quarterly dividend on Wednesday, July 24th, NASDAQ reports.</e1> <e2>Stockholders of record on Wednesday, September 4th will be given a dividend of 0.05 per share by the financial services provider on Wednesday, September 18th.</e2> This represents a $0.20 dividend on an annualized basis and a dividend yield of 0.48%.
0074.00001.2; PJT Partners Inc (NYSE:PJT) to Issue $0.05 Quarterly Dividend PJT Partners Inc (NYSE:PJT) announced a quarterly dividend on Wednesday, July 24th, NASDAQ reports. Stockholders of record on Wednesday, September 4th will be given a dividend of 0.05 per share by the financial services provider on Wednesday, September 18th. This represents a $0.20 dividend on an annualized basis and a dividend yield of 0.48%.; PJT Partners Inc (NYSE:PJT) to Issue $0.05 Quarterly Dividend PJT Partners Inc (NYSE:PJT) announced a quarterly dividend on Wednesday, July 24th, NASDAQ reports.; This represents a $0.20 dividend on an annualized basis and a dividend yield of 0.48%.; 161; 320; 0; 161; 321; 407; <e1>PJT Partners Inc (NYSE:PJT) to Issue $0.05 Quarterly Dividend PJT Partners Inc (NYSE:PJT) announced a quarterly dividend on Wednesday, July 24th, NASDAQ reports.</e1> Stockholders of record on Wednesday, September 4th will be given a dividend of 0.05 per share by the financial services provider on Wednesday, September 18th. <e2>This represents a $0.20 dividend on an annualized basis and a dividend yield of 0.48%.</e2>
0074.00003; PJT traded up $0.24 on Monday, hitting $41.91.; PJT traded up $0.24 on Monday; hitting $41.91.; ; ; 0; 29; 31; 46; <e1>PJT traded up $0.24 on Monday</e1>, <e2>hitting $41.91.</e2>
0074.00008; The financial services provider reported $0.51 earnings per share for the quarter, beating the Thomson Reuters' consensus estimate of $0.24 by $0.27.; The financial services provider reported $0.51 earnings per share for the quarter; beating the Thomson Reuters' consensus estimate of $0.24 by $0.27.; ; ; 0; 81; 83; 149; <e1>The financial services provider reported $0.51 earnings per share for the quarter</e1>, <e2>beating the Thomson Reuters' consensus estimate of $0.24 by $0.27.</e2>
0074.00014.1; Finally, Buckingham Research cut their price target on shares of PJT Partners from $49.00 to $42.00 and set a neutral rating on the stock in a report on Thursday, July 11th. One equities research analyst has rated the stock with a sell rating, two have given a hold rating and three have assigned a buy rating to the company's stock. The stock currently has a consensus rating of Hold and a consensus price target of $52.33.; Finally, Buckingham Research cut their price target on shares of PJT Partners from $49.00 to $42.00 and set a neutral rating on the stock in a report on Thursday, July 11th.; The stock currently has a consensus rating of Hold and a consensus price target of $52.33.; 173; 333; 0; 173; 334; 424; <e1>Finally, Buckingham Research cut their price target on shares of PJT Partners from $49.00 to $42.00 and set a neutral rating on the stock in a report on Thursday, July 11th.</e1> One equities research analyst has rated the stock with a sell rating, two have given a hold rating and three have assigned a buy rating to the company's stock. <e2>The stock currently has a consensus rating of Hold and a consensus price target of $52.33.</e2>
0074.00014.2; Finally, Buckingham Research cut their price target on shares of PJT Partners from $49.00 to $42.00 and set a neutral rating on the stock in a report on Thursday, July 11th. One equities research analyst has rated the stock with a sell rating, two have given a hold rating and three have assigned a buy rating to the company's stock. The stock currently has a consensus rating of Hold and a consensus price target of $52.33.; One equities research analyst has rated the stock with a sell rating, two have given a hold rating and three have assigned a buy rating to the company's stock.; The stock currently has a consensus rating of Hold and a consensus price target of $52.33.; 173; 333; 174; 333; 334; 424; Finally, Buckingham Research cut their price target on shares of PJT Partners from $49.00 to $42.00 and set a neutral rating on the stock in a report on Thursday, July 11th. <e1>One equities research analyst has rated the stock with a sell rating, two have given a hold rating and three have assigned a buy rating to the company's stock.</e1> <e2>The stock currently has a consensus rating of Hold and a consensus price target of $52.33.</e2>
0076.00002; - - Net Margins - Return on Equity - Return on Assets  - Cloudera - -46.72% - -21.07% - -13.75%  - Shopify - -5.98% - -3.85% - -3.46%  Analyst Ratings  This is a breakdown of current ratings and price targets for Cloudera and Shopify, as reported by MarketBeat.com.  - - Sell Ratings - Hold Ratings - Buy Ratings - Strong Buy Ratings - Rating Score  - Cloudera - 1 - 11 - 8 - 0 - 2.35  - Shopify - 2 - 10 - 14 - 0 - 2.46  Cloudera presently has a consensus target price of $12.82, indicating a potential upside of 43.72%.; Cloudera presently has a consensus target price of $12.82; a potential upside of 43.72%.; ; ; 422; 479; 492; 521; - - Net Margins - Return on Equity - Return on Assets  - Cloudera - -46.72% - -21.07% - -13.75%  - Shopify - -5.98% - -3.85% - -3.46%  Analyst Ratings  This is a breakdown of current ratings and price targets for Cloudera and Shopify, as reported by MarketBeat.com.  - - Sell Ratings - Hold Ratings - Buy Ratings - Strong Buy Ratings - Rating Score  - Cloudera - 1 - 11 - 8 - 0 - 2.35  - Shopify - 2 - 10 - 14 - 0 - 2.46  <e1>Cloudera presently has a consensus target price of $12.82</e1>, indicating <e2>a potential upside of 43.72%.</e2>
0076.00003; Shopify has a consensus target price of $334.16, indicating a potential downside of 1.23%.; Shopify has a consensus target price of $334.16; a potential downside of 1.23%.; ; ; 0; 47; 60; 90; <e1>Shopify has a consensus target price of $334.16</e1>, indicating <e2>a potential downside of 1.23%.</e2>
0077.00008; Try and take out at least an amount between $5,000 and $15,000, which results in a 20% withholding tax (10% in Quebec.).; Try and take out at least an amount between $5,000 and $15,000; a 20% withholding tax (10% in Quebec.).; ; ; 0; 62; 81; 120; <e1>Try and take out at least an amount between $5,000 and $15,000</e1>, which results in <e2>a 20% withholding tax (10% in Quebec.).</e2>
0078.00008; Sitharaman also mentioned the raising of liquidity support for the Housing Finance Corporation - to Rs 30,000 - as a major step towards easing the liquidity pressure.; a major step towards easing the liquidity pressure.; Sitharaman also mentioned the raising of liquidity support for the Housing Finance Corporation - to Rs 30,000; ; ; 115; 166; 0; 109; <e2>Sitharaman also mentioned the raising of liquidity support for the Housing Finance Corporation - to Rs 30,000</e2> - as <e1>a major step towards easing the liquidity pressure.</e1>
0079.00019; But a few weeks before Christmas in 2017, the company, which belongs to the Dutoit Group, gave workers the option to sell their shares back to the company. They were each paid out R30,000, a return that including the dividends barely matches inflation.; But a few weeks before Christmas in 2017, the company, which belongs to the Dutoit Group, gave workers the option to sell their shares back to the company.; They were each paid out R30,000, a return that including the dividends barely matches inflation.; 155; ; 0; 155; 156; 252; <e1>But a few weeks before Christmas in 2017, the company, which belongs to the Dutoit Group, gave workers the option to sell their shares back to the company.</e1> <e2>They were each paid out R30,000, a return that including the dividends barely matches inflation.</e2>
0080.00021; Net of a c. -40% FX depreciation vs the USD over that period, investors still end up -20% when they would've expected to be flat. Why? When liquidity drained from the market, the ETF itself was partially responsible for the same drain in liquidity that it had to track.; When liquidity drained from the market, the ETF itself was partially responsible for the same drain in liquidity that it had to track.; Net of a c. -40% FX depreciation vs the USD over that period, investors still end up -20% when they would've expected to be flat.; 129; 134; 135; 269; 0; 129; <e2>Net of a c. -40% FX depreciation vs the USD over that period, investors still end up -20% when they would've expected to be flat.</e2> Why? <e1>When liquidity drained from the market, the ETF itself was partially responsible for the same drain in liquidity that it had to track.</e1>
0083.00018; Users will be exempt from sales taxes on the wide array of equipment, including new servers and cooling systems, that need constant replacing,  The incentives were designed to attract the kind of large, hyperscale developments needed by companies like Apple, which in 2017 decided to place a new 400K SF, $1.3B hyperscale data center just outside of Des Moines in Waukee, Iowa, a state that had a robust set of incentives, said Tyler Diers, director of legislative relations of the Illinois Chamber of Commerce, which helped put the legislation together.; Users will be exempt from sales taxes on the wide array of equipment, including new servers and cooling systems, that need constant replacing; The incentives were designed to attract the kind of large, hyperscale developments needed by companies like Apple, which in 2017 decided to place a new 400K SF, $1.3B hyperscale data center just outside of Des Moines in Waukee, Iowa, a state that had a robust set of incentives, said Tyler Diers, director of legislative relations of the Illinois Chamber of Commerce, which helped put the legislation together.; ; ; 0; 141; 144; 554; <e1>Users will be exempt from sales taxes on the wide array of equipment, including new servers and cooling systems, that need constant replacing</e1>,  <e2>The incentives were designed to attract the kind of large, hyperscale developments needed by companies like Apple, which in 2017 decided to place a new 400K SF, $1.3B hyperscale data center just outside of Des Moines in Waukee, Iowa, a state that had a robust set of incentives, said Tyler Diers, director of legislative relations of the Illinois Chamber of Commerce, which helped put the legislation together.</e2>
0085.00003; In August 2016, the Commission said tax rulings by Ireland in 1991 and in 2007 had artificially reduced Apple's tax burden for over two decades, effectively making it illegal state aid. European Competition Commissioner Margrethe Vestager pointed to a 0.005% tax rate paid by Apple's main Irish unit in 2014 as an example of the unusually low payments by the company.; In August 2016, the Commission said tax rulings by Ireland in 1991 and in 2007 had artificially reduced Apple's tax burden for over two decades, effectively making it illegal state aid.; European Competition Commissioner Margrethe Vestager pointed to a 0.005% tax rate paid by Apple's main Irish unit in 2014 as an example of the unusually low payments by the company.; 185; ; 0; 185; 186; 367; <e1>In August 2016, the Commission said tax rulings by Ireland in 1991 and in 2007 had artificially reduced Apple's tax burden for over two decades, effectively making it illegal state aid.</e1> <e2>European Competition Commissioner Margrethe Vestager pointed to a 0.005% tax rate paid by Apple's main Irish unit in 2014 as an example of the unusually low payments by the company.</e2>
0086.00001; PANAJI, India (Reuters) - India's government slashed corporate taxes on Friday, giving a surprise $20.5 billion break aimed at reviving private investment and lifting growth from a six-year low that has caused job losses and fueled discontent in the countryside.; reviving private investment and lifting growth from a six-year low that has caused job losses and fueled discontent in the countryside.; PANAJI, India (Reuters) - India's government slashed corporate taxes on Friday, giving a surprise $20.5 billion break; ; ; 127; 262; 0; 117; <e2>PANAJI, India (Reuters) - India's government slashed corporate taxes on Friday, giving a surprise $20.5 billion break</e2> aimed at <e1>reviving private investment and lifting growth from a six-year low that has caused job losses and fueled discontent in the countryside.</e1>
0086.00003; She lowered effective corporate tax further for domestic firms incorporated on or after Oct. 1 to 17%, with the condition that they begin production by March 2023.; they begin production by March 2023.; She lowered effective corporate tax further for domestic firms incorporated on or after Oct. 1 to 17%; ; ; 127; 163; 0; 101; <e2>She lowered effective corporate tax further for domestic firms incorporated on or after Oct. 1 to 17%</e2>, with the condition that <e1>they begin production by March 2023.</e1>
0086.00006; The step to cut corporate tax is historic. It will give a great stimulus to #MakeInIndia, attract private investment from across the globe, improve competitiveness of our private sector, create more jobs and result in a win-win for 1.30 billion Indians, he said on Twitter.; The step to cut corporate tax is historic.; It will give a great stimulus to #MakeInIndia, attract private investment from across the globe, improve competitiveness of our private sector, create more jobs and result in a win-win for 1.30 billion Indians, he said on Twitter.; 42; ; 0; 42; 43; 273; <e1>The step to cut corporate tax is historic.</e1> <e2>It will give a great stimulus to #MakeInIndia, attract private investment from across the globe, improve competitiveness of our private sector, create more jobs and result in a win-win for 1.30 billion Indians, he said on Twitter.</e2>
0086.00009; Indian shares surged more than 6% and were set for their best day in more than a decade after the government announced the tax cuts to revive flagging growth in Asia's third largest economy.; the government announced the tax cuts to revive flagging growth in Asia's third largest economy.; Indian shares surged more than 6% and were set for their best day in more than a decade; ; ; 94; 190; 0; 87; <e2>Indian shares surged more than 6% and were set for their best day in more than a decade</e2> after <e1>the government announced the tax cuts to revive flagging growth in Asia's third largest economy.</e1>
0086.00015; While shares soared, bond yields spiked to a near three-month high on speculation that the government may have to borrow more to meet its expenditure needs for the year, as the measures will mean a revenue loss of 1.45 trillion rupees for the current year.; While shares soared, bond yields spiked to a near three-month high on speculation that the government may have to borrow more to meet its expenditure needs for the year, as the measures; a revenue loss of 1.45 trillion rupees for the current year.; ; ; 0; 185; 196; 256; <e1>While shares soared, bond yields spiked to a near three-month high on speculation that the government may have to borrow more to meet its expenditure needs for the year, as the measures</e1> will mean <e2>a revenue loss of 1.45 trillion rupees for the current year.</e2>
0086.00016; The risk of missing its fiscal deficit target of 3.3% increases significantly as tax revenue growth is already weak.; tax revenue growth is already weak.; The risk of missing its fiscal deficit target of 3.3% increases significantly; ; ; 81; 116; 0; 77; <e2>The risk of missing its fiscal deficit target of 3.3% increases significantly</e2> as <e1>tax revenue growth is already weak.</e1>
0087.00021; A tax rate of 20% is applicable on salaries for duties performed in the Republic of Congo by foreign employees seconded to work in the Republic of Congo for limited periods.; duties performed in the Republic of Congo by foreign employees seconded to work in the Republic of Congo for limited periods.; A tax rate of 20% is applicable on salaries; ; ; 48; 173; 0; 43; <e2>A tax rate of 20% is applicable on salaries</e2> for <e1>duties performed in the Republic of Congo by foreign employees seconded to work in the Republic of Congo for limited periods.</e1>
0088.00003; As the momentum trade seized up this past week, software stocks were hit particularly hard. The iShares Expanded Tech-Software Sector ETF (ticker: IGV) fell 1.5% on Monday even as the broad market squeezed out a gain.; As the momentum trade seized up this past week, software stocks were hit particularly hard.; The iShares Expanded Tech-Software Sector ETF (ticker: IGV) fell 1.5% on Monday even as the broad market squeezed out a gain.; 91; ; 0; 91; 92; 217; <e1>As the momentum trade seized up this past week, software stocks were hit particularly hard.</e1> <e2>The iShares Expanded Tech-Software Sector ETF (ticker: IGV) fell 1.5% on Monday even as the broad market squeezed out a gain.</e2>
0088.00008; Adobe's per-share earnings have come in ahead of consensus estimates in 20 of the past 21 quarters, according to FactSet. During that period, Adobe shares are up 312%.; Adobe's per-share earnings have come in ahead of consensus estimates in 20 of the past 21 quarters, according to FactSet.; During that period, Adobe shares are up 312%.; 121; ; 0; 121; 122; 167; <e1>Adobe's per-share earnings have come in ahead of consensus estimates in 20 of the past 21 quarters, according to FactSet.</e1> <e2>During that period, Adobe shares are up 312%.</e2>
0088.00025; The S&P 500 returned 4.3%, after a 13.6% gain in the March quarter.; a 13.6% gain in the March quarter.; The S&P 500 returned 4.3%; ; ; 33; 67; 0; 25; <e2>The S&P 500 returned 4.3%</e2>, after <e1>a 13.6% gain in the March quarter.</e1>
0089.00003; At last count, it owned and operated 293 landfills, 346 transfer stations, 146 recycling plants and 26,000 garbage trucks, making it the largest waste disposal outfit in North America. So we can forgive you for not being aware of the 87-acre Riverbend Landfill you own in Oregon's scenic wine country, or the consistently losing 13-year campaign you've been fighting to expand it a mere 29 acres, affording you a mere 10 more years.; At last count, it owned and operated 293 landfills, 346 transfer stations, 146 recycling plants and 26,000 garbage trucks, making it the largest waste disposal outfit in North America.; So we can forgive you for not being aware of the 87-acre Riverbend Landfill you own in Oregon's scenic wine country, or the consistently losing 13-year campaign you've been fighting to expand it a mere 29 acres, affording you a mere 10 more years.; 184; ; 0; 184; 185; 432; <e1>At last count, it owned and operated 293 landfills, 346 transfer stations, 146 recycling plants and 26,000 garbage trucks, making it the largest waste disposal outfit in North America.</e1> <e2>So we can forgive you for not being aware of the 87-acre Riverbend Landfill you own in Oregon's scenic wine country, or the consistently losing 13-year campaign you've been fighting to expand it a mere 29 acres, affording you a mere 10 more years.</e2>
0089.00006; A stock analyst recently issued a Waste Management buy recommendation based on your successful drive to instill price and cost discipline to achieve better margins, enabling you to pay out $802 million in dividends and buy back more than $1 billion of stock last year.; A stock analyst recently issued a Waste Management buy recommendation based on your successful drive to instill price and cost discipline to achieve better margins,; you to pay out $802 million in dividends and buy back more than $1 billion of stock last year.; ; ; 0; 164; 174; 268; <e1>A stock analyst recently issued a Waste Management buy recommendation based on your successful drive to instill price and cost discipline to achieve better margins,</e1> enabling <e2>you to pay out $802 million in dividends and buy back more than $1 billion of stock last year.</e2>
0090.00002; DAILY POST had reported that the Federal Government had vowed to go ahead and probe the gas pipeline deal between the previous administration and an Irish firm, Process and Industrial Developments Limited (P&ID), which triggered the decision of a United Kingdom court to ask the company to seize $9.6bn in Nigerian assets.; DAILY POST had reported that the Federal Government had vowed to go ahead and probe the gas pipeline deal between the previous administration and an Irish firm, Process and Industrial Developments Limited (P&ID); the decision of a United Kingdom court to ask the company to seize $9.6bn in Nigerian assets.; ; ; 0; 211; 229; 322; <e1>DAILY POST had reported that the Federal Government had vowed to go ahead and probe the gas pipeline deal between the previous administration and an Irish firm, Process and Industrial Developments Limited (P&ID)</e1>, which triggered <e2>the decision of a United Kingdom court to ask the company to seize $9.6bn in Nigerian assets.</e2>
