Index; Text; Gold
0001.00001; ITEM 7.; 0
0001.00002; MANAGEMENT'S DISCUSSION AND ANALYSIS OF FINANCIAL CONDITION AND RESULTS OF OPERATIONSFinancial Highlights - 2016 Compared to 2015 Our pre-tax income for 2016 was $6.6 billion, representing a $521 million decrease compared to the prior year as lower passenger revenue and higher salaries and related costs offset the benefits of lower fuel prices.; 1
0001.00003; Pre-tax income, adjusted for special items (a non-GAAP financial measure) was $6.1 billion, an increase of $206 million, or 3.5%.; 0
0001.00004; Special items in 2016 were related to fuel hedge MTM adjustments and settlements and Virgin Atlantic MTM adjustments, which totaled $450 million and $115 million, respectively.Revenue.; 0
0001.00005; Our operating revenue decreased $1.1 billion, or 2.6%, and passenger revenue per available seat mile (PRASM) decreased 4.9% on 2.1% higher capacity compared to 2015. The decrease in PRASM was largely driven by competitive pressure in the current low fuel price environment and the impact of U.S. dollar strength on tickets sold in international markets, which are predominantly priced in local currency.; 1
0001.00006; Operating Expense.; 0
0001.00007; Total operating expense decreased $215 million and our consolidated operating cost per available seat mile (CASM) decreased 2.6% to 12.98 cents compared to 2015, primarily due to lower fuel prices, partially offset by higher salaries and related costs.; 1
0001.00008; During 2016, Brent crude oil averaged $44 per barrel compared to the average of nearly $52 per barrel during 2015.; 0
0001.00009; Salaries and related costs were higher as a result of the pay rate increase for pilots resulting from a new pilot contract ratified in the December 2016 quarter that was retroactive to January 1, 2016 and pay rate increases for eligible merit, ground and flight attendant employees effective in the December 2015 quarter.Non-fuel unit costs (CASM-Ex, including profit sharing a non-GAAP financial measure) increased 3.7% to 10.13 cents due to the pay rate increases discussed above and other product and service investments, which were partially offset by productivity gains from our fleet, technology and supply chain initiatives.The non-GAAP financial measures for pre-tax income, adjusted for special items, and CASM-Ex, used above and adjusted net debt, used below, are defined and reconciled in Supplemental Information below.; 1
0001.00010; Company InitiativesOur employees are an important part of Delta's success and underpin the quality, customer service and operational reliability that is core to Delta's brand.; 0
0001.00011; During the December 2016 quarter, Delta pilots ratified a new contract that included an 18% pay rate increase that was retroactive to January 1, 2016. This increase for pilots followed pay rate increases for the majority of other employees during the December 2015 quarter.; 0
0001.00012; In addition, our profit sharing payment to employees in February 2017 will be the third consecutive annual profit sharing payment of more than one billion dollars.; 0
0001.00013; We have paid eligible employees more than $5 billion in profit sharing since the program started in 2007.; 0
0001.00014; We expect to continue to pay our employees industry leading total compensation because sharing the success that our employees help produce is core to Delta's culture and important to providing the best travel experience for our customers and producing solid results for shareholders.Running a reliable, customer-focused airline has produced a solid return on invested capital (ROIC, see calculation in Supplemental Information below) of 26.1% in 2016, despite the pressure from employee investments discussed above.; 1
0001.00015; This financial performance has allowed us to improve our balance sheet by reducing debt and capital lease obligations to $7.3 billion and adjusted net debt (a non-GAAP financial measure) to $6.1 billion, increase funding of our defined benefit pension plans and increase the amount of capital returned to our shareholders.; 1
0001.00016; We are focused on delivering additional value for shareholders in the future through revenue growth, cost productivity and prudent deployment of cash flows.; 1
0001.00017; We have significantly invested in our business since 2010 to improve our operational performance, which consistently ranks first among the major U.S. carriers.; 0
0001.00018; During 2016, we operated 241 days with zero mainline canceled flights, a nearly 50% improvement over our 2015 performance.; 0
0001.00019; In addition, our reported completion factor of 99.6% and on-time arrival rate of nearly 87% places us at the top of the major global U.S. carriers. This operational excellence resulted in consistent increases in our domestic net promoter score, including our highest reported score of 44% in November.Global StrategyWe continue to expand our global network by strengthening our presence in major and developing markets around the world in an effort to increase and diversify our network into high revenue and high growth markets.; 1
0001.00020; The growth of our global presence will enable customers to seamlessly connect to more places while enjoying a consistent, high-quality travel experience.; 0
0001.00021; We are deploying this strategy through investments and relationships in the Atlantic, Latin America and the Pacific.Atlantic.; 0
0001.00022; In 2017, we plan to build on our presence in our strategically advantaged hubs in London, Paris and Amsterdam, while de-emphasizing higher Europe point-of-sale markets.; 0
0001.00023; Alongside our 49% equity investment in Virgin Atlantic, we have an antitrust immunized joint venture with the U.K.-based carrier.; 0
0001.00024; This joint venture has significantly improved our presence in London, one of the largest revenue markets from the U.S., while also enhancing our transatlantic network including our existing joint venture relationship with Air France-KLM and Alitalia.; 0
0001.00025; Our Atlantic senior decision-making functions are located in Europe for close coordination with our joint venture airlines.Latin America.; 0
0001.00026; We are focused on maximizing the value of our relationships with other carriers in Latin America while deriving value from the recent investments in our network, product and service.; 0
0001.00027; During 2015, we announced our intention to create an antitrust immunized commercial joint venture with Aeroméxico and to acquire additional shares of the capital stock of Grupo Aeroméxico through a cash tender offer, both subject to regulatory approvals. The Mexican and U.S. regulators approved antitrust immunity for the joint venture during 2016, subject to certain conditions.; 0
0001.00028; Delta and Aeroméxico have accepted the conditions and are in the process of implementing the necessary actions in order to satisfy the conditions.; 0
0001.00029; We expect both the joint venture to be implemented and the tender offer to be completed in the first half of 2017.; 0
0001.00030; As a result of the tender offer, when combined with our current holdings and derivative positions, we would own up to 49% of the outstanding capital stock of Grupo Aeroméxico.We also own 9.5% of GOL's outstanding capital stock as part of our long-term strategy to strengthen the opportunity we see in Brazil.; 1
0001.00031; In conjunction with our investment, we and GOL have extended our existing commercial agreements.Pacific.; 0
0001.00032; We continue to execute the multi-year restructuring of our Pacific operations by reorienting our network from Tokyo-Narita to Shanghai, through our partnership with China Eastern Airlines, and Seoul, through our partnership with Korean Air.; 0
0001.00033; During 2016, the U.S. Department of Transportation announced that we have been awarded two daytime slot pairs at Tokyo's Haneda Airport (from Los Angeles and Minneapolis).; 0
0001.00034; We commenced these routes and canceled other routes in the Pacific region during the December 2016 quarter. Concurrent with these changes, we are increasing our presence in China, the largest transpacific market from the U.S. We hold a 3.2% stake in China Eastern and are expanding our relationship through co-location in the same terminal at Shanghai’s Pudong airport for a seamless travel experience.; 0
0001.00035; China Eastern is one of the largest airlines in China with a route network covering more than 200 destinations in over 25 countries.; 0
0001.00036; In addition, we are working to expand our trans-Pacific partnership with Korean Air, including expanded codeshare offerings and the commencement of a daily, non-stop flight between Atlanta and Seoul during the June 2017 quarter.Cost Productivity Over the long-term, we continue to focus on maintaining the rate of non-fuel unit cost growth at less than 2% annually.; 0
0001.00037; We continue to leverage our expertise in supply chain and aircraft maintenance to improve our productivity.; 0
0001.00038; Additionally, we are investing in technology projects to improve the customer experience in a cost-efficient manner. We use approximately 50% of our operating cash flow to reinvest in the business for long-term growth opportunities.; 0
0001.00039; The remaining free cash flow is used to further strengthen the balance sheet to reduce debt levels, make incremental pension contributions and return capital to shareholders through dividends and share repurchases.Investing in our FacilitiesWe are working closely with airport authorities throughout our network to enhance facilities in order to both improve our operational efficiency and to better serve our customers.; 0
0001.00040; These efforts include, but are not limited to, future airport renovation and redevelopment projects at New York-LaGuardia airport, Los Angeles International Airport (LAX) and Hartsfield-Jackson Atlanta International Airport and the recently-completed redevelopment of New York-JFK airport. In addition, we are modernizing our Sky Clubs, including the recent openings of flagship locations in Atlanta and Seattle, and improving the food, beverage and services offered throughout the Sky Club network.; 0
0001.00041; Finally, we continue to make significant investments in technologies that improve the customer experience including delta.com, mobile device applications, check-in kiosks, employee customer service applications and airport information displays.Strengthened Balance SheetA key tenet of our strategy is to operate the company with investment grade financial metrics.; 0
0001.00042; Since beginning our balance sheet improvement strategy in 2009, we have reduced our adjusted net debt by nearly $11 billion, which has significantly reduced our annual interest expense. As a result of these efforts, we have received upgrades to our credit ratings by all three major ratings agencies, including investment grade ratings from Moody's and Fitch.; 1
0001.00043; In addition, because we have a significant net underfunded pension liability, we have been making pension contributions above the minimum amount required.; 1
0001.00044; Our goal remains to achieve at least an 80% funded status for the pension plan by 2020.Increased Capital Returns to OwnersWhile we have been reducing our debt levels and investing in the business, we have been increasing our capital returns to shareholders, returning a total of $3.1 billion in 2016 through dividends and share repurchases.; 0
0001.00045; Since first implementing our quarterly dividend in 2013, we have increased the dividend per share by 50% annually and paid $1.2 billion in total dividends, including $509 million in 2016. Through dividends and share repurchases, we have returned nearly $7.4 billion to shareholders since 2013, while reducing outstanding shares by approximately 14% compared to the beginning of 2013.; 0
0001.00046; Mainline$28,105$28,898$(793)(2.7)%Regional carriers5,6725,884(212)(3.6)%Total passenger revenue33,77734,782(1,005)(2.9)%Cargo668813(145)(17.8)%Other5,1945,109851.7 %Total operating revenue$39,639$40,704$(1,065)(2.6)%Passenger Revenue Increase (Decrease)vs. Year Ended December 31, 2015(in millions)Year Ended December 31, 2016Passenger RevenueRPMs (Traffic)ASMs (Capacity)Passenger Mile YieldPRASMLoad FactorMainline$17,932— %4.3 %5.2 %(4.1)%(5.0)%(0.8)ptsRegional carriers5,672(3.6)%0.6 %1.0 %(4.2)%(4.6)%(0.3)ptsDomestic23,604(0.9)%3.6 %4.5 %(4.4)%(5.2)%(0.6)ptsAtlantic5,185(6.5)%(1.7)%0.3 %(4.9)%(6.8)%(1.7)ptsPacific2,616(12.8)%(4.6)%(6.6)%(8.6)%(6.7)%1.8ptsLatin America2,372(1.8)%3.5 %0.8 %(5.1)%(2.6)%2.3ptsTotal$33,777(2.9)%1.7 %2.1 %(4.5)%(4.9)%(0.3)ptsPassenger revenue decreased $1.0 billion over the prior year.; 0
0001.00047; PRASM decreased 4.9% and passenger mile yield decreased 4.5% on 2.1% higher capacity.; 0
0001.00048; Load factor was 0.3 points lower than the prior year at 84.6%.; 0
0001.00049; Unit revenues of the domestic region decreased 5.2%, resulting from weakness in the close-in yield environment during most of the year despite strong volume.Revenues related to our international regions decreased 7.2% year-over-year primarily due to yield declines resulting from imbalances between supply and demand, principally in the Atlantic region and China, the impact of foreign currency fluctuations, continued reductions in international fuel surcharges and economic challenges in certain regions.In the Atlantic, the unit revenue decline predominantly resulted from lower yields driven by industry capacity growthoutpacing passenger demand and the strength of the U.S. dollar.; 1
0001.00050; In core European markets, U.S. point-of-sale demand was strong and recovered quickly following the Brussels airport terrorist attack in March.; 0
0001.00051; However, Europe point-of sale demand has been soft largely due to the impact of weaker Euro exchange rates.; 1
0001.00052; In 2017, we will continue to build on our presence in our strategically advantaged hubs in London, Paris and Amsterdam.Unit revenue declines in the Pacific compared to 2015 primarily resulted from lower yen hedge gains, lower international fuel surcharges and yield declines resulting from industry capacity growth between the U.S. and China.; 1
0001.00053; We expect the significant capacity growth over the last three years in the U.S. to Shanghai market to slow in 2017 as both Chinese and U.S. carriers reach their respective frequency caps. During the September 2016 quarter, the U.S. Department of Transportation announced that we have been awarded two daytime slot pairs at Tokyo's Haneda Airport (from Los Angeles and Minneapolis).; 0
0001.00054; We commenced these routes and canceled other routes in the Pacific region during the December 2016 quarter as part of our ongoing optimization of the Pacific region.; 0
0001.00055; We expect these positive trends to continue in 2017 as we continue to invest in higher performing Mexican business markets.; 0
0001.00056; For a discussion of charges recorded in restructuring and other, see Note 14 of the Notes to the Consolidated Financial Statements.Salaries and Related Costs.; 0
0001.00057; The increase in salaries and related costs was principally due to pay rate increases given to eligible employees which includes an 18% pay rate increase for pilots resulting from a new pilot contract ratified in the December 2016 quarter that was retroactive to January 1, 2016.; 1
0001.00058; Additionally, in the December 2015 quarter, base pay rates increased 14.5% for eligible merit, ground and flight attendant employees in conjunction with changes in their profit sharing program.; 0
0001.00059; Including our regional carriers, fuel expense decreased $1.6 billion compared to the prior year due to an 18% decrease in the market price per gallon of fuel and lower fuel hedge losses, partially offset by a loss from our refinery segment in the current year compared to a profit in the prior year and a 0.7% increase in consumption.; 1
0001.00060; (2) Includes the impact of pricing arrangements between the airline and refinery segments with respect to the refinery's inventory price risk.; 0
0001.00061; For additional information regarding the refinery segment impact, see Refinery Segment below.; 0
0001.00062; (3) MTM adjustments and settlements include the effects of the derivative transactions discussed in Note 4 of the Notes to the Consolidated Financial Statements.; 0
0001.00063; For additional information and the reason for adjusting fuel expense, see Supplemental Information below.Regional Carriers Expense.; 0
0001.00064; The increase in regional carriers expense was primarily due to increases in aircraft maintenance and scheduled contract carrier rate escalations, partially offset by lower fuel cost from the decrease in the market price of fuel.Contracted Services.; 0
0001.00065; The increase in contracted services expense predominantly related to costs associated with the 2.1% increase in capacity and additional temporary staffing.Profit Sharing.; 1
0001.00066; The decrease in profit sharing was primarily due to an adjustment to the profit sharing calculation.; 0
0001.00067; Our broad-based employee profit sharing program provides that, for each year in which we have an annual pre-tax profit, as defined by the terms of the program, we will pay a specified portion of that profit to employees.; 0
0001.00068; In determining the amount of profit sharing, the program defines profit as pre-tax profit adjusted for profit sharing and certain other items.; 0
0001.00069; Beginning with 2016 (to be paid out in 2017), the profit sharing program for merit, ground and flight attendant employees was adjusted to pay 10% of annual pre-tax profit (as defined by the terms of the program) and, if we exceed our prior-year results, the program will pay 20% of the year-over-year increase in pre-tax profit to eligible employees.; 1
0001.00070; For years prior to 2016, our profit sharing program paid 10% to all eligible employees for the first $2.5 billion of annual profit and 20% of annual profit above $2.5 billion.; 0
0001.00071; The profit sharing program for pilots remains unchanged from the prior year and will continue under its current terms.; 0
0001.00072; Mainline$28,898$28,688$2100.7 %Regional carriers5,8846,266(382)(6.1)%Total passenger revenue34,78234,954(172)(0.5)%Cargo813934(121)(13.0)%Other5,1094,47463514.2 %Total operating revenue$40,704$40,362$3420.8 %Passenger Revenue Increase (Decrease)vs. Year Ended December 31, 2014(in millions)Year Ended December 31, 2015Passenger RevenueRPMs (Traffic)ASMs (Capacity)Passenger Mile YieldPRASMLoad FactorMainline$17,9335.4 %6.7 %6.1 %(1.2)%(0.6)%0.5ptsRegional carriers5,884(6.1)%(2.2)%(4.0)%(4.0)%(2.1)%1.5ptsDomestic23,8172.3 %5.1 %4.1 %(2.6)%(1.8)%0.8ptsAtlantic5,548(4.8)%0.6 %3.2 %(5.3)%(7.7)%(2.1)ptsPacific3,002(12.2)%(2.3)%(5.0)%(10.2)%(7.6)%2.3ptsLatin America2,415(0.4)%5.1 %5.7 %(5.3)%(5.8)%(0.5)ptsTotal consolidated$34,782(0.5)%3.3 %3.0 %(3.7)%(3.3)%0.2ptsPassenger revenue decreased $172 million over the prior year. PRASM decreased 3.3% and passenger mile yield decreased 3.7% on 3.0% higher capacity.; 0
0001.00073; Load factor was 0.2 points higher than the prior year at 84.9%.Unit revenues of the mainline domestic region decreased 0.6%, resulting from weaker yields in certain markets, which were nearly offset by the strong performance in Atlanta, New York, Seattle and Los Angeles.Regional carriers passenger revenue decreased 6.1% on a 4.0% reduction in capacity.; 1
0001.00074; During 2015, we removed thirty 50-seat regional aircraft as part of our strategy to restructure our domestic fleet.Revenues related to our international regions decreased 6.0% year-over-year primarily due to the impact of the strong U.S. dollar and reductions in international fuel surcharges. These challenges were addressed through capacity reductions implemented in the December 2015 quarter.In the Atlantic region, unit revenue declines in Africa, the Middle East and Russia were partially offset by strength in core European markets.; 1
0001.00075; Unit revenue declines in the Pacific primarily resulted from the strength of the U.S. dollar and lower international fuel surcharges.; 1
0001.00076; We continued to optimize the Pacific region in order to improve margins by reducing our winter capacity, including the cancellation of our Seattle to Tokyo-Haneda route in the June 2015 quarter and downgauging via the continued retirement of the B-747-400 fleet during the second half of 2015.; 0
0001.00077; In addition, we made a strategic investment in, and established a long-term commercial relationship with, China Eastern.; 0
0001.00078; Latin America saw capacity growth of 5.7%, the majority of which occurred during the first half of 2015.; 0
0001.00079; In the December 2015 quarter, we continued to invest in higher performing markets such as Mexico and the Caribbean, while reducing capacity in Brazil due to its challenging economic environment.; 0
0001.00080; For a discussion of charges recorded in restructuring and other, see Note 14 of the Notes to the Consolidated Financial Statements.Salaries and Related Costs.; 0
0001.00081; The increase in salaries and related costs was primarily due to higher pilot and flight attendant block hours and pay rate increases implemented in both the first half of 2015 and December 2015.; 1
0001.00082; Base pay rates increased 14.5% for eligible merit, ground and flight attendant employees effective December 1, 2015.Aircraft Fuel and Related Taxes.; 0
0001.00083; Including our regional carriers, fuel expense decreased $5.9 billion compared to the prior year due to a 43.5% decrease in the market price per gallon of fuel, an increase in Monroe's profitability and reduced hedge losses, partially offset by a 2.4% increase in consumption. 34Table of ContentsThe table below shows the impact of hedging and the refinery on fuel expense and average price per gallon, adjusted: Average Price Per Gallon Year Ended December 31,Increase(Decrease) Year Ended December 31,Increase(Decrease)(in millions, except per gallon data)20152014 20152014Fuel purchase cost(1)$6,934$11,350$(4,416) $1.74$2.91$(1.17)Airline segment fuel hedge losses(2)9352,258(1,323) 0.230.58(0.35)Refinery segment impact(2)(290)(96)(194) (0.07)(0.02)(0.05)Total fuel expense$7,579$13,512$(5,933) $1.90$3.47$(1.57)MTM adjustments and settlements(3)1,301(2,346)3,647 0.33(0.60)0.93Total fuel expense, adjusted$8,880$11,166$(2,286) $2.23$2.87$(0.64) (1) Market price for jet fuel at airport locations, including related taxes and transportation costs.; 0
0001.00084; (2) Includes the impact of pricing arrangements between the airline and refinery segments with respect to the refinery's inventory price risk.; 0
0001.00085; For additional information regarding the refinery segment impact, see Refinery Segment below.; 0
0001.00086; (3) MTM adjustments and settlements include the effects of the derivative transactions discussed in Note 4 of the Notes to the Consolidated Financial Statements.; 0
0001.00087; For additional information and the reason for adjusting fuel expense, see Supplemental Information below.Regional Carriers Expense.; 0
0001.00088; The reduction in regional carriers expense was primarily due to lower fuel cost from a decrease in the price per gallon of fuel, lower capacity and reduced maintenance expenses.; 1
0001.00089; During 2015, we removed thirty 50-seatregional aircraft as part of our strategy to restructure our domestic fleet.Contracted Services.; 0
0001.00090; The increase in contracted services expense predominantly related to costs associated with the 3.0% increase in capacity and additional temporary staffing.Depreciation and Amortization.; 1
0001.00091; Depreciation and amortization expense increased year-over-year primarily due to investments in new A330-300, B-737-900ER and CRJ-900 aircraft and aircraft modifications that upgraded aircraft interiors and enhanced our product offering.Landing Fees and Other Rents.; 1
0001.00092; Landing fees and other rents increased principally due to an increased number of departures and higher rental rates.Profit Sharing.; 1
0001.00093; The increase in profit sharing was driven by an increase in full year pre-tax income compared to the prior year.; 1
0001.00094; Our broad-based employee profit sharing program provides that, for each year in which we have an annual pre-tax profit, as defined by the terms of the program, we will pay a specified portion of that profit to employees.; 0
0001.00095; In determining the amount of profit sharing, the program defines profit as pre-tax profit adjusted for profit sharing and certain other items.; 0
0001.00096; For years prior to 2016, our profit sharing program paid 10% to all employees for the first $2.5 billion of annual profit and 20% of annual profit above $2.5 billion.Beginning with 2016 pre-tax profit (to be paid out in 2017), the profit sharing program for merit, ground and flight attendant employees has been adjusted to pay 10% of annual pre-tax profit (as defined by the terms of the program) and, if we exceed our prior-year results, the program will pay 20% of the year-over-year increase in pre-tax profit to eligible employees.; 1
0001.00097; The profit sharing program for pilots remained unchanged and will continue in 2016 under its terms.Passenger Service.; 0
0001.00098; Passenger service expense includes the costs for onboard food and beverage, cleaning and supplies.; 0
0001.00099; This expense increased year-over-year primarily due to costs associated with enhancements to our onboard product offering and the 3.3% increase in traffic.Other.; 1
0001.00100; Other operating expense increased primarily due to costs associated with sales of non-jet fuel products to third parties by our oil refinery.; 0
