Index; Text; Gold
0002.00109; In each of the international regions we continue to monitor government travel directives and customer demand and will adjust flight schedules accordingly.; 0
0002.00110; Prior to the COVID-19 pandemic, we completed two transactions to further strengthen our international partnerships.; 0
0002.00111; In the Atlantic region, effective January 2020, we combined our separate transatlantic joint venture agreements with Air France-KLM and Virgin Atlantic into a single three-party transatlantic joint venture.; 0
0002.00112; This enhanced joint venture is designed to strengthen collaboration between the three airlines and is expected to provide customers with increased access to destinations across North America, the U.K. and Europe.; 0
0002.00113; In the Latin America region, in January 2020, we completed the tender offer to acquire 20% of the shares of LATAM as part of our plan to create a strategic alliance.; 0
0002.00114; Additionally, in the March 2020 quarter, we started codesharing for certain flights operated by LATAM.; 0
0002.00115; In May 2020, we signed a trans-American joint venture agreement with LATAM that, subject to regulatory approvals, will combine our highly complementary route networks between North and South America, with the goal of providing customers with a seamless travel experience and industry-leading connectivity.; 0
0002.00116; We believe this alliance will generate growth opportunities, building upon Delta's and LATAM's global footprint and joint ventures.; 0
0002.00117; See Note 5 of the Notes to the Consolidated Financial Statements for additional information on our strategic alliance with LATAM and the impact of its bankruptcy filing.Delta Air Lines, Inc. 2020 Form 10-K ; 0
0002.00118; ; 0
0002.00119; ; 0
0002.00120; ; 0
0002.00121; ; 0
0002.00122; ; 0
0002.00123; 35 Item 7.; 0
0002.00124; Ancillary businesses and refinery includes refinery sales to third parties, aircraft maintenance provided to third parties and our vacation wholesale operations.; 0
0002.00125; Refinery sales to third parties, which are at or near cost, increased $1.1 billion compared to 2019. The increase in third-party refinery sales resulted from the refinery's shift to producing more non-jet fuel products due to the decline in demand for jet fuel.; 1
0002.00126; The increase in refinery sales was partially offset by an approximately $270 million, or approximately 30%, decline in revenue from aircraft maintenance services we provide to third parties, which decreased due to the reduction in flights operated worldwide.; 1
0002.00127; In addition, results for 2019 also included approximately $200 million of revenue from Delta Private Jets, which was combined with Wheels Up in January 2020 and is no longer reflected in ancillary businesses and refinery.; 0
0002.00128; Loyalty Program.; 0
0002.00129; Loyalty program revenues relate primarily to brand usage by third parties and other performance obligations embedded in miles sold, including redemption of miles for non-travel awards.; 0
0002.00130; These revenues are mainly driven by customer spend on American Express cards, which declined at a lower rate than air travel, during the year.Miscellaneous.; 0
0002.00131; Miscellaneous revenue is primarily composed of lounge access and codeshare revenues.; 0
0002.00132; The volume of these transactions has fallen compared to 2019, due to the impact of, and our response to, the COVID-19 pandemic.Delta Air Lines, Inc. 2020 Form 10-K ; 1
0002.00133; ; 0
0002.00134; ; 0
0002.00135; ; 0
0002.00136; ; 0
0002.00137; ; 0
0002.00138; 36 Item 7.; 0
0002.00139; As a result, most operating expense line items decreased significantly in 2020 compared to 2019.; 0
0002.00140; Operating expenses decreased primarily due to the voluntary separation programs and work hour reductions described below, the many cost reduction measures and programs implemented in response to the COVID-19 pandemic and the reduction in volume and selling-related costs.; 1
0002.00141; During 2021, as effective vaccines become broadly available, vaccination becomes widespread globally, travel restrictions and advisories begin to ease and customer confidence begins to grow, we expect operating expense to increase as capacity and revenue return. However, we believe that many of the cost savings achieved during 2020 were structural in nature, which we expect to lead to lower non-fuel unit cost in the future.The discussion below is focused largely on the year-over-year changes in certain operating expense line items that were not primarily driven by the reduction in capacity or revenue.; 0
0002.00142; These include many of the cost reduction measures and programs we implemented in response to the COVID-19 pandemic.Salaries and Related Costs.; 1
0002.00143; The decrease in salaries and related costs is primarily due to actions taken in response to the decreased demand for air travel due to the COVID-19 pandemic.; 1
0002.00144; Beginning in March 2020 and continuing through December 2020, we reduced salaries by 100% for our CEO and 50% for our officers.; 0
0002.00145; In addition, we reduced work hours by 25% for all other management and most front-line employee work groups.; 0
0002.00146; We offered voluntary unpaid leaves of absence for periods ranging from 30 days up to 12 months and approximately 50,000 of our employees elected a leave at various times throughout 2020.; 0
0002.00147; Also, during the September 2020 quarter, approximately 18,000 employees elected to participate in voluntary separation programs, reducing our workforce by approximately 20%.; 0
0002.00148; We expect the lower headcount following these voluntary separation programs to mitigate the impact on salaries and related costs from the restoration of salaries and work hours in 2021, enabling us to maintain lower costs compared to 2019.Delta Air Lines, Inc. 2020 Form 10-K   ; 0
0002.00149; ; 0
0002.00150; ; 0
0002.00151; ; 0
0002.00152; 37 Item 7.; 0
0002.00153; MD&A - Results of OperationsAircraft Fuel and Related Taxes.; 0
0002.00154; Fuel expense decreased $5.3 billion compared to the prior year due to a 51% decrease in capacity and an approximately 25% decrease in the market price per gallon of jet fuel.The table below shows the impact of hedging and the refinery on fuel expense and average price per gallon, adjusted (non-GAAP financial measures):Fuel expense and average price per gallonAverage Price Per GallonYear Ended December 31,Increase(Decrease)Year Ended December 31,Increase (Decrease)(in millions, except per gallon data) (1)2020201920202019Fuel purchase cost (2)$2,938 $8,581 $(5,643)$1.52 $2.04 $(0.52)Fuel hedge impact22 14 8 0.01 — 0.01 Refinery segment impact (3)216 (76)292 0.11 (0.02)0.13 Total fuel expense$3,176 $8,519 $(5,343)$1.64 $2.02 $(0.38)MTM adjustments and settlements on hedges (4)(10)(14)4 (0.01)— (0.01)Delta Private Jets adjustment (5)— (28)28 — (0.01)0.01 Total fuel expense, adjusted$3,166 $8,477 $(5,311)$1.64 $2.01 $(0.37)(1)This reconciliation may not calculate exactly due to rounding.; 1
0002.00155; (2)Market price for jet fuel at airport locations, including related taxes and transportation costs. (3)Refer to Refinery Segment below for additional information about our refinery's operations.; 0
0002.00156; (4)MTM adjustments and settlements on hedges include the effects of the derivative transactions disclosed in Note 6 of the Notes to the Consolidated Financial Statements.; 0
0002.00157; For additional information and the reason for adjusting fuel expense, see Supplemental Information below.; 0
0002.00158; (5)Because we combined Delta Private Jets with Wheels Up in January 2020, we have excluded the impact of Delta Private Jets from 2019 results for comparability.Depreciation and Amortization.; 0
0002.00159; The decrease in depreciation and amortization is primarily due to aircraft that have been retired or impaired during 2020, including the MD-88, MD-90, 717, 737-700, 767-300ER and 777 fleet types, as well as certain A320 aircraft.; 1
0002.00160; Impairments and other charges related to the retirement of these fleets are reflected in restructuring charges.; 0
0002.00161; See Note 2 of the Notes to the Consolidated Financial Statements for additional information about these fleet retirements.Ancillary Businesses and Refinery.; 0
0002.00162; Ancillary businesses and refinery includes expenses associated with refinery sales to third parties, aircraft maintenance services we provide to third parties and our vacation wholesale operations.; 0
0002.00163; Increased expenses were primarily related to refinery sales to third parties, which are at or near cost.; 1
0002.00164; These refinery cost of sales increased $1.1 billion compared to 2019.; 0
0002.00165; Due to the decrease in demand for jet fuel following the onset of the COVID-19 pandemic, the refinery shifted production to more non-jet fuel products, which increased the sales to third parties during 2020 compared to the prior year period.; 1
0002.00166; The increase in refinery costs was partially offset by a decrease of approximately $260 million in the cost of aircraft maintenance services we provide to third parties compared to 2019 due to the reduction in flights operated worldwide.; 1
0002.00167; In addition, approximately $180 million of costs related to services performed by Delta Private Jets in 2019 were recorded in ancillary businesses and refinery prior to the combination of that business with Wheels Up in January 2020.Aircraft Rent.; 0
0002.00168; Most aircraft operating lease expenses are recorded in aircraft rent and are contractually fixed. Therefore, aircraft rent did not decline to the same extent as our other operating expense line items compared to 2019.Restructuring Charges.; 1
0002.00169; Restructuring charges are composed of various expenses that resulted from our response to the unprecedented impact on our business from the COVID-19 pandemic primarily due to fleet impairment and related charges and voluntary separation program charges.; 1
0002.00170; See Note 2 of the Notes to the Consolidated Financial Statements for additional information about these restructuring charges.; 0
0002.00171; Government Grant Recognition.; 0
0002.00172; In April 2020, we entered into an agreement with the U.S. Department of the Treasury to receive emergency support through the CARES Act payroll support program, which totaled $5.6 billion.; 0
0002.00173; The support payments included a grant of $4.0 billion that was fully recognized as a contra-expense in 2020 over the period that the funds were intended to benefit.; 0
0002.00174; We expect to receive approximately $2.9 billion in the March 2021 quarter as part of the payroll support program extension, of which approximately $2.0 billion is expected to be in the form of grants that we plan to recognize as contra-expense during the first half of 2021.; 0
0002.00175; See Note 2 of the Notes to the Consolidated Financial Statements for additional information about government support programs, including the CARES Act. Delta Air Lines, Inc. 2020 Form 10-K ; 0
0002.00176; ; 0
0002.00177; ; 0
0002.00178; ; 0
0002.00179; ; 0
0002.00180; 38Item 7.; 0
0002.00181; Interest expense increased compared to 2019 as a result of the financing arrangements entered into during 2020.; 1
0002.00182; See Note 2 and Note 8 of the Notes to the Consolidated Financial Statements for additional information on recent financings. As a result of the increase in our outstanding debt since the onset of the pandemic, we expect to incur approximately $350 million in quarterly interest expense at the beginning of 2021.; 0
0002.00183; However, we expect to reduce those expenses during 2021 by paying down our debt in addition to scheduled maturities.Impairments and equity method losses.; 0
0002.00184; Impairments and equity method losses reflects our share of LATAM and Grupo Aeroméxico's equity method results prior to their respective bankruptcy filings, our share of Virgin Atlantic's equity method results and the impairments reducing the carrying value of these investments to zero during the June 2020 quarter.; 0
0002.00185; See Note 5 of the Notes to the Consolidated Financial Statements for additional information on our equity investments.Gain/(loss) on investments, net.; 0
0002.00186; Gain/(loss) on investments, net reflects the gains and losses on our equity investments measured at fair value on a recurring basis.; 0
0002.00187; See Note 5 of the Notes to the Consolidated Financial Statements for additional information on our equity investments.Miscellaneous, net.; 0
0002.00188; Miscellaneous, net includes pension and related expense, foreign exchange gains/losses, charitable contributions and gains and losses resulting from other transactions.; 0
0002.00189; Foreign exchange gains/losses vary and impact the comparability of miscellaneous, net from period to period.; 0
0002.00190; The increase in 2020 compared to the prior year is primarily due to the $240 million gain recognized as a result of the combination of Delta Private Jets with Wheels Up in January 2020 and favorable movement in pension and related expense in 2020 compared to 2019.Income TaxesOur effective tax rate for 2020 was 21%. As of December 31, 2020, we had approximately $5.7 billion of U.S. federal pre-tax net operating loss carryforwards, of which $2.0 billion was generated prior to 2018 and will not begin to expire until 2027, and under current tax law, the remaining amount has no expiration.For more information about our income taxes, see Note 13 of the Notes to the Consolidated Financial Statements.; 0
0002.00191; Delta Air Lines, Inc. 2020 Form 10-K ; 0
0002.00192; ; 0
0002.00193; ; 0
0002.00194; ; 0
0002.00195; ; 0
0002.00196; 39Item 7.; 0
0002.00197; MD&A - Refinery SegmentRefinery SegmentThe refinery operated by our subsidiary Monroe Energy, LLC and MIPC, LLC (collectively, Monroe) primarily produces gasoline, diesel and jet fuel.; 0
0002.00198; Monroe has agreements in place to exchange the non-jet fuel products the refinery produces with third parties for jet fuel consumed in our airline operations.; 0
0002.00199; Historically, the jet fuel produced and procured through exchanging gasoline and diesel fuel produced by the refinery provided approximately 200,000 barrels per day, or approximately 75% of our pre-COVID-19 pandemic consumption, for use in our airline operations.; 0
0002.00200; We believe that the jet fuel supply resulting from the refinery's operation generally contributes to reducing the market price of jet fuel and lowers our cost of jet fuel compared to what it otherwise would be.The refinery’s production has also been altered by the dramatic change in economic conditions caused by the COVID-19 pandemic.; 1
0002.00201; During 2020, the refinery operated at 60% – 90% of normal production levels, largely due to the significant decrease in the demand for jet fuel. Additionally, due to the decrease in demand for jet fuel, the refinery has shifted production to produce more non-jet fuel products.; 1
0002.00202; Those non-jet fuel products will continue to be exchanged for jet fuel to the extent that the refinery can balance refinery sales with jet fuel demand.The refinery recorded operating revenues of $3.1 billion in 2020, compared to $5.6 billion in 2019.; 0
0002.00203; As a result of the refinery's shift to producing more non-jet fuel products, operating revenues in 2020 were composed of $1.5 billion of non-jet fuel products exchanged with third parties to procure jet fuel, $1.1 billion of refinery sales to third parties, $307 million of non-jet fuel product sales and $214 million of sales of jet fuel to the airline segment.; 1
0002.00204; Refinery revenues decreased compared to the prior year periods due to lower refinery run rates during the year, as well as lower pricing for refined products.The refinery recorded an operating loss of $216 million in 2020, compared to operating income of $76 million in 2019.; 1
0002.00205; The operating loss in 2020 compared to income in 2019 was mainly driven by an increase in RINs compliance costs discussed below and the reduction in revenue, which was partially offset by cost savings resulting from decreased production levels.A refinery is subject to annual EPA requirements to blend renewable fuels into the gasoline and on-road diesel fuel it produces. Alternatively, a refinery may purchase renewable energy credits, called RINs, from third parties in the secondary market.; 0
0002.00206; The refinery operated by Monroe purchases the majority of its RINs requirement in the secondary market.; 0
0002.00207; Full-time equivalent employees exclude employees of regional carriers that we do not own. (2)Includes the impact of fuel hedge activity and refinery segment results.Delta Air Lines, Inc. 2020 Form 10-K ; 0
0002.00208; ; 0
0002.00209; ; 0
0002.00210; ; 0
0002.00211; ; 0
0002.00212; 40Item 7.; 0
0002.00213; MD&A - Financial Condition and LiquidityFinancial Condition and LiquidityAs a result of the COVID-19 pandemic, we took actions to increase liquidity and strengthen our financial position, which included the following during 2020. We are continuing to monitor and carefully manage our liquidity.; 0
0002.00214; •Completing financing transactions for an aggregate principal amount of approximately $25.9 billion, which are discussed in Financing Activities below.•Receiving $5.6 billion as part of the CARES Act payroll support program as described in Government Support Programs above.; 0
0002.00215; •Reducing planned capital expenditures by approximately $2.8 billion for the year to $1.9 billion, including restructuring our aircraft order books for future aircraft deliveries, delaying aircraft modifications and postponing certain information technology initiatives and ground equipment replacement. See Note 12 of the Notes to the Consolidated Financial Statements for additional information about our aircraft purchase commitments.•Amending our credit facilities to replace fixed charge coverage ratio covenants with liquidity-based covenants.•Suspending share repurchases and dividends indefinitely and postponing voluntary pension funding.As of December 31, 2020, we had $16.7 billion in cash, cash equivalents, short-term investments and aggregate principal amount committed and available to be drawn under our revolving credit facilities.; 0
0002.00216; In addition, in January 2021 we received $1.4 billion with respect to the payroll support program extension described below, with the remaining $1.5 billion expected in the March 2021 quarter.; 0
0002.00217; We expect to meet our liquidity needs for the next twelve months with cash and cash equivalents, short-term investments, financing arrangements, government assistance under the payroll support program, restricted cash equivalents and cash flows from operations.; 0
0002.00218; We expect to meet our long-term liquidity needs with cash flows from operations and financing arrangements.We have unencumbered assets available for potential financing arrangements, if needed.; 0
0002.00219; During 2020, we used existing cash and cash received from financings to fund capital expenditures of $1.9 billion, of which the largest portion was incurred before the onset of the COVID-19 pandemic, and to return $604 million to shareholders also before the onset of the global pandemic.; 0
0002.00220; Capital expenditures in 2020 following the onset of the COVID-19 pandemic were limited to only those critical to our operation.The following discussion of liquidity evaluates various material cash requirements from known contractual and other obligations, but does not include amounts that are contingent on events or other factors that are uncertain or unknown at this time, including legal contingencies, uncertain tax positions and amounts payable under collective bargaining arrangements, among others.; 0
0002.00221; The amounts presented are based on various estimates, including estimates regarding the timing of payments, prevailing interest rates, volumes purchased, the occurrence of certain events and other factors. Accordingly, the actual results may vary materially from the amounts discussed herein.Sources and Uses of LiquidityOperating ActivitiesOperating activities in 2020 used $3.8 billion compared to providing $8.4 billion in 2019.; 0
0002.00222; Including the $2.9 billion in payroll support payments we expect to receive during the March 2021 quarter, if the demand environment evolves as described above we expect to generate positive cash flows from operations during 2021. As described above, we are planning for demand recovery throughout much of 2021, with sustained demand improvement expected during the second half of 2021.Delta Air Lines, Inc. 2020 Form 10-K ; 0
0002.00223; ; 0
0002.00224; ; 0
0002.00225; ; 0
0002.00226; ; 0
0002.00227; 41Item 7.; 0
0002.00228; MD&A - Financial Condition and LiquidityOur operating cash flows are impacted by the following factors:Seasonality of Advance Ticket Sales.; 0
0002.00229; We sell tickets for air travel in advance of the customer's travel date.; 0
0002.00230; When we receive a cash payment at the time of sale, we record the cash received on advance sales as deferred revenue in air traffic liability.; 0
0002.00231; The air traffic liability has historically increased during the winter and spring as advanced ticket sales grow prior to the summer peak travel season and decreased during the summer and fall months.; 1
0002.00232; However, the ongoing reduction in demand for air travel due to the COVID-19 pandemic has resulted in an unprecedented low level of advance bookings and the associated cash received, as well as significant ticket cancellations which led to issuance of cash refunds or travel credits to customers.; 1
0002.00233; The total value of cash refunds, excluding taxes and related fees, issued to customers during 2020 was approximately $3.1 billion.; 0
0002.00234; Travel credits represented approximately 65% of the air traffic liability as of December 31, 2020.; 0
0002.00235; The length and severity of the reduction in travel demand due to the COVID-19 pandemic are uncertain, as described in Item 1A. Risk Factors, but we currently expect three phases in 2021.; 0
0002.00236; We anticipate that the early part of the year will be characterized by fluctuating demand.; 0
0002.00237; With continued distribution of effective vaccines and easing of travel advisories and restrictions, we believe customer confidence will grow, leading to increased demand in the spring and summer of 2021. We expect vaccination to become widespread during the second half of 2021, resulting in sustained demand improvement.Fuel.; 0
0002.00238; Fuel expense represented approximately 11% of our total operating expense for 2020.; 0
0002.00239; The market price for jet fuel is volatile, which can impact the comparability of our periodic cash flows from operations.; 0
0002.00240; We expect fuel consumption to be lower through the March 2021 quarter than the comparable quarter in 2020, as only the final weeks of the March 2020 quarter were significantly impacted by the COVID-19 pandemic.; 0
0002.00241; Through the remainder of 2021, as effective vaccines become broadly available, vaccination becomes widespread globally, travel restrictions and advisories begin to ease and customer confidence begins to grow, we expect capacity to return and fuel consumption to increase compared to the comparable period of 2020, though we still expect it to be lower than the comparable period in 2019.Employee Benefit Obligations. We sponsor defined benefit pension plans for eligible employees and retirees.; 0
0002.00242; These plans are closed to new entrants and are frozen for future benefit accruals.; 0
0002.00243; Our funding obligations for these plans are governed by the Employee Retirement Income Security Act, as modified by the Pension Protection Act of 2006.; 0
0002.00244; We had no minimum funding requirements in 2019 or 2020, we have no such requirements in 2021, and based on our current projections, we do not expect any minimum required contributions until 2025.; 0
0002.00245; However, during 2019, we voluntarily contributed $1 billion to these plans.; 0
0002.00246; As a part of our liquidity initiatives we suspended voluntary pension funding that we were previously planning in 2020.; 0
0002.00247; We plan to contribute at least $500 million to these plans in 2021.; 0
0002.00248; In addition, we have employee benefit obligations relating primarily to projected future benefit payments from our unfunded postretirement and postemployment plans.; 0
0002.00249; See Note 11 of the Notes to the Consolidated Financial Statements for more information on our employee benefit obligations.Voluntary Separation Programs. In 2020, we recorded a $3.4 billion charge associated with voluntary early retirement and separation programs and other employee benefit charges.; 0
0002.00250; Approximately $720 million of this charge was disbursed in cash payments to participants during 2020.; 0
0002.00251; An additional approximately $250 million of cash payments were disbursed in 2020 related to unused vacation and other benefits, which were accrued prior to the voluntary programs charge.; 0
0002.00252; We anticipate that approximately $600 million in cash payments will be made to participants in the voluntary separation programs in 2021 and the remaining payments in 2022 and beyond.Profit Sharing.; 0
0002.00253; Our broad-based employee profit sharing program provides that, for each year in which we have an annual pre-tax profit, as defined by the terms of the program, we will pay a specified portion of that profit to employees.; 0
