Index; Text; Gold
0002.00254; We paid $1.6 billion in profit sharing in February 2020 related to our 2019 pre-tax profit in recognition of our employees' contributions toward meeting our financial goals.; 1
0002.00255; We will not have a profit sharing payment in 2021 based on the pre-tax loss in 2020.Government Support Programs.; 0
0002.00256; See Financing Activities below for discussion of the impact to our liquidity from the government support programs in 2020 and 2021.Contract Carrier Obligations.; 0
0002.00257; We have certain estimated minimum fixed obligations under capacity purchase agreements with third-party regional carriers.; 0
0002.00258; These minimum amounts are based on the required minimum levels of flying by the regional carriers under the respective agreements and assumptions regarding the costs associated with such minimum levels of flying.; 0
0002.00259; As of December 31, 2020 the total of these minimum amounts was $7.7 billion, which range from approximately $800 million to $1.4 billion on an annual basis over the next five years.; 0
0002.00260; See Note 12 of the Notes to the Consolidated Financial Statements for more information on our contract carrier obligations.Delta Air Lines, Inc. 2020 Form 10-K ; 0
0002.00261; ; 0
0002.00262; ; 0
0002.00263; ; 0
0002.00264; ; 0
0002.00265; ; 0
0002.00266; 42Item 7.; 0
0002.00267; MD&A - Financial Condition and LiquidityOperating Lease Obligations.; 0
0002.00268; As described further in Note 9 of the Notes to the Consolidated Financial Statements, as of December 31, 2020 we had a total of $8.6 billion of minimum operating lease obligations.; 0
0002.00269; These minimum lease payments range from approximately $700 million to $900 million on an annual basis over the next five years.Other Obligations.; 0
0002.00270; We have certain purchase obligations under which we are required to make minimum payments for goods and services, including, but not limited to, aviation-related, maintenance, professional security, insurance, marketing, technology, sponsorships and other third-party services and products.; 0
0002.00271; As of December 31, 2020, we had approximately $8.0 billion of such obligations, which range from approximately $400 million to $900 million on an annual basis over the next five years.Investing Activities Short-Term Investments.; 0
0002.00272; Using a portion of the proceeds we obtained through our financing transactions discussed below, in 2020 we acquired a net of $5.8 billion in short-term investments.; 0
0002.00273; See Note 4 of the Notes to the Consolidated Financial Statements for further information on these investments. Capital Expenditures.; 0
0002.00274; Our capital expenditures are primarily related to the purchase of aircraft, fleet modifications and technology enhancements.; 0
0002.00275; Our capital expenditures were $1.9 billion in 2020, of which the largest portion was incurred before the onset of the COVID-19 pandemic, and $4.9 billion in 2019.; 0
0002.00276; In 2020, we restructured our aircraft order books with Airbus and MHI RJ Aviation Group (manufacturer of CRJ aircraft) in an effort to better match the timing of aircraft deliveries with our network and financial needs over the next several years.; 0
0002.00277; The restructuring reduced our aircraft purchase commitments by more than $2 billion in 2020 and by more than $5 billion through 2022.; 0
0002.00278; The shift in delivery timing is intended to allow us to continue simplifying and modernizing our fleet while maintaining our Airbus order book.We expect that we will have capital expenditures of approximately $2.5 billion in 2021 primarily for aircraft, including deliveries and advance deposit payments, as well as aircraft modifications, the majority of which relate to cabin improvements and technology enhancements.; 0
0002.00279; We expect that the capital expenditures in 2021 will be funded through either cash flows from operations or financing arrangements.; 0
0002.00280; We have committed to future aircraft purchases and have obtained, but are under no obligation to use, long-term financing commitments for a substantial portion of the purchase price of the aircraft.; 0
0002.00281; See Note 12 of the Notes to the Consolidated Financial Statements for more information on our aircraft purchase commitments.In connection with a dispute brought at the World Trade Organization against the EU and certain member states to address state subsidies in the large civil aircraft sector, the U.S. Trade Representative has imposed tariffs on certain products imported from the EU, including 15% tariffs on certain new aircraft and certain airplane parts originating in France and Germany.; 0
0002.00282; We are pursuing strategies to minimize the impact, if any, of these tariffs on our business.Equity Investments.; 0
0002.00283; In January 2020, we acquired 20% of the shares of LATAM for $1.9 billion, or $16 per share, through a tender offer. In addition, to support the establishment of our strategic alliance, we agreed to make transition payments to LATAM totaling $350 million, of which $75 million remains to be paid by the end of 2021.As part of our planned strategic alliance with LATAM, we have also assumed 10 of LATAM's A350 purchase commitments with Airbus for deliveries through 2025.; 0
0002.00284; We believe this alliance will generate growth opportunities, building upon Delta's and LATAM's global footprint and joint ventures.During 2020, we acquired through open market transactions, additional outstanding shares of Hanjin-KAL, the largest shareholder of Korean Air, for $158 million.; 0
0002.00285; As of December 31, 2020 our equity ownership interest in Hanjin-KAL was approximately 13%.; 0
0002.00286; See Note 5 of the Notes to the Consolidated Financial Statements for more information on our equity investments.Los Angeles International Airport (LAX) Construction.; 0
0002.00287; We executed a modified lease agreement during 2016 with the City of Los Angeles (the City), which owns and operates LAX, and announced plans to modernize, upgrade and provide post-security connection to Terminals 2 and 3. Construction is underway, which includes a new centralized ticketing and arrival hall, a new security checkpoint, core infrastructure to support the City's planned airport people mover, ramp improvements and a post-security connector to the north side of the Tom Bradley International Terminal.Delta Air Lines, Inc. 2020 Form 10-K ; 0
0002.00288; ; 0
0002.00289; ; 0
0002.00290; ; 0
0002.00291; ; 0
0002.00292; 43Item 7.; 0
0002.00293; MD&A - Financial Condition and LiquidityGiven reduced passenger volumes resulting from the COVID-19 pandemic, we have accelerated the construction schedule for this project.; 0
0002.00294; Additionally, in 2020, we enhanced the project’s scope to include a more customer-friendly design of Terminal 3, a Delta One lounge and expanded Delta Sky Club, and baggage system upgrades designed to increase the terminals’ operational efficiency going forward.; 0
0002.00295; Construction is expected to be completed by 2023. The project is expected to cost approximately $2.3 billion.; 0
0002.00296; A substantial majority of the project costs are being funded through the Regional Airports Improvement Corporation (RAIC), a California public benefit corporation, using an $800 million revolving credit facility provided by a group of lenders.; 0
0002.00297; The credit facility was executed during 2017 and amended in 2020, and we have guaranteed the obligations of the RAIC under the credit facility. Loans made under the credit facility are being repaid with the proceeds from the City’s purchase of completed project assets.; 0
0002.00298; Under the lease agreement and subsequent project component approvals by the City's Board of Airport Commissioners, the City has appropriated to date approximately $1.8 billion to purchase completed project assets, representing the maximum allowable reimbursement by the City.; 0
0002.00299; Costs incurred in excess of the $1.8 billion maximum will not be reimbursed by the City.; 0
0002.00300; We currently expect our net project costs to be approximately $500 million, of which approximately $200 million has been reflected as investing activities in our cash flows statement since the project started in 2017.; 0
0002.00301; In 2020, $315 million was spent on this project, with $293 million paid by the credit facility and $22 million paid directly by Delta.; 0
0002.00302; Approximately $550 million is expected to be spent on the project during 2021, with $445 million to be paid by the credit facility and $105 million to be paid directly by Delta.; 0
0002.00303; New York-LaGuardia Redevelopment.; 0
0002.00304; As part of the terminal redevelopment project at LaGuardia Airport, we are partnering with the Port Authority of New York and New Jersey (Port Authority) to replace Terminals C and D with a new state-of-the-art terminal facility consisting of 37 gates across 4 concourses connected to a central headhouse.; 0
0002.00305; The terminal will feature a new, larger Delta Sky Club, wider concourses, more gate seating and 75% more concessions space than the existing terminals. The facility will also offer direct access between the parking garage and terminal and improved roadways and drop-off/pick-up areas. The design of the new terminal will integrate sustainable technologies and improvements in energy efficiency.; 0
0002.00306; Construction will be phased to limit passenger inconvenience and is expected to be completed by 2026.; 0
0002.00307; In connection with the redevelopment, during 2017, we entered into an amended and restated terminal lease with the Port Authority with a term through 2050.; 0
0002.00308; Pursuant to the lease agreement, as amended to date, we will (1) fund (through debt issuance and existing cash) and undertake the design, management and construction of the terminal and certain off-premises supporting facilities, (2) receive a Port Authority contribution of $481 million to facilitate construction of the terminal and other supporting infrastructure, (3) be responsible for all operations and maintenance during the term of the lease and (4) have preferential rights to all gates in the terminal subject to Port Authority requirements with respect to accommodation of designated carriers.; 0
0002.00309; We currently expect our net project cost to be approximately $3.5 billion and we bear the risks of project construction, including any potential cost over-runs. Using funding primarily provided by existing financing arrangements, we spent approximately $600 million during 2020, bringing the total amount spent on the project to date to approximately $1.5 billion.; 0
0002.00310; We expect to spend approximately $900 million during 2021, of which a substantial majority will be paid using cash restricted for airport construction.; 0
0002.00311; See Note 8 of the Notes to the Consolidated Financial Statements for additional information on the debt related to this redevelopment project, the New York Transportation Development Corporation (NYTDC) Special Facilities Revenue Bonds, Series 2018 and NYTDC Special Facilities Revenue Bonds, Series 2020.In 2019, we opened Concourse G, the first of the four new concourses housing seven of the 37 new gates.; 0
0002.00312; Not only did it deliver the first direct impact to the Delta passenger experience, it also represented the first major phasing milestone.; 0
0002.00313; The next major milestone will be the opening of the headhouse and Concourse E, which is scheduled for 2022.Delta Air Lines, Inc. 2020 Form 10-K ; 0
0002.00314; ; 0
0002.00315; ; 0
0002.00316; ; 0
0002.00317; 44Item 7.; 0
0002.00318; MD&A - Financial Condition and LiquidityFinancing ActivitiesDebt and Finance Leases.; 0
0002.00319; During 2020, we took quick and decisive action to mitigate liquidity risk following the onset of the global pandemic by obtaining approximately $25.9 billion from financing transactions.; 0
0002.00320; A summary of these transactions is listed below. As our liquidity position began to stabilize during 2020, we repaid approximately $5.6 billion of future debt maturities, including $2.6 billion under our revolving credit facilities which had been drawn down in March 2020.; 0
0002.00321; See Note 2, Note 8 and Note 9 of the Notes to the Consolidated Financial Statements for additional information.•Raising $9.0 billion through the issuance of notes and entry into a term loan facility, each secured by certain assets related to our SkyMiles program.•Issuing $3.5 billion of senior secured notes and entering into a $1.5 billion term loan, both of which are secured by certain slots, gates and routes.•Entering into a $3.0 billion 364-day secured term loan facility with an original maturity in March 2021, which was repaid early and terminated in October 2020.•Entering into $2.8 billion of sale-leaseback transactions.; 0
0002.00322; Approximately $2.3 billion of these transactions were treated as financing activities with the remainder treated as investing activities.; 0
0002.00323; See Note 9 of the Notes to the Consolidated Financial Statements for additional information.•Entering into a promissory note for the $1.6 billion CARES Act payroll support program loan.•Entering into loan agreements to borrow $1.5 billion from the NYTDC in connection with NYTDC's issuance of Special Facilities Revenue Bonds, Series 2020, to finance, among other things, a portion of the construction costs for the new terminal facilities at LaGuardia Airport.•Completing $1.7 billion in transactions secured by aircraft, including EETC issuances and aircraft loans.•Issuing $1.3 billion of unsecured notes.In addition, in January 2021 we received $1.4 billion with respect to the payroll support program extension described below, with the remaining $1.5 billion expected in the March 2021 quarter.; 0
0002.00324; The principal amount of our debt and finance leases was $29.4 billion at December 31, 2020.; 0
0002.00325; Future Debt Obligations.; 0
0002.00326; As described further in Note 8 of the Notes to the Consolidated Financial Statements, as of December 31, 2020, scheduled maturities of our debt in 2021 and 2022 were $1.5 billion and $1.9 billion, respectively, with maturities from 2023 through 2025 ranging between $3 billion and $5 billion annually.; 0
0002.00327; As of December 31, 2020, scheduled maturities after 2025 aggregate to $12.5 billion.; 0
0002.00328; In addition, we are obligated to make periodic interest payments at fixed and variable rates, depending on the terms of the applicable debt agreements.; 0
0002.00329; Based on applicable interest rates and scheduled debt maturities as of December 31, 2020, these interest obligations total approximately $7.2 billion and range from approximately $700 million to $1.4 billion on an annual basis over the next five years.; 0
0002.00330; As described further in Note 9 of the Notes to the Consolidated Financial Statements as of December 31, 2020 we had a total of $1.3 billion of minimum finance lease obligations.; 0
0002.00331; These minimum lease payments range from approximately $100 million to $300 million on an annual basis over the next five years.Capital Returns to Shareholders.; 0
0002.00332; In early March 2020, we suspended both our share repurchase program and future dividends due to the impact of the pandemic.; 0
0002.00333; Prior to suspending these activities, in the March 2020 quarter, we repurchased and retired 6 million shares of our common stock at a cost of $344 million and paid a quarterly dividend of $260 million.; 0
0002.00334; The CARES Act payroll support program initially restricted share repurchases and the payment of dividends through September 2021, which have been continued to March 2022 under the terms of the payroll support extension.Delta Air Lines, Inc. 2020 Form 10-K ; 0
0002.00335; ; 0
0002.00336; ; 0
0002.00337; ; 0
0002.00338; 45Item 7.; 0
0002.00339; MD&A - Financial Condition and LiquidityUndrawn Lines of Credit.; 0
0002.00340; As of December 31, 2020 we had approximately $2.6 billion undrawn and available under our revolving credit facilities. In addition, we had outstanding letters of credit as of December 31, 2020, including approximately $300 million that reduced the availability under our revolvers and approximately $300 million that did not affect the availability under our revolvers.; 0
0002.00341; Covenants.; 0
0002.00342; We were in compliance with the covenants in our debt agreements at December 31, 2020.; 0
0002.00343; See Note 8 of the Notes to the Consolidated Financial Statements for more information on the covenants in our debt agreements.Critical Accounting EstimatesOur critical accounting estimates are those estimates made in accordance with GAAP that involve a significant level of estimation uncertainty and have had or are reasonably likely to have a material impact on our consolidated results of operations or financial condition.; 0
0002.00344; Accordingly, the actual results may differ materially from these estimates. For a discussion of our significant accounting policies, see Note 1 of the Notes to the Consolidated Financial Statements, unless otherwise noted below.Loyalty ProgramOur SkyMiles loyalty program generates customer loyalty by rewarding customers with incentives to travel on Delta.; 0
0002.00345; This program allows customers to earn mileage credits (miles) by flying on Delta, Delta Connection and other airlines that participate in the loyalty program. When traveling, customers earn miles based on the passenger's loyalty program status and ticket price.; 0
0002.00346; Customers can also earn miles through participating companies such as credit card companies, hotels, car rental agencies and ridesharing companies.; 0
0002.00347; Miles are redeemable by customers in future periods for air travel on Delta and other participating airlines, membership in our Sky Club and other program awards.; 0
0002.00348; To facilitate transactions with participating companies, we sell miles to non-airline businesses, customers and other airlines.; 0
0002.00349; The loyalty program includes two types of transactions that are considered revenue arrangements with multiple performance obligations (1) passenger ticket sales earning miles and (2) sale of miles to participating companies.; 0
0002.00350; Passenger Ticket Sales Earning Miles.; 0
0002.00351; Passenger ticket sales earning miles provide customers with (1) miles earned and (2) air transportation, which are each considered performance obligations.; 0
0002.00352; We value each performance obligation on a standalone basis.; 0
0002.00353; To value the miles earned, we consider the quantitative value a passenger receives by redeeming miles for a ticket rather than paying cash, which is referred to as equivalent ticket value (ETV).; 0
0002.00354; Our estimate of ETV is adjusted for miles that are not likely to be redeemed (breakage).; 0
0002.00355; We use statistical models to estimate breakage based on historical redemption patterns. A change in assumptions to the redemption activity for miles or the estimated fair value of miles expected to be redeemed could have a material impact on our revenue in the year in which the change occurs and in future years.; 0
0002.00356; We recognize breakage proportionally during the period in which the remaining miles are actually redeemed.; 0
0002.00357; At December 31, 2020, the aggregate deferred revenue balance associated with the SkyMiles program was $7.2 billion.; 0
0002.00358; A hypothetical 10% change in the number of outstanding miles estimated to be redeemed would result in an impact of approximately $60 million on annual revenue recognized.We defer revenue for the miles when earned and recognize loyalty travel awards in passenger revenue as the miles are redeemed and transportation is provided.; 0
0002.00359; We record the air transportation portion of the passenger ticket sales in air traffic liability and recognize passenger revenue when we provide transportation or if the ticket goes unused.; 0
0002.00360; A hypothetical 10% increase in our estimate of the ETV of a mile would decrease annual passenger revenue by approximately $40 million, as a result of an increase in the amount of revenue deferred from the mileage component of passenger ticket sales.Sale of Miles to Participating Companies.; 0
0002.00361; Customers earn miles based on their spending with participating companies such as credit card companies, hotels, car rental agencies and ridesharing companies with which we have marketing agreements to sell miles.; 0
0002.00362; Our contracts to sell miles under these marketing agreements have multiple performance obligations.; 0
0002.00363; Payments are typically due to us monthly based on the volume of miles sold during the period, and the initial terms of our marketing contracts are from three to eleven years.; 0
0002.00364; During the years ended December 31, 2020 and 2019, total cash sales from marketing agreements were $2.8 billion and $4.2 billion, respectively, which are allocated to travel and other performance obligations, as discussed below. Delta Air Lines, Inc. 2020 Form 10-K ; 0
0002.00365; ; 0
0002.00366; ; 0
0002.00367; ; 0
0002.00368; 46Item 7. MD&A - Critical Accounting EstimatesOur most significant contract to sell miles relates to our co-brand credit card relationship with American Express. Our agreements with American Express provide for joint marketing, grant certain benefits to Delta-American Express co-branded credit card holders (cardholders) and American Express Membership Rewards program participants, and allow American Express to market its services or products using our customer database.; 0
0002.00369; Cardholders earn miles for making purchases using co-branded cards, and certain cardholders may also check their first bag for free, are granted discounted access to Delta Sky Club lounges and receive priority boarding and other benefits while traveling on Delta.; 0
0002.00370; Additionally, participants in the American Express Membership Rewards program may exchange their points for miles under the loyalty program.; 0
0002.00371; We sell miles at agreed-upon rates to American Express which are then provided to their customers under the co-brand credit card program and the Membership Rewards program.; 0
0002.00372; Effective January 1, 2019, we amended our co-brand and other agreements with American Express which increased the value we receive and extended the terms to 2029.; 0
0002.00373; The products and services delivered are consistent with previous agreements.; 0
0002.00374; We account for marketing agreements, including those with American Express, by allocating the consideration received to the individual products and services delivered.; 0
0002.00375; We allocate the value based on the relative selling prices of those products and services, which generally consist of award travel, priority boarding, baggage fee waivers, lounge access and the use of our brand. We determine our best estimate of the selling prices by using a discounted cash flow analysis using multiple inputs and assumptions, including (1) the expected number of miles awarded and number of miles redeemed, (2) ETV for the award travel obligation adjusted for breakage, (3) published rates on our website for baggage fees, discounted access to Delta Sky Club lounges and other benefits while traveling on Delta, (4) brand value (using estimated royalties generated from the use of our brand) and (5) volume discounts provided to certain partners.We defer the amount allocated to award travel as part of loyalty program deferred revenue and recognize loyalty travel awards in passenger revenue as the miles are redeemed and transportation is provided.; 0
0002.00376; Revenue allocated to services performed in conjunction with a passenger’s flight, such as baggage fee waivers, is recognized as travel-related services in passenger revenue when the related service is performed.; 0
0002.00377; Revenue allocated to access Delta Sky Club lounges is recognized as miscellaneous in other revenue as access is provided.; 0
0002.00378; Revenue allocated to the remaining performance obligations, primarily brand value, is recorded as loyalty program in other revenue as miles are delivered.; 0
0002.00379; For additional information on our significant accounting policies related to the loyalty program, see Note 3 of the Notes to the Consolidated Financial Statements.Goodwill and Indefinite-Lived Intangible Assets We apply a fair value-based impairment test to the carrying value of goodwill and indefinite-lived intangible assets on an annual basis (as of October 1) and, if certain events or circumstances indicate that an impairment loss may have been incurred, on an interim basis.; 0
0002.00380; We assess the value of our goodwill and indefinite-lived assets under either a qualitative or quantitative approach.; 0
0002.00381; Under a qualitative approach, we consider various market factors, including certain of the key assumptions listed below.; 0
0002.00382; We analyze these factors to determine if events and circumstances have affected the fair value of goodwill and indefinite-lived intangible assets.; 0
0002.00383; If we determine that it is more likely than not that the asset may be impaired, we use the quantitative approach to assess the asset's fair value and the amount of the impairment.; 0
