Index; Text; Gold
0001.00001; ITEM 7.; 0
0001.00002; MANAGEMENT'S DISCUSSION AND ANALYSIS OF FINANCIAL CONDITION AND RESULTS OF OPERATIONSThis section of Form 10-K does not address certain items regarding the year ended December 31, 2018.; 0
0001.00003; Discussion and analysis of 2018 and year-to-year comparisons between 2019 and 2018 not included in this Form 10-K can be found in Item 7.; 0
0001.00004; Management's Discussion and Analysis of our Annual Report on Form 10-K for the year ended December 31, 2019.; 0
0001.00005; The following discussion and analysis of our financial condition and results of operations should be read in conjunction with our audited Consolidated Financial Statements and the related notes and other financial information included elsewhere in this Annual Report on Form 10-K.Impact of the COVID-19 PandemicThe unprecedented, widespread and persistent impact of COVID-19 and the related travel restrictions and social distancing measures implemented throughout the world have significantly reduced demand for air travel.; 0
0001.00006; After initially impacting our service to China beginning in January 2020, the spread of the virus and the resulting global pandemic have significantly affected our entire network.; 0
0001.00007; Beginning in March 2020, large public events were cancelled, governmental authorities began imposing restrictions on non-essential activities, businesses suspended travel and popular leisure destinations temporarily closed to visitors. Certain countries that are key markets for our business have imposed bans on international travelers for specified periods or indefinitely.As a result, demand for travel declined at a rapid pace in the March 2020 quarter and has remained depressed, which has had an unprecedented and materially adverse impact on our results of operations and financial position.; 0
0001.00008; Although demand has improved at a slow pace since that time, it remains significantly below pre-pandemic levels.; 0
0001.00009; The exact timing and pace of the recovery remain uncertain as certain markets have reopened, some of which have since experienced a resurgence of COVID-19 cases, while others, particularly international markets, remain closed or are enforcing extended quarantines for most U.S. residents.; 0
0001.00010; The U.S. and numerous other countries are now also requiring airline passengers to provide negative COVID-19 test results prior to travel into their countries.; 0
0001.00011; Additionally, some states have instituted travel restrictions, advisories or quarantines for travelers from other states within the U.S. We expect the demand environment to remain depressed until effective vaccines become broadly available, vaccination becomes widespread globally and travel restrictions and advisories begin to ease.; 0
0001.00012; Our forecasted expense and liquidity management initiatives may be modified as the demand environment evolves.In response to these developments, we have implemented enhanced measures focusing on the safety of our customers and employees, while at the same time seeking to mitigate the impact on our financial position and operations and to position our business for recovery.Taking Care of our Customers and Employees.; 0
0001.00013; The safety of our customers and employees is our primary focus.; 0
0001.00014; As the COVID-19 pandemic has progressed, we have taken numerous steps to help promote the safety of our customers and employees on the ground and in the air in keeping with current health-expert recommendations, including:•Adopting new cleaning procedures on all flights, including regular disinfectant electrostatic spraying on aircraft and sanitizing high-touch areas like tray tables, entertainment screens, armrests and seat-back pockets.•Taking steps to help employees and customers practice social distancing and promote safety, including:◦Creating a Global Cleanliness Division to ensure a consistently safe and sanitized experience across our facilities and aircraft.◦Beginning in May 2020, requiring all customers and customer-facing employees to wear masks.◦Capping load factors throughout our aircraft and blocking middle seats through at least April 30, 2021.◦Modifying our boarding and deplaning processes, while providing limited food and beverage service that is designed to reduce physical touch points.; 0
0001.00015; ◦Encouraging social distancing throughout all aspects of our operation.◦Implementing significant workforce social distancing and protection measures, including reconfiguring call center spaces to promote social distancing, increasing cleaning and disinfecting of our facilities and encouraging employees to work remotely when possible.•Giving customers flexibility to plan and re-book travel, including extending expiration on certain tickets and travel credits through December 2022, eliminating change fees for domestic tickets and international tickets originating from North America, with the exception of Basic Economy tickets, and waiving change fees for all tickets purchased before March 30, 2021.; 0
0001.00016; Additionally, we are extending 2020 Medallion Status an additional year, rolling Medallion Qualification Miles into 2021 and extending Delta SkyMiles American Express Card benefits and Delta Sky Club memberships.Delta Air Lines, Inc. 2020 Form 10-K ; 0
0001.00017; ; 0
0001.00018; ; 0
0001.00019; ; 0
0001.00020; ; 0
0001.00021; ; 0
0001.00022; 30Item 7.; 0
0001.00023; MD&A - Financial Highlights•Offering pay protection to employees who have tested positive for COVID-19, who must quarantine due to exposure to COVID-19, who are considered being at high-risk for illness from COVID-19 according to the Centers for Disease Control and Prevention (CDC) guidelines and do not have the ability to work remotely.•Offering on-site rapid COVID-19 testing in most locations and making at-home testing available for all U.S.-based employees.; 0
0001.00024; We have also added rapid testing in most U.S. hubs for active flight crews.Capacity Reductions.; 0
0001.00025; Beginning in the second half of March 2020, we experienced a precipitous decrease in demand as COVID-19 spread throughout the world. While we have increased capacity compared to the lowest levels in April 2020, system capacity remains significantly lower than prior to the COVID-19 pandemic.; 0
0001.00026; During 2020, system capacity was reduced approximately 50% compared to 2019, with international capacity reduced by approximately 65% and domestic capacity reduced by approximately 45%.; 0
0001.00027; System capacity for the March 2020 through December 2020 period, excluding the pre-pandemic months of January and February, was reduced by approximately 60%, with international capacity reduced by approximately 75% and domestic capacity reduced by approximately 50%.; 0
0001.00028; For the March 2021 quarter, system capacity is expected to be down approximately 30%-40% compared to the March 2019 quarter.; 0
0001.00029; As a result of reduced demand and lower capacity, we retired 227 aircraft in 2020 and have temporarily parked approximately 125 aircraft as of December 31, 2020.Expense Management.; 1
0001.00030; In response to the reduction in revenue, we have implemented, and will continue to implement, cost saving initiatives, including the following in 2020:•Reducing capacity as described above to align with expected demand, which has resulted in removing from active service approximately 350 aircraft as of December 31, 2020, including certain fleets or aircraft that we have decided to early retire as described below.; 1
0001.00031; •Consolidating our footprint at our airport facilities, including temporarily closing some Delta Sky Clubs.•Avoiding furloughs for our U.S. employees and reducing employee-related costs, through the following: ◦Voluntary unpaid leaves of 30 days to 12 months offered to most employees. Approximately 50,000 of our employees have taken or have elected to take voluntary leaves at various times during 2020 and, for those taking leaves up to 12 months, continuing through 2021.◦Offering employees early retirement and voluntary separation programs, with approximately 18,000 employees electing to participate.; 0
0001.00032; See Note 11 of the Notes to the Consolidated Financial Statements for additional information.◦Reaching an agreement with ALPA that protects our pilots from furlough through April 2022.◦From April 1 through December 31, 2020, salary reductions of 100% for our CEO, 50% for our officers and a 25% reduction in work hours for all other management and most front-line employee work groups.•Delaying or eliminating nearly all other discretionary spending.Balance Sheet, Cash Flow and Liquidity.; 0
0001.00033; Our cash, cash equivalents, short-term investments and aggregate principal amount committed and available to be drawn under our revolving credit facilities (liquidity) as of December 31, 2020 was $16.7 billion as a result of the following actions to increase liquidity and strengthen our financial position during the year ended December 31, 2020:•Completing financing transactions for an aggregate principal amount of approximately $25.9 billion.; 1
0001.00034; •Receiving $5.6 billion as part of the CARES Act payroll support program as described in Government Support Programs below.; 0
0001.00035; •Reducing planned capital expenditures by approximately $2.8 billion for the year to $1.9 billion, including restructuring our aircraft order books for future aircraft deliveries, delaying aircraft modifications and postponing certain information technology initiatives and ground equipment replacement.; 0
0001.00036; See Note 12 of the Notes to the Consolidated Financial Statements for additional information about our aircraft purchase commitments.•Amending our credit facilities to replace fixed charge coverage ratio covenants with liquidity-based covenants.•Suspending share repurchases and dividends indefinitely and postponing voluntary pension funding.In addition, in January 2021 we received $1.4 billion with respect to the payroll support program extension described below, with the remaining $1.5 billion expected in the March 2021 quarter.; 0
0001.00037; In response to the impact that the demand environment has had on our financial condition, our credit rating was downgraded by Standard & Poor's to BB in March 2020 and by Fitch to BB+ in April 2020.; 1
0001.00038; Our credit rating from Moody's remains Baa3. See Financial Condition and Liquidity - Sources and Uses of Liquidity for additional information.Our debt agreements contain various affirmative, negative and financial covenants.; 0
0001.00039; See Note 8 of the Notes to the Consolidated Financial Statements for additional information on these covenants.Delta Air Lines, Inc. 2020 Form 10-K ; 0
0001.00040; ; 0
0001.00041; ; 0
0001.00042; ; 0
0001.00043; 31Item 7.; 0
0001.00044; MD&A - Financial HighlightsGovernment Support ProgramsOn March 27, 2020, the Coronavirus Aid, Relief, and Economic Security Act (CARES Act) was enacted into law.; 0
0001.00045; The CARES Act is a support package intended to assist many aspects of the American economy, including providing the airline industry with up to $25 billion in grants and loans to be used for employee wages, salaries and benefits.; 0
0001.00046; In April 2020, we entered into an agreement with the U.S. Department of the Treasury to receive emergency support through the CARES Act payroll support program, which totaled $5.6 billion.; 0
0001.00047; The support payments were conditioned on our agreement to comply with a variety of conditions, including to refrain from conducting involuntary employee layoffs or furloughs through September 30, 2020.; 0
0001.00048; The support payments consisted of $4.0 billion in a grant and $1.6 billion in an unsecured 10-year low interest loan.; 0
0001.00049; The loan bears interest at an annual rate of 1.00% for the first five years (through April 2025) and the Secured Overnight Financing Rate (SOFR) plus 2.00% in the final five years.; 0
0001.00050; In return, we issued to the U.S. Department of the Treasury warrants to acquire more than 6.7 million shares of Delta common stock, which represented approximately 1% of our outstanding shares.; 0
0001.00051; These warrants have an initial exercise price of $24.39 per share, subject to adjustment in certain cases, and a five-year term.The relative fair value of the warrants issued in 2020 is recorded within stockholder's equity and as a discount reducing the carrying value of the loan which is being amortized as interest expense in our Consolidated Statements of Operations (income statement) over the term of the loan.; 0
0001.00052; The proceeds of the 2020 CARES Act grant were recorded in cash and cash equivalents when received and were recognized as contra-expense in government grant recognition in our income statement over the periods that the funds were intended to compensate.; 0
0001.00053; See Note 8 of the Notes to the Consolidated Financial Statements for further discussion of the unsecured loan and warrants to acquire Delta shares issued under the CARES Act payroll support program.Finally, the CARES Act also provides for deferred payment of the employer portion of social security taxes through the end of 2020, with 50% of the deferred amount due December 31, 2021 and the remaining 50% due December 31, 2022. This provided us with approximately $200 million of additional liquidity during 2020.On December 27, 2020, an additional COVID-19 support bill was enacted into law, which extends the payroll support program of the CARES Act and provides an additional $15 billion in grants and loans to be used for airline employee wages, salaries and benefits.; 1
0001.00054; In January 2021, we entered into a payroll support program extension agreement with the U.S. Department of the Treasury. We expect to receive $2.9 billion in payroll support payments, which must be used exclusively for the payment of employee wages, salaries and benefits and are conditioned on our agreement to refrain from conducting involuntary employee layoffs or furloughs from the date of the extension agreement through March 2021.; 1
0001.00055; Other conditions include prohibitions on share repurchases and dividends through March 2022 and certain limitations on executive compensation until October 2022.; 0
0001.00056; The Department of Transportation also has the authority until March 1, 2022 to require airlines that received payroll support program funds to maintain scheduled air service deemed necessary to any point served by the airline before March 1, 2020.The expected support payments consist of approximately $2.0 billion in grants and $830 million in an unsecured 10-year low interest loan.; 0
0001.00057; We received the first installment of $1.4 billion under the agreement on January 15, 2021 and expect to receive the balance in the March 2021 quarter.; 0
0001.00058; The loan bears interest at an annual rate of 1.00% for the first five years (through January 15, 2026) and the applicable SOFR plus 2.00% in the final five years.; 0
0001.00059; Approximately 70% of the payment received on January 15, 2021 was in the form of a grant, and approximately 30% was in the form of an unsecured loan.; 0
0001.00060; We issued a promissory note for approximately $400 million with respect to the term loan, which will increase to its full principal amount as the balance of payroll support payments is received.; 0
0001.00061; In connection with receipt of these payments, we also expect to issue to the U.S. Department of the Treasury warrants to acquire shares of Delta common stock, which we expect to be approximately 2.1 million shares representing less than 0.5% of our outstanding shares.; 1
0001.00062; Approximately one-half of the expected warrants were issued on January 15, 2021 and the remaining warrants will be issued as the balance of payroll support payments is received.; 0
0001.00063; These warrants have an initial exercise price of $39.73 per share, subject to adjustment in certain cases, and a five-year term.Delta Air Lines, Inc. 2020 Form 10-K ; 0
0001.00064; ; 0
0001.00065; ; 0
0001.00066; ; 0
0001.00067; ; 0
0001.00068; 32Item 7.; 0
0001.00069; MD&A - Financial HighlightsFinancial Highlights - 2020 Compared to 2019Our pre-tax loss for 2020 was $15.6 billion, representing a $21.8 billion decrease compared to the prior year primarily due to the impact of the COVID-19 pandemic on our business which resulted in a 64% decrease in revenue and $8.2 billion of restructuring charges and $2.4 billion in investment impairments and equity method losses.; 1
0001.00070; Pre-tax loss, adjusted (a non-GAAP financial measure) was $9.0 billion, a decrease of $15.2 billion compared to the prior year.; 0
0001.00071; Adjustments for 2020 were primarily related to restructuring charges from fleet retirement decisions, voluntary early retirement and separation programs charges and investment impairments and equity method losses, which were partially offset by recognition of the CARES Act grant.Revenue.; 0
0001.00072; Compared to 2020, our operating revenue decreased $29.9 billion, or 64% due to reduced demand resulting from the COVID-19 pandemic.; 1
0001.00073; Operating Expense.; 0
0001.00074; Total operating expense decreased $10.8 billion, or 27%, compared to the prior year, primarily resulting from lower volume and selling-related expenses including fuel, lower profit sharing, recognition of the CARES Act payroll support program grant and significant cost reduction measures taken across all aspects of our operation in response to the COVID-19 pandemic, partially offset by restructuring charges.; 1
0001.00075; Total operating expense, adjusted (a non-GAAP financial measure) decreased $16.0 billion, or 40% compared to the prior year.; 0
0001.00076; Our total operating cost per available seat mile (CASM) increased 50% to 22.01 cents compared to the prior year, primarily due to the 51% decrease in capacity, which was partially offset by the significant cost reduction measures discussed above.; 1
0001.00077; Non-fuel unit costs (CASM-Ex, a non-GAAP financial measure) increased 43% to 15.61 cents and consolidated CASM, adjusted (a non-GAAP financial measure, which includes aircraft fuel costs) increased 23% to 17.96 cents.Non-Operating Results.; 0
0001.00078; Total non-operating expense was $3.1 billion in 2020, $2.7 billion higher than the prior year primarily resulting from impairments and our proportionate share of equity method losses related to our investments in LATAM, Grupo Aeroméxico and Virgin Atlantic, and higher interest expense as a result of our increased debt balances due to the financing arrangements entered into during 2020.Cash Flow.; 1
0001.00079; Our liquidity at December 31, 2020 was $16.7 billion, a $10.8 billion increase compared to December 31, 2019 as a result of proceeds from loans and debt issuances (including our SkyMiles financing arrangements and aircraft financings), support payments under the CARES Act payroll support program and other liquidity initiatives.; 1
0001.00080; Losses during 2020 resulted in operating activities using $3.8 billion.; 1
0001.00081; During 2020 we incurred $9.2 billion of investing cash outflows, primarily related to the purchase of short-term investments and our tender offer to acquire shares of LATAM in January 2020. These results generated $4.3 billion of negative free cash flow (a non-GAAP financial measure) in 2020 compared to $4.2 billion of free cash flow in 2019.The non-GAAP financial measures pre-tax loss, adjusted, operating expense, adjusted, CASM-Ex, consolidated CASM, adjusted, and free cash flow used above are defined and reconciled in Supplemental Information below.; 1
0001.00082; Delta Air Lines, Inc. 2020 Form 10-K ; 0
0001.00083; ; 0
0001.00084; ; 0
0001.00085; ; 0
0001.00086; ; 0
0001.00087; 33 Item 7.; 0
0001.00088; (2)For additional information on adjustments to TRASM, see Supplemental Information below.Operating RevenueCompared to the year ended December 31, 2019, our operating revenue decreased $29.9 billion, or 64%, due to reduced demand resulting from the COVID-19 pandemic.; 1
0001.00089; The decrease in operating revenue, on a 51% decrease in capacity, generated a 25% decrease in total revenue per available seat mile (TRASM) and a 30% decrease in TRASM, adjusted compared to 2019.; 1
0001.00090; The increase in third-party refinery sales resulted from the refinery's shift to producing more non-jet fuel products due to the decline in demand for jet fuel.; 1
0001.00091; See Refinery Segment below for additional details on the refinery's operations during 2020.We have historically generated cargo revenues in domestic and international markets through the use of cargo space on regularly scheduled passenger aircraft.; 0
0001.00092; In 2020, following the onset of the COVID-19 pandemic, reduced industry capacity drove a significant increase in our cargo yield, and we also generated cargo revenue through the operation of cargo-only charter flights (i.e., using aircraft in our fleet not then being utilized for passenger travel). These two factors contributed to the smaller percentage decline in cargo revenue, than in passenger revenue, compared to the prior year.The length and severity of the reduction in travel demand due to the COVID-19 pandemic are uncertain, as described in Item 1A.; 1
0001.00093; Risk Factors, but we currently expect three phases in 2021.; 0
0001.00094; We anticipate that the early part of the year will be characterized by fluctuating demand.; 0
0001.00095; With continued distribution of effective vaccines and easing of travel advisories and restrictions, we believe customer confidence will grow, leading to increased demand in the spring and summer of 2021.; 0
0001.00096; We expect vaccination to become widespread during the second half of 2021, resulting in sustained demand improvement.Delta Air Lines, Inc. 2020 Form 10-K  ; 0
0001.00097; ; 0
0001.00098; ; 0
0001.00099; ; 0
0001.00100; ; 0
0001.00101; 34 Item 7.; 0
0001.00102; PRASM decreased 38% and passenger mile yield decreased 1% on 51% lower capacity.; 0
0001.00103; Load factor decreased 32 pts from the prior year to 55%.We began waiving changes fees on most tickets during 2020 and subsequently changed our policy with respect to change fees, as described above in Taking Care of our Customers and Employees. We do not expect these policy changes to materially affect our revenue in future periods.; 0
0001.00104; DomesticPrior to the initial effects of the COVID-19 pandemic in March 2020, domestic results were strong with revenue nearly 10% higher than the prior year period.; 0
0001.00105; However, due to the decrease in customer demand beginning in March, passenger unit revenue related to our domestic region decreased 42% with capacity down 43% compared to the prior year.; 1
0001.00106; We are planning for improvement to the demand environment, primarily from leisure customers, to continue in 2021, though still significantly lower than the comparable period in 2019.; 0
0001.00107; We remain optimistic about the ultimate recovery of business travel, but are unable to predict the timing or extent of that recovery. InternationalPassenger revenue related to our international regions decreased 76% compared to the prior year.; 0
0001.00108; The reductions in revenue and capacity presented in the table above were a result of reduced demand and government travel directives and quarantines limiting or suspending air travel due to the global spread of COVID-19.; 1
0001.00109; Additionally, many countries have implemented international testing requirements, which has slowed demand in the short-term but is expected to enhance the long-term recovery of international air travel.; 1
0001.00110; We expect this significantly lower demand environment to continue into 2021, with improvement expected after the recovery in domestic travel.; 0
0001.00111; As an initial step to this recovery, in December 2020 we became the first U.S. airline to offer flights between the U.S. and Europe that allow customers to avoid quarantine upon arrival after testing negative for the virus prior to travel and upon arrival in Amsterdam and Rome.; 0
0001.00112; During 2020 we transferred our U.S.-Tokyo services from Narita to Haneda airport, Tokyo's preferred airport for corporate customers, and continued to develop our network connectivity with our joint venture partner Korean Air at Seoul-Incheon airport.; 0
0001.00113; In each of the international regions we continue to monitor government travel directives and customer demand and will adjust flight schedules accordingly.; 0
0001.00114; Prior to the COVID-19 pandemic, we completed two transactions to further strengthen our international partnerships.; 0
0001.00115; In the Atlantic region, effective January 2020, we combined our separate transatlantic joint venture agreements with Air France-KLM and Virgin Atlantic into a single three-party transatlantic joint venture.; 0
0001.00116; This enhanced joint venture is designed to strengthen collaboration between the three airlines and is expected to provide customers with increased access to destinations across North America, the U.K. and Europe.; 0
0001.00117; In the Latin America region, in January 2020, we completed the tender offer to acquire 20% of the shares of LATAM as part of our plan to create a strategic alliance.; 0
0001.00118; Additionally, in the March 2020 quarter, we started codesharing for certain flights operated by LATAM.; 0
