Index; Text; Gold
0001.00215; If we determine that it is more likely than not that the asset may be impaired, we use the quantitative approach to assess the asset's fair value and the amount of the impairment. Under a quantitative approach, we calculate the fair value of the asset using the key assumptions listed below.When we evaluate goodwill for impairment using a quantitative approach, we estimate the fair value of the reporting unit by considering both market capitalization and projected discounted future cash flows (an income approach).; 0
0001.00216; When we perform a quantitative impairment assessment of our indefinite-lived intangible assets, fair value is estimated based on (1) recent market transactions, where available, (2) the royalty method for the Delta tradename (which assumes hypothetical royalties generated from using our tradename) or (3) projected discounted future cash flows (an income approach).; 0
0001.00217; Key Assumptions.; 0
0001.00218; The key assumptions in our impairment tests include: (1) forecasted revenues, expenses and cash flows, (2) terminal period revenue growth and cash flows, (3) an estimated weighted average cost of capital, (4) assumed discount rates depending on the asset and (5) a tax rate.; 0
0001.00219; These assumptions are consistent with those hypothetical market participants would use. Since we are required to make estimates and assumptions when evaluating goodwill and indefinite-lived intangible assets for impairment, actual transaction amounts may differ materially from these estimates.; 0
0001.00220; In addition, we consider the amount by which the intangible assets' fair values exceeded their respective carrying values in the most recent fair value measurements calculated using a quantitative approach.Changes in certain events and circumstances could result in impairment or a change from indefinite-lived to definite-lived.; 0
0001.00221; Factors which could cause impairment include, but are not limited to, (1) negative trends in our market capitalization, (2) reduced profitability resulting from lower passenger mile yields or higher input costs (primarily related to fuel and employees), (3) lower passenger demand as a result of weakened U.S. and global economies, (4) interruption to our operations due to a prolonged employee strike, terrorist attack, or other reasons, (5) changes to the regulatory environment (e.g., diminished slot restrictions or additional Open Skies agreements), (6) competitive changes by other airlines and (7) strategic changes to our operations leading to diminished utilization of the intangible assets.; 0
0001.00222; We assessed each of the above assumptions in our most recent impairment analyses.; 0
0001.00223; The combination of our most recently completed annual results and our projected revenues, expenses and cash flows more than offset any negative events and circumstances.; 0
0001.00224; The stabilized operating environment for U.S. airlines has led to improved financial results.Goodwill.; 0
0001.00225; Our goodwill balance, which is related to the airline segment, was $9.8 billion at December 31, 2016.; 0
0001.00226; Based upon our qualitative assessment of all relevant factors, including applicable factors noted in Key Assumptions above, we determined that there was no indication that goodwill was impaired.; 0
0001.00227; Identifiable Intangible Assets. Our identifiable intangible assets, which are related to the airline segment, had a net carrying amount of $4.8 billion at December 31, 2016, of which $4.7 billion related to indefinite-lived intangible assets.; 0
0001.00228; Indefinite-lived assets are not amortized and consist primarily of routes, slots, the Delta tradename and assets related to SkyTeam and collaborative arrangements.; 0
0001.00229; Definite-lived assets consist primarily of marketing and maintenance service agreements.; 0
0001.00230; In 2016, we performed qualitative assessments of our indefinite-lived intangible assets other than the Pacific routes and slots asset, including applicable factors noted in Key Assumptions above, and determined that there was no indication that the assets were impaired.; 0
0001.00231; Our qualitative assessments include analyses and weighting of all relevant factors, which impact the fair value of our indefinite-lived intangible assets. This intangible asset is composed of Pacific route authorities and takeoff and landing rights (slots) at capacity-constrained airports in Asia, including Tokyo-Narita airport.; 0
0001.00232; Changes in key inputs and assumptions, including (1) new or enhanced joint ventures or alliances, (2) legislative or regulatory changes, including access to Tokyo's Haneda airport, (3) foreign currency exchange rates, (4) fuel costs and (5) Pacific region profitability, could impact the value of this asset in the future.; 0
0001.00233; We performed a quantitative assessment of our Pacific routes and slots indefinite-lived intangible asset and determined that there was no indication that the asset was impaired as the fair value significantly exceeded the carrying value.Long-Lived AssetsOur flight equipment and other long-lived assets have a recorded value of $24.4 billion at December 31, 2016.; 0
0001.00234; This value is based on various factors, including the assets' estimated useful lives and salvage values.; 0
0001.00235; We review flight equipment and other long-lived assets used in operations for impairment losses when events and circumstances indicate the assets may be impaired.; 0
0001.00236; Factors which could be indicators of impairment include, but are not limited to, (1) a decision to permanently remove flight equipment or other long-lived assets from operations, (2) significant changes in the estimated useful life, (3) significant changes in projected cash flows, (4) permanent and significant declines in fleet fair values and (5) changes to the regulatory environment.; 0
0001.00237; For long-lived assets held for sale, we discontinue depreciation and record impairment losses when the carrying amount of these assets is greater than the fair value less the cost to sell.To determine whether impairments exist for aircraft used in operations, we group assets at the fleet-type level (the lowest level for which there are identifiable cash flows) and then estimate future cash flows based on projections of capacity, passenger mile yield, fuel costs, labor costs and other relevant factors.; 0
0001.00238; If an impairment occurs, the impairment loss recognized is the amount by which the fleet's carrying amount exceeds its estimated fair value. We estimate aircraft fair values using published sources, appraisals and bids received from third parties, as available.Defined Benefit Pension PlansWe sponsor defined benefit pension plans for eligible employees and retirees.; 0
0001.00239; These plans are closed to new entrants and frozen for future benefit accruals.; 0
0001.00240; As of December 31, 2016, the unfunded benefit obligation for these plans recorded on our Consolidated Balance Sheet was $10.6 billion. During 2016, we contributed $1.3 billion to these plans and recorded $251 million of expense in salaries and related costs on our Consolidated Statement of Operations.; 0
0001.00241; In 2017, we estimate we will contribute at least $1.2 billion to these plans, including $700 million of contributions above the minimum funding requirements.; 0
0001.00242; The most critical assumptions impacting our defined benefit pension plan obligations and expenses are the discount rate, the expected long-term rate of return on plan assets and life expectancy.; 0
0001.00243; Weighted Average Discount Rate. We determine our weighted average discount rate on our measurement date primarily by reference to annualized rates earned on high-quality fixed income investments and yield-to-maturity analysis specific to our estimated future benefit payments. We used a weighted average discount rate to value the obligations of 4.20% and 4.57% at December 31, 2016 and 2015, respectively.; 0
0001.00244; Our weighted average discount rate for net periodic pension benefit cost in each of the past three years has varied from the rate selected on our measurement date, ranging from 4.99% to 4.13% between 2014 and 2016.Expected Long-Term Rate of Return. Our expected long-term rate of return on plan assets is based primarily on plan-specific investment studies using historical market return and volatility data.; 0
0001.00245; Modest excess return expectations versus some public market indices are incorporated into the return projections based on the actively managed structure of the investment programs and their records of achieving such returns historically. We also expect to receive a premium for investing in less liquid private markets.; 0
0001.00246; We review our rate of return on plan assets assumptions annually. Our annual investment performance for one particular year does not, by itself, significantly influence our evaluation.; 0
0001.00247; The investment strategy for our defined benefit pension plan assets is to earn a long-term return that meets or exceeds our annualized return target while taking an acceptable level of risk and maintaining sufficient liquidity to pay current benefits and other cash obligations of the plan. This is achieved by investing in a globally diversified mix of public and private equity, fixed income, real assets, hedge funds and other assets and instruments.; 0
0001.00248; Our expected long-term rate of return on assets for net periodic pension benefit cost for the year ended December 31, 2016 was 8.94%.; 0
0001.00249; Changes in life expectancy may significantly change our benefit obligations and future expense.; 0
0001.00250; We use the Society of Actuaries' (SOA) published mortality data, other publicly available information and our own perspective of future longevity to develop our best estimate of life expectancy.; 0
0001.00251; In 2014, the SOA published updated mortality tables for U.S. plans and an updated improvement scale, which both reflected significant improvements in longevity.; 0
0001.00252; Since then, the SOA has published annual updates to their improvement scale.; 0
0001.00253; Each year we consider updates by the SOA in setting our mortality assumptions for purposes of measuring pension and other postretirement and postemployment benefit obligations.; 0
0001.00254; Funding. Our funding obligations for qualified defined benefit plans are governed by the Employee Retirement Income Security Act.; 0
0001.00255; The Pension Protection Act of 2006 allows commercial airlines to elect alternative funding rules (Alternative Funding Rules) for defined benefit plans that are frozen.; 0
0001.00256; We elected the Alternative Funding Rules under which the unfunded liability for a frozen defined benefit plan may be amortized over a fixed 17-year period and is calculated using an 8.85% discount rate.While the Pension Protection Act makes our funding obligations for these plans more predictable, factors outside our control continue to have an impact on the funding requirements.; 0
0001.00257; Estimates of future funding requirements are based on various assumptions and can vary materially from actual funding requirements.; 0
0001.00258; Assumptions include, among other things, the actual and projected market performance of assets, statutory requirements and demographic data for participants.; 0
0001.00259; For additional information, see Note 8 of the Notes to the Consolidated Financial Statements.Recent Accounting StandardsRevenue from Contracts with Customers In May 2014, the Financial Accounting Standards Board (FASB) issued Accounting Standards Update (ASU) No. 2014-09, Revenue from Contracts with Customers (Topic 606).; 0
0001.00260; Under this ASU and subsequently issued amendments, revenue is recognized at the time a good or service is transferred to a customer for the amount of consideration received. Entities may use a full retrospective approach or report the cumulative effect as of the date of adoption. The standard is effective for interim and annual reporting periods beginning after December 15, 2017.; 0
0001.00261; Early adoption of the standard is permitted, but not before December 15, 2016.; 0
0001.00262; We are currently evaluating how the adoption of the revenue recognition standard will impact our Consolidated Financial Statements.; 0
0001.00263; Interpretations are on-going and could have a significant impact on our implementation.; 0
0001.00264; While we currently believe the adoption will have little effect on earnings, the classification of certain transactions within revenues and between revenues and operating expenses may change.; 0
0001.00265; Also, the adoption may increase the rate used to account for frequent flyer miles, which would impact the balance of the frequent flyer liability. We plan to adopt the standard effective January 1, 2018.Leases In February 2016, the FASB issued ASU No.; 0
0001.00266; 2016-02, Leases (Topic 842).; 0
0001.00267; This standard will require all leases with durations greater than twelve months to be recognized on the balance sheet and is effective for interim and annual reporting periods beginning after December 15, 2018, although early adoption is permitted.; 0
0001.00268; We have not completed our assessment, but we believe adoption of this standard will have a significant impact on our Consolidated Balance Sheets.; 0
0001.00269; However, we do not expect the adoption to have a significant impact on the recognition, measurement or presentation of lease expenses within the Consolidated Statements of Operations or the Consolidated Statements of Cash Flows.; 0
0001.00270; Information about our undiscounted future lease payments and the timing of those payments is in Note 7 of the Notes to the Consolidated Financial Statements.; 0
0001.00271; 45Table of ContentsFinancial Instruments In January 2016, the FASB issued ASU No.; 0
0001.00272; 2016-01, Financial Instruments—Overall (Subtopic 825-10). This standard makes several changes, including the elimination of the available-for-sale classification of equity investments, and requires equity investments with readily determinable fair values to be measured at fair value with changes in fair value recognized in net income.; 0
0001.00273; It is effective for interim and annual periods beginning after December 15, 2017.Our investments in the parent companies of Aeroméxico and GOL are currently accounted for as available-for-sale with changes in fair value recognized in other comprehensive income. At the time of adoption, any amounts in accumulated other comprehensive income/(loss) (AOCI) related to equity investments would be reclassified to retained earnings. As of December 31, 2016, a net unrealized loss of $38 million related to these investments was recorded in AOCI on our Consolidated Balance Sheet.; 1
0001.00274; Equity Method InvestmentsIn March 2016, the FASB issued ASU No.; 0
0001.00275; 2016-07, Investments—Equity Method and Joint Ventures (Topic 323). This standard eliminates the requirement that when an existing cost method investment qualifies for use of the equity method, an investor must restate its historical financial statements, as if the equity method had been used since the investment was acquired.; 0
0001.00276; Under the new guidance, at the point an investment qualifies for the equity method, any unrealized gain or loss in AOCI will be recognized in non-operating income/expense.; 0
0001.00277; We adopted this standard during the March 2016 quarter.; 0
0001.00278; Although none of our available-for-sale or cost investments qualified for use of the equity method during 2016, we expect the tender offer for additional capital stock of Grupo Aeroméxico to be completed in the March 2017 quarter, at which point our investment will qualify for the equity method of accounting.; 0
0001.00279; Statement of Cash FlowsIn the second half of 2016, the FASB issued ASU Nos.; 0
0001.00280; 2016-15 and 2016-18 related to the classification of certain cash receipts and cash payments and the presentation of restricted cash within an entity's statement of cash flows, respectively.; 0
0001.00281; These standards are effective for interim and annual reporting periods beginning after December 15, 2017, but early adoption is permitted.; 0
0001.00282; We do not expect these standards to have a material impact on our Consolidated Statements of Cash Flows. Under the U.S. Securities and Exchange Commission rules, non-GAAP financial measures may be considered in addition to results prepared in accordance with GAAP but should not be considered a substitute for or superior to GAAP results.The following table shows a reconciliation of pre-tax income (a GAAP measure) to pre-tax income, adjusted for special items (a non-GAAP financial measure).; 0
0001.00283; We adjust pre-tax income for the following items to determine pre-tax income, adjusted for special items, for the reasons described below:•MTM adjustments and settlements.; 0
0001.00284; MTM adjustments are defined as fair value changes recorded in periods other than the settlement period.; 0
0001.00285; Such fair value changes are not necessarily indicative of the actual settlement value of the underlying hedge in the contract settlement period.; 0
0001.00286; Settlements represent cash received or paid on hedge contracts settled during the period.; 0
0001.00287; These items adjust fuel expense to show the economic impact of hedging, including cash received or paid on hedge contracts during the period.; 0
0001.00288; Adjusting for these items allows investors to better understand and analyze our core operational performance in the periods shown.•Restructuring and other.; 0
0001.00289; Because of the variability in restructuring and other, the adjustment for this item is helpful to investors to analyze our recurring core performance in the periods shown.•Virgin Atlantic MTM adjustments. We record our proportionate share of earnings from our equity investment in Virgin Atlantic in non-operating expense.; 0
0001.00290; We adjust for Virgin Atlantic's MTM adjustments to allow investors to better understand and analyze our core financial performance in the periods shown.; 0
0001.00291; We adjust CASM for the following items to determine CASM-Ex, including profit sharing for the reasons described below:• Aircraft fuel and related taxes.; 0
0001.00292; The volatility in fuel prices impacts the comparability of year-over-year financial performance.; 0
0001.00293; The adjustment for aircraft fuel and related taxes (including our regional carriers) allows investors to better understand and analyze our non-fuel costs and year-over-year financial performance.•Restructuring and other.; 0
0001.00294; Because of the variability in restructuring and other, the adjustment for this item is helpful to investors to analyze our recurring core performance in the periods shown.•Other expenses.; 0
0001.00295; Other expenses include aircraft maintenance and staffing services we provide to third parties, our vacation wholesale operations and refinery cost of sales to third parties.; 0
0001.00296; Because these businesses are not related to the generation of a seat mile, we adjust for the costs related to these sales to provide a more meaningful comparison of the costs of our airline operations to the rest of the airline industry.; 0
0001.00297; We present ROIC as management believes this metric is helpful to investors in assessing our ability to generate returns using its invested capital.; 0
0001.00298; ROIC is operating income, adjusted, divided by adjusted average invested capital.; 0
0001.00299; We adjust operating income for MTM adjustments and settlements and restructuring and other for the same reasons discussed above for pre-tax income.; 0
0001.00300; All adjustments to calculate ROIC are intended to provide a more meaningful comparison of our results to the airline industry and other high-quality industrial companies. Average adjusted net debt is calculated using amounts as of the end of the last five quarters.The following table shows a reconciliation of adjusted net debt. We use adjusted total debt, including aircraft rent and long-term adjusted debt and capital leases, to present estimated financial obligations.; 0
0001.00301; We reduce adjusted total debt by cash, cash equivalents and short-term investments, and hedge margin (receivable) payable, resulting in adjusted net debt, to present the amount of assets needed to satisfy the debt. We believe this metric is helpful to investors in assessing the company’s overall debt profile. We reduce adjusted total debt by the amount of hedge margin (receivable) payable, which reflects cash (posted to) received from counterparties, as we believe this removes the impact of current market volatility on our unsettled hedges and is a better representation of the continued progress we have made on our debt initiatives.; 0
0001.00302; A measure of capacity.; 0
0001.00303; ASMs equal the total number of seats available for transporting passengers during a reporting period multiplied by the total number of miles flown during that period.CASM - (Operating) Cost per Available Seat Mile.; 0
0001.00304; The amount of operating cost incurred per ASM during a reporting period.; 0
0001.00305; CASM is also referred to as unit cost. CASM-Ex, including profit sharing - The amount of operating cost incurred per ASM during a reporting period, adjusted for aircraft fuel and related taxes, restructuring and other and other expenses, including aircraft maintenance and staffing services we provide to third parties, our vacation wholesale operations and refinery cost of sales to third parties.Passenger Load Factor - A measure of utilized available seating capacity calculated by dividing RPMs by ASMs for a reporting period.Passenger Mile Yield or Yield - The amount of passenger revenue earned per RPM during a reporting period.PRASM - Passenger Revenue per ASM.; 0
0001.00306; The amount of passenger revenue earned per ASM during a reporting period. PRASM is also referred to as unit revenue.; 0
0001.00307; RPM - Revenue Passenger Mile. One revenue-paying passenger transported one mile.; 0
0001.00308; RPMs equal the number of revenue passengers during a reporting period multiplied by the number of miles flown by those passengers during that period.; 0
0001.00309; RPMs are also referred to as traffic.; 0
0001.00310; QUANTITATIVE AND QUALITATIVE DISCLOSURES ABOUT MARKET RISKWe have market risk exposure related to aircraft fuel prices, interest rates and foreign currency exchange rates. Market risk is the potential negative impact of adverse changes in these prices or rates on our Consolidated Financial Statements.; 0
0001.00311; In an effort to manage our exposure to these risks, we enter into derivative contracts and may adjust our derivative portfolio as market conditions change.; 0
0001.00312; We expect adjustments to the fair value of financial instruments to result in ongoing volatility in earnings and stockholders' equity.The following sensitivity analyses do not consider the effects of a change in demand for air travel, the economy as a whole or actions we may take to seek to mitigate our exposure to a particular risk.; 0
0001.00313; For these and other reasons, the actual results of changes in these prices or rates may differ materially from the following hypothetical results.Aircraft Fuel Price RiskChanges in aircraft fuel prices materially impact our results of operations. We have recently managed our fuel price risk through a hedging program intended to reduce the financial impact from changes in the price of jet fuel as jet fuel prices are subject to potential volatility.; 0
0001.00314; During the March 2016 quarter, to better participate in the low fuel price environment, we entered into derivatives designed to offset and effectively neutralize our existing airline segment hedge positions. As a result, we locked in the amount of net hedge settlements for the remainder of 2016 and 2017.; 1
0001.00315; During the June 2016 quarter, we early settled $455 million of our airline segment's 2016 positions.; 0
0001.00316; We recognized $366 million of fuel hedge losses during the year ended December 31, 2016.For the year ended December 31, 2016, aircraft fuel and related taxes, including our regional carriers, accounted for $6.0 billion, or 18.3%, of our total operating expense, based on annual consumption of approximately four billion gallons of jet fuel.; 0
0001.00317; Assuming we do not enter into new derivative contracts, we are exposed to changes in the market price of jet fuel. A one cent increase in the cost of jet fuel would result in approximately $40 million of additional annual fuel expense.Interest Rate RiskOur exposure to market risk from adverse changes in interest rates is primarily associated with our long-term debt obligations.; 0
0001.00318; Market risk associated with our fixed and variable rate long-term debt relates to the potential reduction in fair value and negative impact to future earnings, respectively, from an increase in interest rates.; 0
0001.00319; At December 31, 2016, we had $3.4 billion of fixed-rate long-term debt and $3.7 billion of variable-rate long-term debt.; 0
