0001.00136; In addition, net cash from operating activities benefited from higher accounts receivable sold under the Customer Receivables Purchase Agreement and a timing benefit from higher payables due to inventory build to support demand, which is expected to partially reverse in 2021.; inventory build to support demand, which is expected to partially reverse in 2021.; In addition, net cash from operating activities benefited from higher accounts receivable sold under the Customer Receivables Purchase Agreement and a timing benefit from higher payables; ; ; 194; 276; 0; 186; <e2>In addition, net cash from operating activities benefited from higher accounts receivable sold under the Customer Receivables Purchase Agreement and a timing benefit from higher payables</e2> due to <e1>inventory build to support demand, which is expected to partially reverse in 2021.</e1>
0001.00137; The change in net cash was partially offset by higher annual incentive compensation payments in the current year.The change in net cash provided by operating activities from continuing operations for 2019 is primarily due to favorable working capital management as a result of the Company’s continued focus on improving its working capital.; favorable working capital management as a result of the Company’s continued focus on improving its working capital.; The change in net cash was partially offset by higher annual incentive compensation payments in the current year.The change in net cash provided by operating activities from continuing operations for 2019; ; ; 225; 340; 0; 204; <e2>The change in net cash was partially offset by higher annual incentive compensation payments in the current year.The change in net cash provided by operating activities from continuing operations for 2019</e2> is primarily due to <e1>favorable working capital management as a result of the Company’s continued focus on improving its working capital.</e1>
0001.00138; Accounts receivable decreased in 2019 due to better terms compliance as a result of improvements in the Company’s dispute resolution process and accounts receivable sold under the Customer Receivables Purchase Agreement.; better terms compliance as a result of improvements in the Company’s dispute resolution process and accounts receivable sold under the Customer Receivables Purchase Agreement.; Accounts receivable decreased in 2019; ; ; 45; 220; 0; 37; <e2>Accounts receivable decreased in 2019</e2> due to <e1>better terms compliance as a result of improvements in the Company’s dispute resolution process and accounts receivable sold under the Customer Receivables Purchase Agreement.</e1>
0001.00140; Cash Flows from Investing ActivitiesThe change in cash used in investing activities for 2020 was primarily due to higher proceeds from the sale of divested businesses in the prior year, partially offset by lower capital expenditures.; higher proceeds from the sale of divested businesses in the prior year, partially offset by lower capital expenditures.; Cash Flows from Investing ActivitiesThe change in cash used in investing activities for 2020; ; ; 114; 233; 0; 92; <e2>Cash Flows from Investing ActivitiesThe change in cash used in investing activities for 2020</e2> was primarily due to <e1>higher proceeds from the sale of divested businesses in the prior year, partially offset by lower capital expenditures.</e1>
0001.00141.1; The change in cash used in investing activities for 2019 was primarily due to higher proceeds from the sale of divested businesses in 2018, cash received by the Company in 2018 for insurance claims, which include a claim from fire-related losses and settlement of a note receivable related to a legacy Jarden investment, partially offset by lower capital expenditures.Cash Flows from Financing ActivitiesThe change in net cash used in financing activities was primarily due to higher payments of long-term debt in the prior year, as well as current-year proceeds from the issuance of the June 2025 Notes (defined below).; higher proceeds from the sale of divested businesses in 2018, cash received by the Company in 2018 for insurance claims, which include a claim from fire-related losses and settlement of a note receivable related to a legacy Jarden investment, partially offset by lower capital expenditures; The change in cash used in investing activities for 2019; ; ; 78; 367; 0; 56; <e2>The change in cash used in investing activities for 2019</e2> was primarily due to <e1>higher proceeds from the sale of divested businesses in 2018, cash received by the Company in 2018 for insurance claims, which include a claim from fire-related losses and settlement of a note receivable related to a legacy Jarden investment, partially offset by lower capital expenditures</e1>.Cash Flows from Financing ActivitiesThe change in net cash used in financing activities was primarily due to higher payments of long-term debt in the prior year, as well as current-year proceeds from the issuance of the June 2025 Notes (defined below).
0001.00141.2; The change in cash used in investing activities for 2019 was primarily due to higher proceeds from the sale of divested businesses in 2018, cash received by the Company in 2018 for insurance claims, which include a claim from fire-related losses and settlement of a note receivable related to a legacy Jarden investment, partially offset by lower capital expenditures.Cash Flows from Financing ActivitiesThe change in net cash used in financing activities was primarily due to higher payments of long-term debt in the prior year, as well as current-year proceeds from the issuance of the June 2025 Notes (defined below).; higher payments of long-term debt in the prior year, as well as current-year proceeds from the issuance of the June 2025 Notes (defined below).; The change in net cash used in financing activities; ; ; 477; 620; 404; 455; The change in cash used in investing activities for 2019 was primarily due to higher proceeds from the sale of divested businesses in 2018, cash received by the Company in 2018 for insurance claims, which include a claim from fire-related losses and settlement of a note receivable related to a legacy Jarden investment, partially offset by lower capital expenditures.Cash Flows from Financing Activities<e2>The change in net cash used in financing activities</e2> was primarily due to <e1>higher payments of long-term debt in the prior year, as well as current-year proceeds from the issuance of the June 2025 Notes (defined below).</e1>
0001.00143; The change in financing activities for 2019 was primarily due to the year-over-year change in debt (approximately $2.2 billion) and a decrease in shares repurchased (approximately $1.5 billion), partially offset by payments to dissenting shareholders in 2019 (approximately $171 million) in connection with the Jarden acquisition.; the year-over-year change in debt (approximately $2.2 billion) and a decrease in shares repurchased (approximately $1.5 billion), partially offset by payments to dissenting shareholders in 2019 (approximately $171 million) in connection with the Jarden acquisition.; The change in financing activities for 2019; ; ; 65; 330; 0; 43; <e2>The change in financing activities for 2019</e2> was primarily due to <e1>the year-over-year change in debt (approximately $2.2 billion) and a decrease in shares repurchased (approximately $1.5 billion), partially offset by payments to dissenting shareholders in 2019 (approximately $171 million) in connection with the Jarden acquisition.</e1>
0001.00147; As a result of the partial debt extinguishment, the Company recorded an immaterial loss.; As a result of the partial debt extinguishment; the Company recorded an immaterial loss.; ; ; 0; 46; 48; 88; <e1>As a result of the partial debt extinguishment</e1>, <e2>the Company recorded an immaterial loss.</e2>
0001.00153; The Company recorded a loss on extinguishment of debt of $20 million as a result of the partial debt repayment.On January 25, 2021, the Company delivered a notice of redemption to the holders of the 3.150% senior notes that will mature in April 2021 (the “April 2021 Notes”) that the Company will redeem the April 2021 Notes on March 1, 2021 (the “Redemption Date”) for a redemption price equal to 100% of the current outstanding aggregate principal amount of the notes, plus accrued and unpaid interest to the Redemption Date.Under the Company's $1.25 billion Credit Revolver that matures in December 2023, the Company may borrow funds on a variety of interest rate terms.; the partial debt repayment.On January 25, 2021, the Company delivered a notice of redemption to the holders of the 3.150% senior notes that will mature in April 2021 (the “April 2021 Notes”) that the Company will redeem the April 2021 Notes on March 1, 2021 (the “Redemption Date”) for a redemption price equal to 100% of the current outstanding aggregate principal amount of the notes, plus accrued and unpaid interest to the Redemption Date.; The Company recorded a loss on extinguishment of debt of $20 million; ; ; 84; 527; 0; 68; <e2>The Company recorded a loss on extinguishment of debt of $20 million</e2> as a result of <e1>the partial debt repayment.On January 25, 2021, the Company delivered a notice of redemption to the holders of the 3.150% senior notes that will mature in April 2021 (the “April 2021 Notes”) that the Company will redeem the April 2021 Notes on March 1, 2021 (the “Redemption Date”) for a redemption price equal to 100% of the current outstanding aggregate principal amount of the notes, plus accrued and unpaid interest to the Redemption Date.</e1>Under the Company's $1.25 billion Credit Revolver that matures in December 2023, the Company may borrow funds on a variety of interest rate terms.
0001.00155; As a result of the S&P and Moody's downgrades, the Company could no longer borrow from the commercial paper market on terms it deems acceptable or favorable.; As a result of the S&P and Moody's downgrades; the Company could no longer borrow from the commercial paper market on terms it deems acceptable or favorable.; ; ; 0; 45; 47; 157; <e1>As a result of the S&P and Moody's downgrades</e1>, <e2>the Company could no longer borrow from the commercial paper market on terms it deems acceptable or favorable.</e2>
0001.00197; See Footnote 11 of the Notes to Consolidated Financial Statements for further information.At December 31, 2020, the Company had approximately $51 million in standby letters of credit primarily related to the Company’s self-insurance programs, including workers’ compensation, product liability and medical.; the Company’s self-insurance programs, including workers’ compensation, product liability and medical.; See Footnote 11 of the Notes to Consolidated Financial Statements for further information.At December 31, 2020, the Company had approximately $51 million in standby letters of credit; ; ; 204; 306; 0; 182; <e2>See Footnote 11 of the Notes to Consolidated Financial Statements for further information.At December 31, 2020, the Company had approximately $51 million in standby letters of credit</e2> primarily related to <e1>the Company’s self-insurance programs, including workers’ compensation, product liability and medical.</e1>
0001.00235; The impairment reflected a downward revision of forecasted results due to the impact of the delayed and limited re-opening of schools and offices as a result of the COVID-19 global pandemic, as well as the continued deterioration in sales for slime-related adhesive products.; the impact of the delayed and limited re-opening of schools and offices as a result of the COVID-19 global pandemic, as well as the continued deterioration in sales for slime-related adhesive products.; The impairment reflected a downward revision of forecasted results; ; ; 74; 275; 0; 66; <e2>The impairment reflected a downward revision of forecasted results</e2> due to <e1>the impact of the delayed and limited re-opening of schools and offices as a result of the COVID-19 global pandemic, as well as the continued deterioration in sales for slime-related adhesive products.</e1>
