0001.00087; Operating loss was also unfavorably impacted by higher costs associated with lower sales volume in the Home Fragrance business unit and the temporary closure of their key manufacturing facility in Massachusetts, during the first half of 2020, and non-cash impairment charges of $8 million primarily related to operating leases of its Yankee Candle retail store business.; operating leases of its Yankee Candle retail store business.; Operating loss was also unfavorably impacted by higher costs associated with lower sales volume in the Home Fragrance business unit and the temporary closure of their key manufacturing facility in Massachusetts, during the first half of 2020, and non-cash impairment charges of $8 million; ; ; 310; 370; 0; 288; <e2>Operating loss was also unfavorably impacted by higher costs associated with lower sales volume in the Home Fragrance business unit and the temporary closure of their key manufacturing facility in Massachusetts, during the first half of 2020, and non-cash impairment charges of $8 million</e2> primarily related to <e1>operating leases of its Yankee Candle retail store business.</e1>
0001.00089; In addition, the net sales decline also reflected softening trends related to sales of slime-related adhesive products, which is expected to continue in 2021, as well as the exiting of the North American distribution of Uniball® products in the prior year.; softening trends related to sales of slime-related adhesive products, which is expected to continue in 2021, as well as the exiting of the North American distribution of Uniball® products in the prior year.; In addition, the net sales decline; ; ; 50; 256; 0; 34; <e2>In addition, the net sales decline</e2> also reflected <e1>softening trends related to sales of slime-related adhesive products, which is expected to continue in 2021, as well as the exiting of the North American distribution of Uniball® products in the prior year.</e1>
0001.00091; Changes in foreign currency unfavorably impacted net sales by $5 million.32Operating income for 2020 decreased to $362 million as compared to $588 million in the prior year period. During the second half of the year, demand for outdoor products and coolers, primarily in North America and Asia improved, partially offset by decreased demand in apparel and beverage products.; Changes in foreign currency unfavorably impacted net sales by $5 million.32Operating income for 2020 decreased to $362 million as compared to $588 million in the prior year period. During the second half of the year, demand for outdoor products and coolers, primarily in North America and Asia improved, partially offset by decreased demand in apparel and beverage products.Operating income was unfavorably impacted by lower sales as mentioned above, higher costs associated with lower sales volume and certain temporary manufacturing closures, higher non-cash impairment charges and increased costs associated with the COVID-19 global pandemic, partially offset by lower overhead, productivity improvements and discretionary spending, including advertising and promotional costs.Outdoor and Recreation Years Ended December 31,(in millions)20202019$ Change% ChangeNet sales$1,292 $1,413 $(121)(8.6)%Operating loss(418)(64)(354)NMOperating margin(32.4)%(4.5)%Notable items impacting operating loss comparability:Impairment of goodwill and other intangible assets (See Footnote 7)$482 $120 $362 Product recall costs (See Footnote 18)2 20 (18)NM — Not meaningfulOutdoor and Recreation segment net sales for 2020 decreased 9% primarily due to a shift in consumer purchasing patterns, as a result of the ongoing COVID-19 pandemic, which negatively impacted performance during the first half of the year.; Changes in foreign currency unfavorably impacted net sales by $5 million.32Operating income for 2020 decreased to $362 million as compared to $588 million in the prior year period.; 180; ; -1; 1397; 0; 180; <e2>Changes in foreign currency unfavorably impacted net sales by $5 million.32Operating income for 2020 decreased to $362 million as compared to $588 million in the prior year period.</e2> During the second half of the year, demand for outdoor products and coolers, primarily in North America and Asia improved, partially offset by decreased demand in apparel and beverage products.
0001.00092.1; Changes in foreign currency unfavorably impacted net sales by $12 million, or 1%.Operating loss for 2020 was $418 million as compared to $64 million in the prior year period. Changes in foreign currency exchange rates unfavorably impacted net sales by $163 million, or 2%.Gross profit for 2019 decreased 8% and gross profit margin declined to 33.1% in 2019 as compared with 34.6% in 2018. This performance was primarily due to lower net sales, product mix, inflation related to input costs and tariffs.; This performance was primarily due to higher non-cash impairment charges of certain indefinite-lived intangibles assets, lower sales volume as noted above, unfavorable product mix, partially offset by lower overhead costs and lower discretionary spending, including advertising and promotional costs, as well as lower costs associated with a product recall in the prior year, and productivity improvements.33Consolidated Operating Results 2019 vs. 2018 Years Ended December 31,(in millions, except per share data)20192018$ Change% ChangeNet sales$9,715 $10,154 $(439)(4.3)%Gross profit3,219 3,518 (299)(8.5)%Gross margin33.1 %34.6 %Operating loss(482)(7,554)7,072 93.6%Operating margin(5.0)%(74.4)%Interest expense, net303 446 (143)(32.1)%Loss on extinguishment of debt28 4 24 NMOther (income) expense, net39 (12)51 NMLoss before income taxes(852)(7,992)7,140 89.3%Income tax benefit(1,038)(1,359)321 23.6%Income tax rate121.9 %17.0 %Diluted earnings (loss) per share - continuing operations$0.44 $(14.00)Diluted loss per share - discontinued operations(0.19)(0.65)Diluted earnings (loss) per share - attributable to common shareholders$0.25 $(14.65)NM — Not meaningfulNet sales for 2019 decreased 4%, with declines across all segments, primarily within the Appliances and Cookware, Commercial Solutions, and Outdoor and Recreation segments.; Changes in foreign currency unfavorably impacted net sales by $12 million, or 1%.Operating loss for 2020 was $418 million as compared to $64 million in the prior year period.; 174; 388; -1; 1340; 0; 174; <e2>Changes in foreign currency unfavorably impacted net sales by $12 million, or 1%.Operating loss for 2020 was $418 million as compared to $64 million in the prior year period.</e2> Changes in foreign currency exchange rates unfavorably impacted net sales by $163 million, or 2%.Gross profit for 2019 decreased 8% and gross profit margin declined to 33.1% in 2019 as compared with 34.6% in 2018. This performance was primarily due to lower net sales, product mix, inflation related to input costs and tariffs.
0001.00092.2; Changes in foreign currency unfavorably impacted net sales by $12 million, or 1%.Operating loss for 2020 was $418 million as compared to $64 million in the prior year period. Changes in foreign currency exchange rates unfavorably impacted net sales by $163 million, or 2%.Gross profit for 2019 decreased 8% and gross profit margin declined to 33.1% in 2019 as compared with 34.6% in 2018. This performance was primarily due to lower net sales, product mix, inflation related to input costs and tariffs.; This performance was primarily due to lower net sales, product mix, inflation related to input costs and tariffs.; Changes in foreign currency exchange rates unfavorably impacted net sales by $163 million, or 2%.Gross profit for 2019 decreased 8% and gross profit margin declined to 33.1% in 2019 as compared with 34.6% in 2018.; 174; 388; 389; 502; 175; 388; Changes in foreign currency unfavorably impacted net sales by $12 million, or 1%.Operating loss for 2020 was $418 million as compared to $64 million in the prior year period. <e2>Changes in foreign currency exchange rates unfavorably impacted net sales by $163 million, or 2%.Gross profit for 2019 decreased 8% and gross profit margin declined to 33.1% in 2019 as compared with 34.6% in 2018.</e2> <e1>This performance was primarily due to lower net sales, product mix, inflation related to input costs and tariffs.</e1>
0001.00093; Gross profit and margin in 2019 were also unfavorably impacted by a cumulative catch-up adjustment for depreciation expense of $48 million related to the Company’s decision to retain the Commercial Business.; the Company’s decision to retain the Commercial Business.; Gross profit and margin in 2019 were also unfavorably impacted by a cumulative catch-up adjustment for depreciation expense of $48 million; ; ; 150; 207; 0; 138; <e2>Gross profit and margin in 2019 were also unfavorably impacted by a cumulative catch-up adjustment for depreciation expense of $48 million</e2> related to <e1>the Company’s decision to retain the Commercial Business.</e1>
0001.00099; This performance also included overhead reduction driven by various initiatives, lower restructuring and restructuring-related charges in 2019 primarily related to the now completed ATP, and the lapping of a bad debt write off of $26 million from a large customer in the prior year.; the now completed ATP, and the lapping of a bad debt write off of $26 million from a large customer in the prior year.; This performance also included overhead reduction driven by various initiatives, lower restructuring and restructuring-related charges in 2019; ; ; 164; 282; 0; 142; <e2>This performance also included overhead reduction driven by various initiatives, lower restructuring and restructuring-related charges in 2019</e2> primarily related to <e1>the now completed ATP, and the lapping of a bad debt write off of $26 million from a large customer in the prior year.</e1>
0001.00100; These decreases in operating loss and operating margin were partially offset by the cumulative catch-up adjustment for depreciation and amortization expense of $57 million recorded in 2019 as a result of the Company’s decision to retain the Commercial Business.; the Company’s decision to retain the Commercial Business.; These decreases in operating loss and operating margin were partially offset by the cumulative catch-up adjustment for depreciation and amortization expense of $57 million recorded in 2019; ; ; 204; 261; 0; 188; <e2>These decreases in operating loss and operating margin were partially offset by the cumulative catch-up adjustment for depreciation and amortization expense of $57 million recorded in 2019</e2> as a result of <e1>the Company’s decision to retain the Commercial Business.</e1>
0001.00103; Interest expense, net for 2019 decreased primarily due to lower debt levels.; lower debt levels.; Interest expense, net for 2019 decreased; ; ; 58; 76; 0; 40; <e2>Interest expense, net for 2019 decreased</e2> primarily due to <e1>lower debt levels.</e1>
0001.00104; The weighted average interest rates for 2019 and 2018 were approximately 4.4% and 4.2%, respectively.The loss on the extinguishment of debt of $28 million and $4 million for 2019 and 2018, respectively, were related to the Company’s tender offer of certain of its senior notes and debt redemptions.; the Company’s tender offer of certain of its senior notes and debt redemptions.; The weighted average interest rates for 2019 and 2018 were approximately 4.4% and 4.2%, respectively.The loss on the extinguishment of debt of $28 million and $4 million for 2019 and 2018, respectively; ; ; 219; 298; 0; 201; <e2>The weighted average interest rates for 2019 and 2018 were approximately 4.4% and 4.2%, respectively.The loss on the extinguishment of debt of $28 million and $4 million for 2019 and 2018, respectively</e2>, were related to <e1>the Company’s tender offer of certain of its senior notes and debt redemptions.</e1>
0001.00108; The net sales decline in North America was partially offset by sales growth in Latin America primarily due to higher volume.; higher volume.; The net sales decline in North America was partially offset by sales growth in Latin America; ; ; 110; 124; 0; 92; <e2>The net sales decline in North America was partially offset by sales growth in Latin America</e2> primarily due to <e1>higher volume.</e1>
0001.00114; Operating loss included non-cash impairment charges of goodwill and certain indefinite-lived intangible assets of $310 million recorded in 2019 as compared to $410 million of non-cash impairment charges of goodwill and certain indefinite-lived intangible assets recorded in 2018. This decrease in operating loss and operating margin also reflected productivity improvement in 2019 from various initiatives, partially offset by the unfavorable impact of lower sales and inflation.; This decrease in operating loss and operating margin also reflected productivity improvement in 2019 from various initiatives, partially offset by the unfavorable impact of lower sales and inflation.; Operating loss included non-cash impairment charges of goodwill and certain indefinite-lived intangible assets of $310 million recorded in 2019 as compared to $410 million of non-cash impairment charges of goodwill and certain indefinite-lived intangible assets recorded in 2018.; 279; ; 280; 479; 0; 279; <e2>Operating loss included non-cash impairment charges of goodwill and certain indefinite-lived intangible assets of $310 million recorded in 2019 as compared to $410 million of non-cash impairment charges of goodwill and certain indefinite-lived intangible assets recorded in 2018.</e2> <e1>This decrease in operating loss and operating margin also reflected productivity improvement in 2019 from various initiatives, partially offset by the unfavorable impact of lower sales and inflation.</e1>
0001.00115; In addition, operating loss was unfavorably impacted by the cumulative catch-up adjustment for depreciation and amortization expense of $57 million recorded in 2019 as a result of the Company’s decision to retain the Commercial Business.; the Company’s decision to retain the Commercial Business.; In addition, operating loss was unfavorably impacted by the cumulative catch-up adjustment for depreciation and amortization expense of $57 million recorded in 2019; ; ; 180; 237; 0; 164; <e2>In addition, operating loss was unfavorably impacted by the cumulative catch-up adjustment for depreciation and amortization expense of $57 million recorded in 2019</e2> as a result of <e1>the Company’s decision to retain the Commercial Business.</e1>
0001.00117; Net sales declined in the Home Fragrance business unit due to the exit of 75 underperforming Yankee Candle 36retail stores, partially offset by growth in Europe.; the exit of 75 underperforming Yankee Candle 36retail stores, partially offset by growth in Europe.; Net sales declined in the Home Fragrance business unit; ; ; 62; 161; 0; 54; <e2>Net sales declined in the Home Fragrance business unit</e2> due to <e1>the exit of 75 underperforming Yankee Candle 36retail stores, partially offset by growth in Europe.</e1>
0001.00119; Operating loss for 2019 was $17 million as compared to $4.3 billion in 2018. Operating loss included non-cash impairment charges of goodwill and certain indefinite-lived intangible assets of $4.4 billion recorded in 2018. Changes in foreign currency exchange rates unfavorably impacted net sales by $43 million or 1%.; Operating loss for 2019 was $17 million as compared to $4.3 billion in 2018. Operating loss included non-cash impairment charges of goodwill and certain indefinite-lived intangible assets of $4.4 billion recorded in 2018. Changes in foreign currency exchange rates unfavorably impacted net sales by $43 million or 1%.This decrease in operating loss and operating margin was also impacted by lower overhead and advertising and promotional costs.Learning and Development Years Ended December 31,(in millions)20192018$ Change% ChangeNet sales$2,956 $2,982 $(26)(0.9)%Operating income588 238 350 NMOperating margin19.9 %8.0 %Notable items impacting operating income comparability:Impairment of goodwill and other intangible assets (See Footnote 7)$25 $351 $(326)Fire-related losses, net of insurance recoveries— (11)11 Bad debt write off for large customer— 26 (26)NM — Not meaningfulLearning and Development net sales for 2019 decreased 1%.; Operating loss for 2019 was $17 million as compared to $4.3 billion in 2018.; 76; 221; -1; 936; 0; 76; <e2>Operating loss for 2019 was $17 million as compared to $4.3 billion in 2018.</e2> Operating loss included non-cash impairment charges of goodwill and certain indefinite-lived intangible assets of $4.4 billion recorded in 2018. Changes in foreign currency exchange rates unfavorably impacted net sales by $43 million or 1%.
0001.00120.1; The decrease in net sales was also driven by softening trends in the Writing business related to sales of slime-related adhesive products, partially offset by international net sales growth in the Writing business.Operating income increased to $588 million in 2019 as compared to $238 million in 2018. Operating income and operating margins improved primarily due to lower non-cash impairment charges of certain indefinite-lived intangible assets of $25 million recorded in 2019 as compared to $351 million of non-cash impairment charges of goodwill and certain indefinite-lived intangible assets recorded in 2018. Changes in foreign currency exchange rates unfavorably impacted net sales by $23 million, or 2%.; The increase in operating income also included overhead reduction driven by various initiatives in the current year and the lapping of a bad debt write off from a large customer in the prior year, partially offset by higher advertising and promotion costs in the current year and net insurance recoveries from a fire-related loss in the prior year.Outdoor and Recreation Years Ended December 31,(in millions)20192018$ Change% ChangeNet sales$1,413 $1,515 $(102)(6.7)%Operating loss(64)(1,293)1,229 95.1%Operating margin(4.5)%(85.3)%Notable items impacting operating loss comparability:Impairment of goodwill and other intangible assets (See Footnote 7)$120 $1,417 $(1,297)Product recall costs (See Footnote 18)$20 $— $20 Outdoor and Recreation segment net sales for 2019 decreased 7% reflecting lost distribution in certain product categories and unfavorable weather conditions affecting the Coleman business, partially offset by increased sales in airbeds and outdoor cooking categories.; The decrease in net sales was also driven by softening trends in the Writing business related to sales of slime-related adhesive products, partially offset by international net sales growth in the Writing business.Operating income increased to $588 million in 2019 as compared to $238 million in 2018.; 301; 614; -1; 987; 0; 301; <e2>The decrease in net sales was also driven by softening trends in the Writing business related to sales of slime-related adhesive products, partially offset by international net sales growth in the Writing business.Operating income increased to $588 million in 2019 as compared to $238 million in 2018.</e2> Operating income and operating margins improved primarily due to lower non-cash impairment charges of certain indefinite-lived intangible assets of $25 million recorded in 2019 as compared to $351 million of non-cash impairment charges of goodwill and certain indefinite-lived intangible assets recorded in 2018. Changes in foreign currency exchange rates unfavorably impacted net sales by $23 million, or 2%.
0001.00120.2; The decrease in net sales was also driven by softening trends in the Writing business related to sales of slime-related adhesive products, partially offset by international net sales growth in the Writing business.Operating income increased to $588 million in 2019 as compared to $238 million in 2018. Operating income and operating margins improved primarily due to lower non-cash impairment charges of certain indefinite-lived intangible assets of $25 million recorded in 2019 as compared to $351 million of non-cash impairment charges of goodwill and certain indefinite-lived intangible assets recorded in 2018. Changes in foreign currency exchange rates unfavorably impacted net sales by $23 million, or 2%.; lower non-cash impairment charges of certain indefinite-lived intangible assets of $25 million recorded in 2019 as compared to $351 million of non-cash impairment charges of goodwill and certain indefinite-lived intangible assets recorded in 2018.; Operating income and operating margins improved; 301; 614; 367; 614; 302; 349; The decrease in net sales was also driven by softening trends in the Writing business related to sales of slime-related adhesive products, partially offset by international net sales growth in the Writing business.Operating income increased to $588 million in 2019 as compared to $238 million in 2018. <e2>Operating income and operating margins improved</e2> primarily due to <e1>lower non-cash impairment charges of certain indefinite-lived intangible assets of $25 million recorded in 2019 as compared to $351 million of non-cash impairment charges of goodwill and certain indefinite-lived intangible assets recorded in 2018.</e1> Changes in foreign currency exchange rates unfavorably impacted net sales by $23 million, or 2%.
0001.00121; Operating loss decreased to $64 million in 2019 as compared to $1.3 billion in 2018. Operating loss included non-cash impairment charges of goodwill and certain indefinite-lived intangible assets of $120 million recorded in 2019 as compared to $1.4 billion of non-cash impairment charges of certain indefinite-lived intangible assets recorded in 2018. The decrease in operating loss was also due to overhead reduction driven by various initiatives.; The decrease in operating loss was also due to overhead reduction driven by various initiatives.; Operating loss decreased to $64 million in 2019 as compared to $1.3 billion in 2018.; 84; 351; 352; 448; 0; 84; <e2>Operating loss decreased to $64 million in 2019 as compared to $1.3 billion in 2018.</e2> Operating loss included non-cash impairment charges of goodwill and certain indefinite-lived intangible assets of $120 million recorded in 2019 as compared to $1.4 billion of non-cash impairment charges of certain indefinite-lived intangible assets recorded in 2018. <e1>The decrease in operating loss was also due to overhead reduction driven by various initiatives.</e1>
0001.00133; At the time of filing this Annual Report on Form 10-K, the Company is in compliance with all of its financial covenants.In addition, certain of the Company’s Senior Notes aggregating to approximately $4.3 billion in principal amount outstanding are subject to an interest rate adjustment of 25 basis points as a result of the downgrades from S&P and Moody's, for a total of 50 basis points.; the downgrades from S&P and Moody's, for a total of 50 basis points.; At the time of filing this Annual Report on Form 10-K, the Company is in compliance with all of its financial covenants.In addition, certain of the Company’s Senior Notes aggregating to approximately $4.3 billion in principal amount outstanding are subject to an interest rate adjustment of 25 basis points; ; ; 322; 390; 0; 306; <e2>At the time of filing this Annual Report on Form 10-K, the Company is in compliance with all of its financial covenants.In addition, certain of the Company’s Senior Notes aggregating to approximately $4.3 billion in principal amount outstanding are subject to an interest rate adjustment of 25 basis points</e2> as a result of <e1>the downgrades from S&P and Moody's, for a total of 50 basis points.</e1>
0001.00135; The Fitch downgrade did not impact the interest rates on any of the Company's senior notes.Furthermore, the Company may be required to pay a higher interest rate in future financings, and its potential pool of investors and funding sources could decrease as a result of the downgrades.Cash Flows from Operating ActivitiesThe change in net cash provided by operating activities is primarily due to successful working capital initiatives, which included: the extension of payment terms for goods and services with vendors, enhanced customer credit review and collections processes and evaluating supply purchases and focused inventory management.; successful working capital initiatives, which included: the extension of payment terms for goods and services with vendors, enhanced customer credit review and collections processes and evaluating supply purchases and focused inventory management.; The Fitch downgrade did not impact the interest rates on any of the Company's senior notes.Furthermore, the Company may be required to pay a higher interest rate in future financings, and its potential pool of investors and funding sources could decrease as a result of the downgrades.Cash Flows from Operating ActivitiesThe change in net cash provided by operating activities; ; ; 397; 644; 0; 376; <e2>The Fitch downgrade did not impact the interest rates on any of the Company's senior notes.Furthermore, the Company may be required to pay a higher interest rate in future financings, and its potential pool of investors and funding sources could decrease as a result of the downgrades.Cash Flows from Operating ActivitiesThe change in net cash provided by operating activities</e2> is primarily due to <e1>successful working capital initiatives, which included: the extension of payment terms for goods and services with vendors, enhanced customer credit review and collections processes and evaluating supply purchases and focused inventory management.</e1>
