Index; Text; Cause; Effect; Offset_Sentence2; Offset_Sentence3; Cause_Start; Cause_End; Effect_Start; Effect_End; Sentence
0001.00023; During the third quarter, sales improved substantially compared to the second quarter. This was driven by several factors, including an improvement in our merchandise assortments, a 25later back-to-school season, stronger performance in our larger markets, and our return to more normal store hours.; This was driven by several factors, including an improvement in our merchandise assortments, a 25later back-to-school season, stronger performance in our larger markets, and our return to more normal store hours.; During the third quarter, sales improved substantially compared to the second quarter.; 86; ; 87; 299; 0; 86; <e2>During the third quarter, sales improved substantially compared to the second quarter.</e2> <e1>This was driven by several factors, including an improvement in our merchandise assortments, a 25later back-to-school season, stronger performance in our larger markets, and our return to more normal store hours.</e1>
0001.00024; Our fourth quarter sales remained suppressed due to the negative impact from the upsurge in the virus that resulted in reduced customer traffic and more stringent occupancy and store operating hours restrictions.; the negative impact from the upsurge in the virus that resulted in reduced customer traffic and more stringent occupancy and store operating hours restrictions.; Our fourth quarter sales remained suppressed; ; ; 52; 212; 0; 44; <e2>Our fourth quarter sales remained suppressed</e2> due to <e1>the negative impact from the upsurge in the virus that resulted in reduced customer traffic and more stringent occupancy and store operating hours restrictions.</e1>
0001.00030; In the third quarter of fiscal 2020, we refinanced $775 million in aggregate principal amount of higher interest senior notes with the issuance of $1.0 billion in aggregate principal amount of lower interest rate senior notes. This action resulted in a refinancing charge of approximately $240 million in the third quarter, but will significantly reduce our annual interest expense and total cash outlays over the life of the debt.; In the third quarter of fiscal 2020, we refinanced $775 million in aggregate principal amount of higher interest senior notes with the issuance of $1.0 billion in aggregate principal amount of lower interest rate senior notes.; This action resulted in a refinancing charge of approximately $240 million in the third quarter, but will significantly reduce our annual interest expense and total cash outlays over the life of the debt.; 226; ; 0; 226; 227; 431; <e1>In the third quarter of fiscal 2020, we refinanced $775 million in aggregate principal amount of higher interest senior notes with the issuance of $1.0 billion in aggregate principal amount of lower interest rate senior notes.</e1> <e2>This action resulted in a refinancing charge of approximately $240 million in the third quarter, but will significantly reduce our annual interest expense and total cash outlays over the life of the debt.</e2>
0001.00040; Sales for fiscal 2020 decreased $3.5 billion, or 21.9%, compared to the prior year. This was primarily due to the negative impact from store closures during the March 2020 to June 2020 period, the negative impact on customer demand from the COVID-19 pandemic, mandated occupancy restrictions, and reduced store operating hours during the remainder of fiscal 2020.; This was primarily due to the negative impact from store closures during the March 2020 to June 2020 period, the negative impact on customer demand from the COVID-19 pandemic, mandated occupancy restrictions, and reduced store operating hours during the remainder of fiscal 2020.; Sales for fiscal 2020 decreased $3.5 billion, or 21.9%, compared to the prior year.; 83; ; 84; 363; 0; 83; <e2>Sales for fiscal 2020 decreased $3.5 billion, or 21.9%, compared to the prior year.</e2> <e1>This was primarily due to the negative impact from store closures during the March 2020 to June 2020 period, the negative impact on customer demand from the COVID-19 pandemic, mandated occupancy restrictions, and reduced store operating hours during the remainder of fiscal 2020.</e1>
0001.00043; Cost of goods sold in fiscal 2020 decreased $1.7 billion compared to the prior year mainly due to the lower sales from the temporary closure of all store locations (starting on March 20, 2020 through a portion of the second quarter of fiscal 2020), and ensuing negative impact on customer demand from the COVID-19 pandemic after our store reopenings, as well as lower costs from the temporary furlough of most hourly associates in our distribution centers and some associates in our buying offices.; the lower sales from the temporary closure of all store locations (starting on March 20, 2020 through a portion of the second quarter of fiscal 2020), and ensuing negative impact on customer demand from the COVID-19 pandemic after our store reopenings, as well as lower costs from the temporary furlough of most hourly associates in our distribution centers and some associates in our buying offices.; Cost of goods sold in fiscal 2020 decreased $1.7 billion compared to the prior year; ; ; 98; 498; 0; 83; <e2>Cost of goods sold in fiscal 2020 decreased $1.7 billion compared to the prior year</e2> mainly due to <e1>the lower sales from the temporary closure of all store locations (starting on March 20, 2020 through a portion of the second quarter of fiscal 2020), and ensuing negative impact on customer demand from the COVID-19 pandemic after our store reopenings, as well as lower costs from the temporary furlough of most hourly associates in our distribution centers and some associates in our buying offices.</e1>
0001.00045; As we enter 2021, we expect higher supply chain costs from the industry-wide congestion to continue through fiscal 2021, along with higher costs from increases in wages we implemented in the second half of 2020.Cost of goods sold in fiscal 2019 increased $809.9 million compared to the prior year, mainly due to increased sales from the opening of 88 net new stores during the year and a 3% increase in sales from comparable stores.Cost of goods sold as a percentage of sales for fiscal 2019 increased approximately 35 basis points from the prior year, primarily due to a 35 basis point increase in distribution expenses and a 15 basis point increase in freight costs.; increased sales from the opening of 88 net new stores during the year and a 3% increase in sales from comparable stores.; As we enter 2021, we expect higher supply chain costs from the industry-wide congestion to continue through fiscal 2021, along with higher costs from increases in wages we implemented in the second half of 2020.Cost of goods sold in fiscal 2019 increased $809.9 million compared to the prior year; ; ; 312; 432; 0; 296; <e2>As we enter 2021, we expect higher supply chain costs from the industry-wide congestion to continue through fiscal 2021, along with higher costs from increases in wages we implemented in the second half of 2020.Cost of goods sold in fiscal 2019 increased $809.9 million compared to the prior year</e2>, mainly due to <e1>increased sales from the opening of 88 net new stores during the year and a 3% increase in sales from comparable stores.</e1>Cost of goods sold as a percentage of sales for fiscal 2019 increased approximately 35 basis points from the prior year, primarily due to a 35 basis point increase in distribution expenses and a 15 basis point increase in freight costs.
0001.00047; For fiscal 2020, selling, general and administrative expenses (“SG&A”) increased $146.6 million compared to the prior year, primarily due to approximately $240 million in long-term debt refinancing costs, COVID-related expenses (including for supplies, cleaning, and payroll related to additional safety protocols), and payments to associates while our stores were closed (net of employee retention credits under the Coronavirus Aid, Relief, and Economic Security Act (the “CARES Act”)), partially offset by payroll-related cost reduction measures in response to the COVID-19 pandemic (including the temporary furlough of most hourly associates in our stores during closure periods, and some associates in our corporate offices), reductions in non-business critical operating expenses, and lower store operating expenses on lower sales.; approximately $240 million in long-term debt refinancing costs, COVID-related expenses (including for supplies, cleaning, and payroll related to additional safety protocols), and payments to associates while our stores were closed (net of employee retention credits under the Coronavirus Aid, Relief, and Economic Security Act (the “CARES Act”)), partially offset by payroll-related cost reduction measures in response to the COVID-19 pandemic (including the temporary furlough of most hourly associates in our stores during closure periods, and some associates in our corporate offices), reductions in non-business critical operating expenses, and lower store operating expenses on lower sales.; For fiscal 2020, selling, general and administrative expenses (“SG&A”) increased $146.6 million compared to the prior year; ; ; 141; 836; 0; 122; <e2>For fiscal 2020, selling, general and administrative expenses (“SG&A”) increased $146.6 million compared to the prior year</e2>, primarily due to <e1>approximately $240 million in long-term debt refinancing costs, COVID-related expenses (including for supplies, cleaning, and payroll related to additional safety protocols), and payments to associates while our stores were closed (net of employee retention credits under the Coronavirus Aid, Relief, and Economic Security Act (the “CARES Act”)), partially offset by payroll-related cost reduction measures in response to the COVID-19 pandemic (including the temporary furlough of most hourly associates in our stores during closure periods, and some associates in our corporate offices), reductions in non-business critical operating expenses, and lower store operating expenses on lower sales.</e1>
0001.00048; As we enter 2021, we expect our operating costs to continue to reflect ongoing COVID-related expenses and also higher wages.For fiscal 2019, SG&A increased $140.2 million compared to the prior year, mainly due to increased store operating costs reflecting the opening of 88 net new stores during the year.; increased store operating costs reflecting the opening of 88 net new stores during the year.; As we enter 2021, we expect our operating costs to continue to reflect ongoing COVID-related expenses and also higher wages.For fiscal 2019, SG&A increased $140.2 million compared to the prior year; ; ; 213; 305; 0; 197; <e2>As we enter 2021, we expect our operating costs to continue to reflect ongoing COVID-related expenses and also higher wages.For fiscal 2019, SG&A increased $140.2 million compared to the prior year</e2>, mainly due to <e1>increased store operating costs reflecting the opening of 88 net new stores during the year.</e1>
0001.00049; SG&A as a percentage of sales for fiscal 2019 decreased by approximately 10 basis points compared to the prior year primarily due to leverage on higher sales.28Interest expense (income), net.; leverage on higher sales.28Interest expense (income), net.; SG&A as a percentage of sales for fiscal 2019 decreased by approximately 10 basis points compared to the prior year; ; ; 133; 191; 0; 115; <e2>SG&A as a percentage of sales for fiscal 2019 decreased by approximately 10 basis points compared to the prior year</e2> primarily due to <e1>leverage on higher sales.28Interest expense (income), net.</e1>
0001.00050; In fiscal 2020, net interest expense increased by $101.5 million compared to 2019 primarily due to higher interest expense on long-term debt due to the issuance of Senior Notes in April 2020 and October 2020 (net of repurchase of Senior Notes), lower interest income due to lower interest rates, and higher interest expense on short-term debt due to the draw down on our $800 million revolving credit facility in March 2020 (which was subsequently repaid in October 2020), partially offset by higher capitalized interest primarily related to the construction of our Brookshire, Texas distribution center.; higher interest expense on long-term debt due to the issuance of Senior Notes in April 2020 and October 2020 (net of repurchase of Senior Notes), lower interest income due to lower interest rates, and higher interest expense on short-term debt due to the draw down on our $800 million revolving credit facility in March 2020 (which was subsequently repaid in October 2020), partially offset by higher capitalized interest primarily related to the construction of our Brookshire, Texas distribution center.; In fiscal 2020, net interest expense increased by $101.5 million compared to 2019; ; ; 99; 604; 0; 81; <e2>In fiscal 2020, net interest expense increased by $101.5 million compared to 2019</e2> primarily due to <e1>higher interest expense on long-term debt due to the issuance of Senior Notes in April 2020 and October 2020 (net of repurchase of Senior Notes), lower interest income due to lower interest rates, and higher interest expense on short-term debt due to the draw down on our $800 million revolving credit facility in March 2020 (which was subsequently repaid in October 2020), partially offset by higher capitalized interest primarily related to the construction of our Brookshire, Texas distribution center.</e1>
0001.00054; In fiscal 2019, we resolved uncertain tax positions with a state tax authority. As a result, we recognized a tax benefit of approximately $10.0 million in the Consolidated Statement of Earnings.; In fiscal 2019, we resolved uncertain tax positions with a state tax authority.; As a result, we recognized a tax benefit of approximately $10.0 million in the Consolidated Statement of Earnings.; 79; ; 0; 79; 80; 194; <e1>In fiscal 2019, we resolved uncertain tax positions with a state tax authority.</e1> <e2>As a result, we recognized a tax benefit of approximately $10.0 million in the Consolidated Statement of Earnings.</e2>
0001.00055; In fiscal 2018, we resolved uncertain tax positions related to fiscal 2015 with the Internal Revenue Service. As a result, we recognized a tax benefit of approximately $26.0 million in the Consolidated Statement of Earnings.On March 27, 2020, the CARES Act was signed into law.; In fiscal 2018, we resolved uncertain tax positions related to fiscal 2015 with the Internal Revenue Service.; As a result, we recognized a tax benefit of approximately $26.0 million in the Consolidated Statement of Earnings.On March 27, 2020, the CARES Act was signed into law.; 109; ; 0; 109; 110; 277; <e1>In fiscal 2018, we resolved uncertain tax positions related to fiscal 2015 with the Internal Revenue Service.</e1> <e2>As a result, we recognized a tax benefit of approximately $26.0 million in the Consolidated Statement of Earnings.On March 27, 2020, the CARES Act was signed into law.</e2>
0001.00059; Net earnings as a percentage of sales for fiscal 2020 were lower than in fiscal 2019, primarily due to higher cost of goods sold, higher SG&A expenses, and higher interest expense.; higher cost of goods sold, higher SG&A expenses, and higher interest expense.; Net earnings as a percentage of sales for fiscal 2020 were lower than in fiscal 2019; ; ; 103; 180; 0; 84; <e2>Net earnings as a percentage of sales for fiscal 2020 were lower than in fiscal 2019</e2>, primarily due to <e1>higher cost of goods sold, higher SG&A expenses, and higher interest expense.</e1>
0001.00060; Net earnings as a percentage of sales for fiscal 2019 were lower compared to fiscal 2018, primarily due to higher cost of goods sold, partially offset by lower SG&A expenses and higher interest income.Earnings per share.; higher cost of goods sold, partially offset by lower SG&A expenses and higher interest income.; Net earnings as a percentage of sales for fiscal 2019 were lower compared to fiscal 2018; ; ; 107; 201; 0; 88; <e2>Net earnings as a percentage of sales for fiscal 2019 were lower compared to fiscal 2018</e2>, primarily due to <e1>higher cost of goods sold, partially offset by lower SG&A expenses and higher interest income.</e1>Earnings per share.
0001.00061; Diluted earnings per share in fiscal 2020 was $0.24, compared to $4.60 in the prior year. The lower diluted earnings per share in fiscal 2020 was primarily attributable to lower sales due to the closing of all our store locations starting on March 20, 2020 through a portion the second quarter of fiscal 2020 and the negative impact on customer demand from the COVID-19 pandemic, higher markdowns to clear aged and seasonal inventory, long-term debt refinancing costs, payments to associates while our stores were closed (net of employee retention credits under the CARES Act), and higher expenditures for COVID-19 related measures.; The lower diluted earnings per share in fiscal 2020 was primarily attributable to lower sales due to the closing of all our store locations starting on March 20, 2020 through a portion the second quarter of fiscal 2020 and the negative impact on customer demand from the COVID-19 pandemic, higher markdowns to clear aged and seasonal inventory, long-term debt refinancing costs, payments to associates while our stores were closed (net of employee retention credits under the CARES Act), and higher expenditures for COVID-19 related measures.; Diluted earnings per share in fiscal 2020 was $0.24, compared to $4.60 in the prior year.; 89; ; 90; 632; 0; 89; <e2>Diluted earnings per share in fiscal 2020 was $0.24, compared to $4.60 in the prior year.</e2> <e1>The lower diluted earnings per share in fiscal 2020 was primarily attributable to lower sales due to the closing of all our store locations starting on March 20, 2020 through a portion the second quarter of fiscal 2020 and the negative impact on customer demand from the COVID-19 pandemic, higher markdowns to clear aged and seasonal inventory, long-term debt refinancing costs, payments to associates while our stores were closed (net of employee retention credits under the CARES Act), and higher expenditures for COVID-19 related measures.</e1>
0001.00062; Diluted earnings per share in fiscal 2019 was $4.60, which included a per share benefit of approximately $0.02 primarily related to the favorable resolution of a tax matter, compared to $4.26 in the prior year, which included a per share benefit of approximately $0.07 from the favorable resolution of a tax matter.; the favorable resolution of a tax matter, compared to $4.26 in the prior year, which included a per share benefit of approximately $0.07 from the favorable resolution of a tax matter.; Diluted earnings per share in fiscal 2019 was $4.60, which included a per share benefit of approximately $0.02; ; ; 132; 315; 0; 110; <e2>Diluted earnings per share in fiscal 2019 was $4.60, which included a per share benefit of approximately $0.02</e2> primarily related to <e1>the favorable resolution of a tax matter, compared to $4.26 in the prior year, which included a per share benefit of approximately $0.07 from the favorable resolution of a tax matter.</e1>
0001.00069; In the third quarter of fiscal 2020, we refinanced $775 million in aggregate principal amount of higher interest senior notes with the issuance of $1.0 billion in aggregate principal amount of lower interest rate senior notes. This action resulted in a refinancing charge of approximately $240 million in the third quarter, but will significantly reduce our annual interest expense and total cash outlays over the life of the debt.; In the third quarter of fiscal 2020, we refinanced $775 million in aggregate principal amount of higher interest senior notes with the issuance of $1.0 billion in aggregate principal amount of lower interest rate senior notes.; This action resulted in a refinancing charge of approximately $240 million in the third quarter, but will significantly reduce our annual interest expense and total cash outlays over the life of the debt.; 226; ; 0; 226; 227; 431; <e1>In the third quarter of fiscal 2020, we refinanced $775 million in aggregate principal amount of higher interest senior notes with the issuance of $1.0 billion in aggregate principal amount of lower interest rate senior notes.</e1> <e2>This action resulted in a refinancing charge of approximately $240 million in the third quarter, but will significantly reduce our annual interest expense and total cash outlays over the life of the debt.</e2>
0001.00081; This was partially offset by the lower net earnings due to lower sales from the temporary closing of all store locations starting on March 20, 2020 through a portion of the second quarter, and the negative impact on customer demand from the COVID-19 pandemic.; lower sales from the temporary closing of all store locations starting on March 20, 2020 through a portion of the second quarter, and the negative impact on customer demand from the COVID-19 pandemic.; This was partially offset by the lower net earnings; ; ; 59; 259; 0; 51; <e2>This was partially offset by the lower net earnings</e2> due to <e1>lower sales from the temporary closing of all store locations starting on March 20, 2020 through a portion of the second quarter, and the negative impact on customer demand from the COVID-19 pandemic.</e1>
0001.00082; Net cash provided by operating activities was $2.2 billion and $2.1 billion in fiscal 2019 and 2018, respectively, and was primarily driven by net earnings excluding non-cash expenses for depreciation and amortization and for deferred taxes.; net earnings excluding non-cash expenses for depreciation and amortization and for deferred taxes.; Net cash provided by operating activities was $2.2 billion and $2.1 billion in fiscal 2019 and 2018, respectively; ; ; 143; 241; 0; 113; <e2>Net cash provided by operating activities was $2.2 billion and $2.1 billion in fiscal 2019 and 2018, respectively</e2>, and was primarily driven by <e1>net earnings excluding non-cash expenses for depreciation and amortization and for deferred taxes.</e1>
0001.00083; The increase in cash flow from operating activities in fiscal 2020 compared to fiscal 2019 was primarily driven by higher accounts payable leverage.; higher accounts payable leverage.; The increase in cash flow from operating activities in fiscal 2020 compared to fiscal 2019; ; ; 115; 148; 0; 90; <e2>The increase in cash flow from operating activities in fiscal 2020 compared to fiscal 2019</e2> was primarily driven by <e1>higher accounts payable leverage.</e1>
0001.00084; The increase in cash flow from operating activities in fiscal 2019 compared to fiscal 2018 was primarily driven by higher earnings and the timing of merchandise receipts and related payments versus the prior year.; higher earnings and the timing of merchandise receipts and related payments versus the prior year.; The increase in cash flow from operating activities in fiscal 2019 compared to fiscal 2018; ; ; 115; 213; 0; 90; <e2>The increase in cash flow from operating activities in fiscal 2019 compared to fiscal 2018</e2> was primarily driven by <e1>higher earnings and the timing of merchandise receipts and related payments versus the prior year.</e1>
0001.00086; The increase in accounts payable leverage in fiscal 2020 compared to fiscal 2019 was primarily driven by lower packaway and in-store inventory and extended payment terms.; lower packaway and in-store inventory and extended payment terms.; The increase in accounts payable leverage in fiscal 2020 compared to fiscal 2019; ; ; 105; 170; 0; 80; <e2>The increase in accounts payable leverage in fiscal 2020 compared to fiscal 2019</e2> was primarily driven by <e1>lower packaway and in-store inventory and extended payment terms.</e1>
0001.00087; The increase in accounts payable leverage in fiscal 2019 compared to fiscal 2018 was primarily driven by timing of merchandise receipts and related payments versus the prior year.As a regular part of our business, packaway inventory levels will vary over time based on availability of compelling merchandise purchase opportunities in the marketplace and our decisions on the timing for release of that inventory.; timing of merchandise receipts and related payments versus the prior year.; The increase in accounts payable leverage in fiscal 2019 compared to fiscal 2018; ; ; 105; 179; 0; 80; <e2>The increase in accounts payable leverage in fiscal 2019 compared to fiscal 2018</e2> was primarily driven by <e1>timing of merchandise receipts and related payments versus the prior year.</e1>As a regular part of our business, packaway inventory levels will vary over time based on availability of compelling merchandise purchase opportunities in the marketplace and our decisions on the timing for release of that inventory.
0001.00092; The decrease in cash used for investing activities in fiscal 2020 compared to fiscal 2019 was primarily due to a reduction in our capital expenditures.; to a reduction in our capital expenditures.; The decrease in cash used for investing activities in fiscal 2020 compared to fiscal 2019; ; ; 108; 151; 0; 89; <e2>The decrease in cash used for investing activities in fiscal 2020 compared to fiscal 2019</e2> was primarily due <e1>to a reduction in our capital expenditures.</e1>
